title,link,source,published_str,pub_date,doi,last_author,abstract,abstract_source,must_have_abstract
Dynamic attraction of leached metal species enables durable glucose electrooxidation in a strong acid,https://www.nature.com/articles/s41467-026-73501-6,Physical sciences : Nature Communications subject feeds,2026-06-04 00:00:00 UTC,2026-06-04 00:00:00+00:00,,Haohong Duan,"Electrooxidation of organic compounds to produce organic acid in an acidic electrolyte can circumvent product acidification step with high cost in alkaline electrolyte. However, catalysts often suffer from low stability in acid owing to severe leaching. Herein, we report a strategy to dynamically attract leached metal species to stabilize catalyst in a strong acid. In electrooxidation of glucose to formic acid over a lead dioxide (PbO2) catalyst, switching the electrolyte from HClO4 to H2SO4 reduces Pb2+ leaching by up to 30 times. As a result, a 275-hour stable performance at 1 A cm‒2 is achieved in H2SO4 (pH 0.3) using a membrane electrode assembly. Experimental evidence demonstrates that the SO42− ion attracts the leached Pb2+—generated from chemical reduction of PbO2 by glucose—by in-situ forming PbSO4 precipitate on the electrode, which is then oxidized to the active PbO2 phase. Benefiting from acidic electrolysis, we achieve raw cellulose conversion to formic acid without intermediate separation through an acid hydrolysis−electrolysis tandem process. This work demonstrates an efficient strategy to stabilize electrocatalysts that suffer from leaching issues in acidic conditions.",nature_html,0
Device could sniff out fusion reactors secretly making material for a nuclear bomb,https://www.nature.com/articles/d41586-026-01764-6,Nature,2026-06-04 00:00:00 UTC,2026-06-04 00:00:00+00:00,10.1038/d41586-026-01764-6,,Antineutrinos made alongside the production of weapons-grade plutonium could be spotted with existing technology. Antineutrinos made alongside the production of weapons-grade plutonium could be spotted with existing technology.,nature_html,0
Author Correction: Physiology and immunology of a pig-to-human decedent kidney xenotransplant,https://www.nature.com/articles/s41586-026-10694-2,Nature,2026-06-04 00:00:00 UTC,2026-06-04 00:00:00+00:00,10.1038/s41586-026-10694-2,Megan Sykes,,,0
Toward a unified data-driven turbulence model through multi-objective learning,https://academic.oup.com/nsr/advance-article/doi/10.1093/nsr/nwag344/8702617?rss=1,National Science Review Advance Access,2026-06-04 00:00:00 UTC,2026-06-04 00:00:00+00:00,10.1093/nsr/nwag344,Heng Xiao,"Turbulence remains one of the last unresolved problems of classical physics and a major bottleneck to accurate flow prediction in climate, aerospace, and energy systems. Industrial simulations therefore rely on averaged representations of turbulence, which often struggle to predict flows governed by multiple interacting mechanisms. We present a unified, data-driven turbulence modeling framework designed to learn robustly from sparse, indirect observations across diverse flow regimes. The framework embeds physical consistency into a flexible, frame-invariant closure, automatically selects representative training cases based on similarity of flow-feature distributions, and learns a single, unified model through a multi-objective ensemble strategy that balances competing objectives across flows and quantities of interest. The resulting unified foundation model adapts seamlessly across regimes without manual intervention. It outperforms existing turbulence models across a broad spectrum of canonical flows and maintains improved performance in complex three-dimensional configurations of industrial relevance, including a gas turbine diffuser, a generic car, and a generic aircraft. When application-specific accuracy is required, the framework further enables specialist models through additive fine-tuning on targeted flow datasets. The results demonstrate the feasibility of a deployable and generalized turbulence modeling approach that unifies multiple flow mechanisms within a single architecture for a broad range of natural and industrial flows.",rss_oup,0
The emerging antarctic amplification,https://academic.oup.com/nsr/advance-article/doi/10.1093/nsr/nwag343/8702397?rss=1,National Science Review Advance Access,2026-06-04 00:00:00 UTC,2026-06-04 00:00:00+00:00,10.1093/nsr/nwag343,Lei Zhang,"Qigang Wu, JiKai Tian, Qianyi Yu, Shizuo Li, Chang Yang, Aixue Hu, Lei Zhang; The emerging antarctic amplification, National Science Review, , nwag343, htt",openalex,0
Basin uplift and related climate dynamics drive far-field submarine landslides,https://academic.oup.com/nsr/advance-article/doi/10.1093/nsr/nwag342/8702392?rss=1,National Science Review Advance Access,2026-06-04 00:00:00 UTC,2026-06-04 00:00:00+00:00,10.1093/nsr/nwag342,Shucheng Xie,"Submarine landslides can generate catastrophic cascading hazards, including tsunamis. Tectonics and climate have long been hypothesized to influence slope instability, but how they control repeated slope failures over geological time scales is still unclear. In this study from the South China Sea, we find that > 90% of the ∼1,900 m-thick Plio-Quaternary succession consists of repeated submarine landslide deposits, and they onset suddenly at about 5.5 Ma. We demonstrate that uplift of the Red River basin and associated strengthening of the Indian Summer Monsoon drive a regime shift in sediment supply, characterized by a sustained increase that persists to the present, steepening the margin slope and promoting sediment overpressure, thereby triggering widespread mass wasting. This study demonstrates a teleconnection between continental tectonic–climatic changes and submarine landslide activity, thereby advancing our understanding of repeated slope-instability phenomena within a source-to-sink stratigraphic framework and contributing to the reconstruction of Earth’s history.",rss_oup,0
Structure-programmable solid electrolytes for stack-pressure-free all-solid-state micro-batteries,https://academic.oup.com/nsr/advance-article/doi/10.1093/nsr/nwag345/8702391?rss=1,National Science Review Advance Access,2026-06-04 00:00:00 UTC,2026-06-04 00:00:00+00:00,10.1093/nsr/nwag345,Zhong-Shuai Wu,"Structural programming enables the rational construction of solid electrolytes into architected frameworks capable of stress regulation, directional ion transport modulation, and interfacial stabilization, thereby allowing stack-pressure-free operation of all-solid-state microbatteries integrated within microsystems.",crossref,0
Brain-like optical computing: a pathway from edge intelligence to embodied intelligence,https://academic.oup.com/nsr/advance-article/doi/10.1093/nsr/nwag336/8702387?rss=1,National Science Review Advance Access,2026-06-04 00:00:00 UTC,2026-06-04 00:00:00+00:00,10.1093/nsr/nwag336,Min Gu,"Moving beyond matrix-based optics, brain-like optical computing combines photonic memory, learning and event-driven processing for ultralow-latency perception, high-bandwidth interaction and energy-efficient autonomous control across edge and embodied systems.",crossref,0
Interfacial hydrogen-bond network regulation enables selective CO2 reduction to ethanol on copper-free electrocatalysts,https://www.cell.com/chem/fulltext/S2451-9294(26)00144-0?rss=yes,Chem,2026-06-04 00:00:00 UTC,2026-06-04 00:00:00+00:00,10.1016/j.chempr.2026.103078,Tanyuan Wang,"Selective electroreduction of CO2 into ethanol—a storable fuel—has been limited almost exclusively to copper. Herein, a copper-free Ag/Cr2O3 catalyst is designed to produce ethanol with >50% faradaic efficiency at ∼160 mA/cm2 with the assistance of perchlorate. The presence of perchlorate disrupts the continuous hydrogen-bond network, thereby inhibiting the competing hydrogen evolution. The Ag–Cr asymmetric sites further stabilize the C–C coupling intermediates and lower the ethanol pathway barriers over ethylene, thus enabling selective ethanol generation.",rss_cell,0
Ionic thermoelectrics: a soft energy conversion technique,https://academic.oup.com/nsr/advance-article/doi/10.1093/nsr/nwag333/8702384?rss=1,National Science Review Advance Access,2026-06-04 00:00:00 UTC,2026-06-04 00:00:00+00:00,10.1093/nsr/nwag333,Nicholas X Fang,"Weishu Liu, Xiaogang Zhang, Nicholas X Fang; Ionic thermoelectrics: a soft energy conversion technique, National Science Review, , nwag333, https://doi.org",openalex,0
Science with military applications is cited more than civilian-only research,https://www.nature.com/articles/d41586-026-01770-8,Nature,2026-06-04 00:00:00 UTC,2026-06-04 00:00:00+00:00,10.1038/d41586-026-01770-8,Miryam Naddaf,Researchers analysed the scientific impact of dual-use research in US patent records and bibliometric databases. Researchers analysed the scientific impact of dual-use research in US patent records and bibliometric databases.,nature_html,0
What’s behind China’s historically high counts of corresponding authors?,https://www.nature.com/articles/d41586-026-01623-4,Nature,2026-06-04 00:00:00 UTC,2026-06-04 00:00:00+00:00,10.1038/d41586-026-01623-4,Dalmeet Singh Chawla,"From 2016 to 2020, almost one-third of papers by authors in China had multiple corresponding authors — but policy reforms are expected to have dampened the trend. From 2016 to 2020, almost one-third of papers by authors in China had multiple corresponding authors — but policy reforms are expected to have dampened the trend.",nature_html,0
From linear fixes to circular design: how polymer science has changed over the past decade,https://www.nature.com/articles/s41578-026-00933-3,Nature Reviews Materials,2026-06-04 00:00:00 UTC,2026-06-04 00:00:00+00:00,10.1038/s41578-026-00933-3,Katrina M. Knauer,"Over the past decade, polymer science has shifted from precision synthesis to circular economy design. Breakthroughs in recycling, depolymerization and data-driven methods will be instrumental in designing polymers for sustainability within planetary constraints.",nature_html,0
Slab tearing and its surface signals controlled by passive margin strength,https://www.nature.com/articles/s41467-026-73963-8,Earth and environmental sciences : Nature Communications subject feeds,2026-06-04 00:00:00 UTC,2026-06-04 00:00:00+00:00,,Taras Gerya,"Slab tearing, the lateral detachment of subducting oceanic slab from continental lithosphere, is widely inferred from seismic tomography, yet its surface expressions in mountain belts and adjacent foreland basins remain ambiguous and often contradictory. Existing geodynamic models predict that slab tearing propagates at unrealistically high velocities, implying its transient signatures unlikely to be preserved in surface or stratigraphic records. In contrast, geological observations, such as lateral migration of foreland basin depocenters and systematic basin thickening in the direction of tear propagation, indicate more persistent surface responses, highlighting a long-standing disconnect between models and field evidence. Here we resolve this paradox by showing that lateral variations in passive-margin strength fundamentally control the initiation, propagation, and surface imprint of slab tearing. Using fully coupled three-dimensional thermo-mechanical and surface-process simulations, we demonstrate that accounting for passive-margin heterogeneity significantly slows tear propagation and produces long-lived tectonostratigraphic signatures consistent with natural examples from the Alps, Carpathians, Zagros, and other orogenic belts. These results bridge deep-mantle dynamics and surface geological records, providing a unified framework to identify and interpret slab tearing in orogenic systems worldwide.",nature_html,0
Babies’ birth weight improves with help of payments to parents,https://www.nature.com/articles/d41586-026-01765-5,Nature,2026-06-04 00:00:00 UTC,2026-06-04 00:00:00+00:00,10.1038/d41586-026-01765-5,,Interventions that included home visits and cash transfers led to more strapping infants in an Indian state. Interventions that included home visits and cash transfers led to more strapping infants in an Indian state.,nature_html,0
Probing the Hubble Tension with an Infinite-Future Condition on the Hubble Parameter,https://www.sciencedirect.com/science/article/pii/S0370269326004594?dgcid=rss_sd_all,ScienceDirect Publication: Physics Letters B,2026-06-04 00:00:00 UTC,2026-06-04 00:00:00+00:00,,Tong-Jie Zhang,"Publication date: Available online 4 June 2026Source: Physics Letters BAuthor(s): Yuan-Bo Xie, Cheqiu Lyu, Zhiyuan Mo, Wei Hong, Tong-Jie Zhang",rss_description,0
Conversion-driven heterointerface reconfiguration enables fast ion migration in iron disulfide/sulfur-based positive electrodes for aqueous batteries,https://www.nature.com/articles/s41467-026-73910-7,Physical sciences : Nature Communications subject feeds,2026-06-04 00:00:00 UTC,2026-06-04 00:00:00+00:00,,Renzhong Tai,"Establishing stable active sites and molecular-scale bridging architectures at electrode-electrolyte interfaces is essential for advancing fast-charging batteries, yet remains challenging because the principles governing interfacial reaction networks and materials design are not fully understood. In sulfur-based electrodes, irreversible sulfur-cluster dissolution and progressive interfacial degradation severely limit capacity retention and cycling stability. Here we show that reversible dynamic covalent tethering can be constructed at electrified interfaces by coupling hierarchically structured FeS₂ with exogenous sulfur clusters. During the initial full discharge, Cu²⁺ ions are spontaneously reduced and reconstruct the interface to form a Cu₂S/FeS₂ heterostructure, in which interfacial Fe-S-Cu bonds act as ordered covalent bridges. This surface-bound Fe-S-Cu bridging topology reduces interfacial resistance, accelerates charge-transfer kinetics and suppresses metastable phase formation arising from incomplete conversion. Copper ions further function as molecular rivets, preferentially depositing at edge sites and directionally bonding with sulfur atoms to stabilize the FeS₂-hosted sulfur redox system. This dynamic bonding framework preserves the structural coherence of the FeS₂ matrix while immobilizing polysulfide intermediates, enabling more than 68,000 charge-discharge cycles at 100 A g−1. Our findings establish a molecular-level design strategy that links atomic bonding motifs with macroscopic electrochemical functionality.",nature_html,0
Human-induced westerly jet shifts coordinate terrestrial productivity at the hemispheric scale,https://www.nature.com/articles/s41467-026-74039-3,Earth and environmental sciences : Nature Communications subject feeds,2026-06-04 00:00:00 UTC,2026-06-04 00:00:00+00:00,,Deliang Chen,"Previous studies have established how regional climate variability regulates local terrestrial gross primary productivity (GPP), yet the hemispheric-scale spatial organization of GPP, coordinated by large-scale atmospheric circulation, remains poorly understood. Here, using multi-source observations and numerical simulations, we show that anthropogenic shifts in Northern Hemisphere westerlies fundamentally reorganize terrestrial GPP patterns. Around 2000, westerly curvature reversed from a southward to a northward bend over eastern Europe, Northeast Asia, and western North America, while exhibiting opposite changes over central Asia and central North America. Spatial patterns of GPP trends during 1982–2018 closely match GPP responses to westerly curvature variations. Sensitivity analyses using CESM1 large-ensemble simulations and single-forcing experiments identify greenhouse gas forcing as the dominant driver of these changes, thereby reshaping GPP through surface climatic factors. Under the RCP8.5 scenario, continued curvature changes are projected to enhance GPP growth across northern Europe, Northeast Asia, and western North America, while suppressing productivity in southern Europe and central North America. These results reveal anthropogenic forcing influences terrestrial carbon uptake via large-scale atmospheric circulation, with important implications for predicting future carbon–climate feedback.",nature_html,0
Craton-margin lithosphere drives rare earth element ore-forming carbonatite magmatism,https://www.nature.com/articles/s41467-026-73918-z,Earth and environmental sciences : Nature Communications subject feeds,2026-06-04 00:00:00 UTC,2026-06-04 00:00:00+00:00,,Yongsheng Liu,"The majority of light rare earth element (LREE) resources are derived from carbonatite-associated deposits at cratonic margins. However, the origin of ore-forming carbonatite magmas remains unclear. Here, we conducted high pressure-temperature experiments to investigate LREE behavior during carbonate-rich sediment recycling. Results show that, during subduction, the calcic carbonates progressively concentrate LREE, becoming the principal LREE carriers and, upon melting at higher pressures, generate LREE-rich melts. As the melts ascend through cratonic lithospheric mantle, precipitation of extremely LREE-poor magnesite induces further enrichment, producing melts with LREE concentrations up to 156 times those of sedimentary carbonates. These melts are comparable to natural ore-forming carbonatites, highlighting that craton-margin lithosphere drives LREE ore-forming carbonatite magmatism. Our global compilation shows that LREE concentrations in carbonatites positively correlate with the associated deposit tonnage, suggesting that ore-forming carbonatites fundamentally control the deposit reserve magnitude. These findings provide a unified framework for the formation and global distribution of carbonatite-hosted deposits at cratonic margins.",nature_html,0
Implications of regional variations in climate change vulnerability and mitigation behaviour for social-climate dynamics,https://www.nature.com/articles/s41467-026-73874-8,Earth and environmental sciences : Nature Communications subject feeds,2026-06-04 00:00:00 UTC,2026-06-04 00:00:00+00:00,,Madhur Anand,"How regional heterogeneity in social and cultural processes drive–and respond to–climate dynamics is little studied. Here we present a coupled social-climate model stratified across five world regions and parameterised with geophysical, economic and social survey data. We find that support for mitigation evolves in a highly variable fashion across regions, according to socio-economics, climate vulnerability, and feedback from changing temperatures. Social learning and social norms can amplify existing sentiment about mitigation, leading to better or worse global warming outcomes depending on the region. Moreover, mitigation in one region, as mediated by temperature dynamics, can influence other regions to act, or just sit back, thus driving cross-regional heterogeneity in mitigation opinions. Under high emissions scenarios, the peak temperature anomaly varies by several degrees Celsius depending on how these interactions unfold. Our model exemplifies an exploratory framework for studying how global geophysical processes interact with population-scale concerns to determine future sustainability outcomes.",nature_html,0
Agricultural fungicides shape soil and sediment reservoirs of multidrug-resistant fungi,https://www.nature.com/articles/s41467-026-73958-5,Earth and environmental sciences : Nature Communications subject feeds,2026-06-04 00:00:00 UTC,2026-06-04 00:00:00+00:00,,Xinlei Li,"Fungicide resistance in environmental fungi represents a growing One Health challenge, yet its ecological extent and clinical relevance remain poorly studied. Here, we integrate residue monitoring, community profiling, large-scale culture isolation, and mechanistic assays to investigate the resistance of fungi in agricultural soils and adjacent river sediments. The results indicate that fungicides are widely detected in environmental samples and pose substantial ecological risks, particularly carbendazim and tebuconazole. Resistant fungi are also widespread and account for a large proportion of the genera detected in fungal communities. Among >3,900 resistant isolates, we recover 358 multidrug-resistant (MDR) strains showing cross-resistance to multiple agricultural fungicides. Transcriptomic, qPCR, and molecular docking analyses suggest that environmental MDR phenotypes arise from synergistic effects of target-gene alterations, efflux pump overexpression, and adaptive stress responses. Notably, triazole exposure coordinately upregulates virulence genes and mycotoxin biosynthetic clusters, indicating transcriptional activation of genes associated with virulence and secondary metabolism. Together, these findings highlight agricultural landscapes as reservoirs of fungicide-resistant fungi and underscore the need to re-evaluate fungicide practices to protect crop health, ecosystem stability, and the effectiveness of clinical antifungals.",nature_html,0
Carbon mesopore depth engineering boosts the performance of low-platinum fuel cells,https://www.nature.com/articles/s41467-026-73971-8,Physical sciences : Nature Communications subject feeds,2026-06-04 00:00:00 UTC,2026-06-04 00:00:00+00:00,,Hai-Wei Liang,"Ionomer adsorption-induced Pt poisoning and high local oxygen transport resistance constitute two critical challenges preventing proton exchange membrane fuel cells from achieving low-Pt loadings. Yet, strategies concurrently mitigating both issues remain limited, making it challenging to achieve satisfactory performance in both kinetically controlled low-current-density and mass transport-controlled high-current-density regions. Herein, we show that this limitation can be addressed with a mesoporous carbon support design whose key lies in constructing a small mesopore-dominated structure while rationally controlling pore depth to a medium level. This design creates an ideal local reaction environment for Pt nanoparticles inside the mesopores, one that protects most Pt from ionomer poisoning while achieving efficient oxygen diffusion. Using the developed carbon support, we synthesize an intermetallic PtCo nanocatalyst that delivers competitive membrane electrode assembly performance at low-Pt cathode loading (0.1 mgPt cm−2), with a H2-air rated power density of 1.23 W cm−2 at 0.67 V under heat-rejection-constrained conditions and a H2-O2 mass activity of 1.1 A mgPt−1.",nature_html,0
Multimodal deep-learning optimization of chiroptical properties in all-inorganic perovskite-coated TiO2 nanohelices and inverse-design transfer to organic chiral luminophores,https://www.nature.com/articles/s41467-026-74010-2,Physical sciences : Nature Communications subject feeds,2026-06-04 00:00:00 UTC,2026-06-04 00:00:00+00:00,,Zhifeng Huang,"Circularly polarized luminescence (CPL) has been catching increasing attention for developing advanced photonic displays, quantum communication, bioimaging, and chiral sensing. All-inorganic chiral luminophores are superior to their organic or organic-inorganic hybrid counterparts in thermal stability, environmental robustness and device compatibility, but limited by the difficulty in fabrication and low luminescence dissymmetry factor (glum glum is generally applied to evaluate the purity of circular polarization of CPL. Herein, chiral TiO2 nanohelices (NHs) act as chiral templates that are conformally coated with achiral perovskite luminophores composed of cesium lead bromides, to form all-inorganic chiral core@shell nano-luminophores. Chirality transmission from TiO2 NHs to perovskites accounts for the generation of CPL. Given by the complex and multifactorial experimental conditions, the manual engineering of fabrication procedure leads to an optimized glum = 0.2. To further optimize glum, we develop OptiCPL, a few-shot multimodal deep-learning framework that integrates spectral and morphological features, to boost glum from 0.20 to 0.35 through model prediction and experimental validation. In addition, the OptiCPL model is transferrable to polymer F8BT-based chiral organic luminophores, achieving glum = 0.87. This work establishes a synergistic chiral core@shell approach and offers a transferable deep-learning framework for designing high-glum CPL materials.",nature_html,0
