title,link,source,published_str,pub_date,doi,last_author,abstract,abstract_source,must_have_abstract
TAF15 amyloids propagate via defined motifs in a prion-like fashion,https://www.nature.com/articles/s41467-026-75607-3,Biological sciences : Nature Communications subject feeds,2026-07-14 00:00:00 UTC,2026-07-14 00:00:00+00:00,,Nikolaos N. Louros,"TATA-box binding protein–associated factor 15 (TAF15) is an RNA-binding protein and the primary fibrillar constituent in a subset of frontotemporal lobar degeneration (FTLD) cases. However, the molecular determinants underlying TAF15 aggregation remain unclear. Here, we show that TAF15 forms amyloid fibrils under physiological conditions and develop a cellular biosensor to monitor its propagation. Both recombinant TAF15 fibrils and pathological aggregates extracted from FTLD patient brains selectively seed TAF15 biosensor cells, demonstrating prion-like properties. The closely related protein FUS does not seed TAF15 aggregation, revealing a cross-seeding barrier, but partially incorporates into inclusions during TAF15-induced seeding, potentially explaining their pathological overlap in FTLD. Computational and peptide-based mapping identifies aggregation-prone motifs within the low-complexity domain that stabilize ex vivo fibril cores and drive TAF15 propagation. These findings establish TAF15 as an amyloid-forming, prion-like protein and define sequence determinants underlying its self-assembly, providing a mechanistic framework for FTLD-TAF15 and potential therapeutic targets.",nature_html,0
‘Dark comet’ unmasked by its mysterious motions,https://www.nature.com/articles/d41586-026-02192-2,Nature,2026-07-14 00:00:00 UTC,2026-07-14 00:00:00+00:00,10.1038/d41586-026-02192-2,,A celestial body thought to be an ordinary space rock turns out to have a comet-like tail. A celestial body thought to be an ordinary space rock turns out to have a comet-like tail.,nature_html,0
How the calendar came to be,https://www.nature.com/articles/d41586-026-02102-6,Nature,2026-07-14 00:00:00 UTC,2026-07-14 00:00:00+00:00,10.1038/d41586-026-02102-6,,"The development of time-keeping, and a book that brings an immune cell back in vogue, in this week’s pick from the Nature archive. Snippets from Nature’s past.",nature_html,0
AI models: one country’s fears become everyone’s constraint,https://www.nature.com/articles/d41586-026-02187-z,Nature,2026-07-14 00:00:00 UTC,2026-07-14 00:00:00+00:00,10.1038/d41586-026-02187-z,Zaheer Allam,Letter to the Editor,nature_html,0
The Enhanced Games and the normalization of doping: a public health concern,https://www.nature.com/articles/d41586-026-02189-x,Nature,2026-07-14 00:00:00 UTC,2026-07-14 00:00:00+00:00,10.1038/d41586-026-02189-x,Marilia Santos Andrade,Letter to the Editor,nature_html,0
Academia should recognize community partnerships as having societal impact,https://www.nature.com/articles/d41586-026-02190-4,Nature,2026-07-14 00:00:00 UTC,2026-07-14 00:00:00+00:00,10.1038/d41586-026-02190-4,Jessa Marabi,Letter to the Editor,nature_html,0
Bird flu H5N1 in Australia: protect Australian species from bird flu virus,https://www.nature.com/articles/d41586-026-02188-y,Nature,2026-07-14 00:00:00 UTC,2026-07-14 00:00:00+00:00,10.1038/d41586-026-02188-y,Marissa L. Parrott,Letter to the Editor,nature_html,0
Seeking an industry role after your PhD? Make sure your CV reflects that,https://www.nature.com/articles/d41586-026-01855-4,Nature,2026-07-14 00:00:00 UTC,2026-07-14 00:00:00+00:00,10.1038/d41586-026-01855-4,Elena Hoffer,A doctorate can open many doors. A CV tailored to your planned career path can help to unlock them. A doctorate can open many doors. A CV tailored to your planned career path can help to unlock them.,nature_html,0
Origins of stomatal mechanics in grasses,https://www.nature.com/articles/s41467-026-75616-2,Biological sciences : Nature Communications subject feeds,2026-07-14 00:00:00 UTC,2026-07-14 00:00:00+00:00,,Anju Manandhar,"Grass stomata are unique in having dumbbell-shaped guard cell anatomy, but the evolutionary context that led to this dramatic anatomical change remains elusive. Here we compared stomatal responses to changes in leaf water status and light across the order Poales, including the closest relatives of grasses which do not have dumbbell-shaped guard cells. Unlike other angiosperms, non-grass Poales have minimal mechanical interactions between guard cells and neighboring epidermal cells. This is surprising because mechanical interactions between these cells increase maximum stomatal aperture and stomatal responsiveness in angiosperms compared to other land plants. Dumbbell-shaped guard cells in grasses are associated with an increased subsidiary cell area into which guard cells can move by displacement when opening. The reemergence of pronounced mechanical interactions between guard cells and subsidiary cells in grasses enhances stomatal sensitivity to environmental signals and may be linked to the ecological success of this lineage.",nature_html,0
Scaling‑free electro‑membrane crystallization enabled by electric field-assisted organic acid control,https://www.nature.com/articles/s41467-026-75277-1,Physical sciences : Nature Communications subject feeds,2026-07-14 00:00:00 UTC,2026-07-14 00:00:00+00:00,,Chuyang Tang,"Mineral scaling, driven by concentration polarization, is an inevitable challenge in electro-membrane technologies for recovering valuable metals from lithium-ion battery (LIB) leachates. Here, we elucidate the synergistic scaling mechanism and propose an electric field-assisted organic acid control (eF-OAC) principle to prevent membrane mineral scaling while enabling metal recovery. The eF-OAC utilizes an electric field to direct organic acids into the membrane matrix, where ligand-metal coordination dissolves hydroxide-rich scale and mobilizes metal species for selective transport and crystallization. Dynamic experimental analysis reveals that concentration polarization enriches metal hydroxides at the membrane interfaces and pores. Static density functional theory calculations further demonstrate that organic ligands are thermodynamically favored over sulfonate groups for coordinating metal hydroxides, enabling targeted dissolution from the membrane. Leveraging this molecular-level selectivity, the eF-OAC converts scale into recoverable crystalline products. In optimized electro-membrane crystallization, this eF-OAC achieves high recovery rates of 97.6% for Li+, 95.3% for Ni2+, 94.2% for Co2+, and 97.8% for Mn2+. It further yields high-purity Li2SO4 (99.4%), Ni(OH)2 (99.2%), Co(OH)2 (99.0%), and Mn3O4 (99.3%). This study clarifies the mechanisms of mineral scaling and demonstrates a scaling-free approach that transforms fouling liabilities into valuable resource recovery for spent LIBs.",nature_html,0
Covalent Ag-holey MXene link at interface boosting electrochemical dechlorination,https://www.nature.com/articles/s41467-026-75560-1,Physical sciences : Nature Communications subject feeds,2026-07-14 00:00:00 UTC,2026-07-14 00:00:00+00:00,,Miao Zhang,"Incorporating Ag species into conductive matrices can mitigate volumetric expansion and stabilize electrode structures in capacitive deionization (CDI). Yet, this approach may suffer from severe charge transfer resistance at their heterogeneous interface featuring physical contact or weak intermolecular link. To tackle this challenge, we linked Ag single atoms and nanoparticles covalently to holey MXene (HMX) via an in situ etching-and-reduction strategy, in which atomically dispersed Ag in covalent bond with HMX is generated and serves as pivots to guide growth of Ag nanoparticles. The elaborate covalent link promotes Ag-to-HMX electron transfer and creates electron-deficiency on Ag that facilitates faradaic dechlorination. Meanwhile, the perforated HMX nanosheets with rich in-plane nanopores assemble into thin films possessing a spatially interconnected porous matrix, enabling fast cross-film transfer of both electrons and ions. Consequently, the as-made hybrid electrodes exhibit enhanced dechlorination capacity (156.63 ± 2.6 mg g−1), charge efficiency (91.2 ± 4.5%), and cyclic stability (>90% retention in 50 cycles) compared to the control samples. This synthetic strategy integrates Ag-mediated covalent interfacial bridging with pore-engineered MXene, providing a paradigm for designing CDI dechlorination electrodes.",nature_html,0
Universal energy-space localization and stable quantum phases against time-dependent perturbations,https://www.nature.com/articles/s41467-026-75465-z,Physical sciences : Nature Communications subject feeds,2026-07-14 00:00:00 UTC,2026-07-14 00:00:00+00:00,,Tzu-Chieh Wei,"Stability against perturbations is a defining property of quantum many-body phases of matter. However, most rigorous stabilities are only established for static perturbations; whether any system can remain stable against generic time-dependent perturbations is largely elusive. Here, we identify a universal phenomenon, where the evolving state driven by time-dependent q-local Hamiltonians can be exponentially localized in an energy window of instantaneous spectrum, and prove its survival under generic time-dependent perturbations. Applying such energy-space localization to classical and quantum LDPC codes whose codewords are separated by extensive energy barriers, we show that the system remains localized near the original codeword for an exponentially long time under generic time-dependent perturbations. For classical optimization problems with clustered solution spaces, the stability becomes an obstacle for quantum Hamiltonian-based algorithms to escape local minima. Our work provides a new lens for analyzing quantum non-equilibrium dynamics and tools for establishing stability and designing quantum algorithms.",nature_html,0
Thermomechanically squeezed multi-mode phonon lasers with levitated optomechanics,https://www.nature.com/articles/s41467-026-75601-9,Physical sciences : Nature Communications subject feeds,2026-07-14 00:00:00 UTC,2026-07-14 00:00:00+00:00,,Guangzong Xiao,"Squeezing, an effective approach to reduce noise in one quadrature while increasing it in the orthogonal quadrature, has attracted broad attention to enhance the performance of mechanical oscillators in their thermal or ground states. However, the classical squeezing of phonon lasers, mechanical analogs of optical lasers, has not been achieved. Here, we report an experimental demonstration of a thermomechanically squeezed phonon laser with a microscale sphere in a levitated optomechanical system. Through non-adiabatic frequency shifts induced by a pulse-modulated trapping laser, the fundamental-mode phonon laser has been squeezed by 3.15 ± 0.35 dB. In such a way, we found that the second-harmonic mode of phonon lasers could be simultaneously squeezed, demonstrating the unique advantage of our system for concurrent coherent control of multi-mode phonon lasers. This work gives the first example of a squeezed nonlinear phonon laser with a larger mass under low vacuum, thus providing a promising platform for exploring nonlinear phononics and harnessing such a system for precision metrology.",nature_html,0
Resilience metrics to guide back-up investments in the power system during extreme weather,https://www.nature.com/articles/s41893-026-01897-6,Nature Sustainability,2026-07-14 00:00:00 UTC,2026-07-14 00:00:00+00:00,10.1038/s41893-026-01897-6,Marta Victoria,"Security of supply is a common and important concern when integrating renewables in net-zero power systems. Extreme weather affects both demand and supply, leading to power system stress; in Europe this stress spreads continentally beyond the meteorological root cause. Here we use an approach based on shadow prices to identify periods of elevated stress called system-defining events and analyse their impact on the power system. By classifying different types of system-defining events, we identify challenges to power system operation and planning. Crucially, we find the need for sufficient resilience back-up (power) capacities whose financial viability is precarious owing to weather variability and weather-induced risk. Furthermore, we disentangle short- and long-term resilience challenges (from multi-day to annual scale) with distinct metrics and stress tests to incorporate both into future energy modelling assessments. Our methodology and implementation in an open energy system model (PyPSA-Eur) can be re-applied to other systems and help researchers and policymakers in building more resilient and adequate energy systems.",nature_html,0
Adversarial dynamical systems characterize when data-driven learning succeeds or fails,https://www.nature.com/articles/s41467-026-74220-8,Physical sciences : Nature Communications subject feeds,2026-07-14 00:00:00 UTC,2026-07-14 00:00:00+00:00,,Alexei Stepanenko,"Many systems resist analytical modeling, making data-driven inference of dynamics important. Yet data-driven methods can fail to converge or generalize, leaving open a central question: When can system behavior be learned reliably from data, and when is such learning impossible? We answer this question using adversarial dynamical systems to identify the boundary between accessible and inaccessible regimes. In Koopman operator learning, a leading framework for representing nonlinear dynamics through linear spectral objects, we design optimal data-driven spectral algorithms with convergence and certification guarantees under conditions arising broadly in physical systems. This yields a convergence theory for Koopman-operator approximations and resolves a longstanding open problem in Koopman spectral analysis. Conversely, by constructing adversarial systems, we prove matching impossibility results: without these conditions, no single-sequence limiting procedure can guarantee learning, regardless of data quality. These results sharply characterize when data-driven spectral learning can succeed and when it must fail. We validate the framework on oscillators, chaotic fluid flows and Arctic sea ice concentration forecasting. In the latter, we uncover hidden modes of Arctic sea ice decline, deliver long-range forecasts with geographic error bounds, and outperform state-of-the-art dynamical and deep learning models at substantially lower computational cost, enabling real-time deployment on standard CPUs.",nature_html,0
Superconducting coherence boosted by outer-layer metallic screening in multilayered cuprates,https://www.nature.com/articles/s41467-026-75295-z,Physical sciences : Nature Communications subject feeds,2026-07-14 00:00:00 UTC,2026-07-14 00:00:00+00:00,,Takeshi Kondo,"In multilayered high-Tc cuprates, the inner CuO2 planes (IPs) are spatially separated from dopant layers and thus remain cleaner than the outer planes (OPs). Here, we investigate five-layer (Cu,C)Ba2Ca4Cu5Oy (Cu1245) and three-layer Ba2Ca2Cu3O6(F,O)2 (F0223) using angle-resolved photoemission spectroscopy (ARPES) and uncover an unprecedented situation, in which only the IPs become superconducting while the OPs remain metallic at low temperatures. Our model calculations indicate that over 95% of the OP wavefunction remains confined to OP itself, rendering superconducting proximity negligible. This interlayer decoupling realizes an ideal configuration—a single superconducting CuO2 layer screened from the dopant layer-induced disorder by heavily overdoped metallic OPs. The clean CuO2 layer exhibits a large superconducting gap with coherent Bogoliubov peaks extending beyond the antiferromagnetic zone boundary, and a widely extended coherent flat band at the Brillouin zone edge. These findings introduce the “degree of screening” as a physical parameter for probing competition between pseudogap and superconductivity, and for bridging typically disordered real materials with the idealized theoretical models.",nature_html,0
Africa’s response to this Ebola outbreak shows how to shape global health,https://www.nature.com/articles/d41586-026-02148-6,Nature,2026-07-14 00:00:00 UTC,2026-07-14 00:00:00+00:00,10.1038/d41586-026-02148-6,Safura Abdool Karim,"Countries elsewhere must learn from the continent’s example and combat disease outbreaks by working together, not by closing borders. Countries elsewhere must learn from the continent’s example and combat disease outbreaks by working together, not by closing borders.",nature_html,0
DNA-shredding CRISPR enzyme takes aim at cancer cells,https://www.nature.com/articles/d41586-026-02122-2,Nature,2026-07-14 00:00:00 UTC,2026-07-14 00:00:00+00:00,10.1038/d41586-026-02122-2,Raymond H. J. Staals,"A bacterial self-destruct mechanism has been repurposed as a potential therapy, selectively eliminating diseased cells — including tumour cells in mouse models of cancer. A bacterial self-destruct mechanism has been repurposed as a potential therapy, selectively eliminating diseased cells — including tumour cells in mouse models of cancer.",nature_html,0
My research on mice is causing me stress. How can I become more resilient?,https://www.nature.com/articles/d41586-026-01128-0,Nature,2026-07-14 00:00:00 UTC,2026-07-14 00:00:00+00:00,10.1038/d41586-026-01128-0,Christine Ro,"A PhD student loves research, but not the realities of experimenting on animals. What are their options? A PhD student loves research, but not the realities of experimenting on animals. What are their options?",nature_html,0
Electrochemical reactions under reverse bias create additional mobile ions that enable hole tunneling in metal halide perovskite diodes,https://www.cell.com/joule/fulltext/S2542-4351(26)00261-8?rss=yes,Joule,2026-07-14 00:00:00 UTC,2026-07-14 00:00:00+00:00,10.1016/j.joule.2026.102577,Michael D. McGehee,Perovskite diodes under reverse bias must be thought of as both semiconductor devices and electrochemical cells. High concentrations of mobile defects created under reverse bias enable low breakdown voltages and rapid cell degradation.,rss_cell,0
Site-dominant quantum-cutting nanocrystals enable silicon photovoltaics exceeding 100% external quantum efficiency,https://www.cell.com/joule/fulltext/S2542-4351(26)00262-X?rss=yes,Joule,2026-07-14 00:00:00 UTC,2026-07-14 00:00:00+00:00,10.1016/j.joule.2026.102578,Baoquan Sun,Manipulating Yb ion-site occupancy (interstitial vs. substitutional) in CsPbCl3:Yb nanocrystals via temperature-gradient synthesis enhances quantum-cutting efficiency. The optimized nanocrystal film integrated with c-Si PV achieves an EQE of 117.2% ± 2.9% at a power density of 30 μW/cm² at 380 nm and a certified PCE of 26.00% (Ref.: 25.58%). This strategy provides fundamental insights for advancing down-shifting-enhanced photovoltaics beyond the Shockley-Queisser limit.,rss_cell,0
Context-aware sequence-to-function model of human gene regulation,https://www.nature.com/articles/s41467-026-75527-2,Biological sciences : Nature Communications subject feeds,2026-07-14 00:00:00 UTC,2026-07-14 00:00:00+00:00,,Martin Vingron,"Sequence-to-function models have been very successful in predicting gene expression, chromatin accessibility, and epigenetic marks from DNA sequences alone. However, current state-of-the-art models have a fundamental limitation: they cannot extrapolate beyond the cell types and conditions included in their training dataset. Here, we introduce Corgi, a context-aware sequence-to-function model that overcomes this limitation by integrating DNA sequence and trans-regulator expression to predict chromatin accessibility, histone modifications, and gene expression coverage, even in held-out cell types. Trained on a diverse set of bulk and single-cell sequencing datasets, Corgi achieves top performance in joint cross-sequence and cross-cell-type epigenetic track prediction. Additionally, we present an advanced model version, Corgi+, which is state-of-the-art in imputation of epigenetic tracks using only RNA-seq data. We further show that Corgi learns key cell type-specific trans-regulators in a zero-shot manner, and it can predict genomic variant effects in held-out cell types.",nature_html,0
Electric field-engineered bimetallic MXene for ultra-sensitive SERS sensors,https://www.cell.com/matter/fulltext/S2590-2385(26)00284-5?rss=yes,Matter,2026-07-14 00:00:00 UTC,2026-07-14 00:00:00+00:00,10.1016/j.matt.2026.102921,Yong Yang,"By applying an external electric field to bimetallic Ti2TaC2 MXenes, this work reconstructs the near-Fermi electronic structure and simultaneously enhances the photo-electric-induced charge transfer and plasmon-associated electromagnetic enhancement. The electrically gated Ti2TaC2 SERS substrate enables R6G detection down to 10−13 M, achieving a three-orders-of-magnitude improvement over the optical excitation alone and providing a tunable route toward high-sensitivity, non-noble-metal molecular sensing.",rss_cell,0
A molecular model for the Ge(100) buckled dimer,https://www.nature.com/articles/s41557-026-02208-4,Nature Chemistry,2026-07-14 00:00:00 UTC,2026-07-14 00:00:00+00:00,10.1038/s41557-026-02208-4,Lutz Greb,"The ‘buckled dimer’ defines the key properties of silicon and germanium(100) semiconductor surfaces and governs their behaviour during passivation, functionalization and device fabrication. Each dimer combines a Lewis-acidic ‘down’ atom with a Lewis-basic ‘up’ atom, creating a polarized motif that is difficult to isolate or to quantify. Accordingly, their atomically resolved chemistry remains challenging to interrogate. Here we show that structural constraint can translate this surface motif into a molecular system. A calix[4]pyrrolato ligand enforces a unique cis-bent geometry in a dinuclear Ge(II) complex, generating a polarized Ge–Ge unit that emulates the ambiphilic character of a Ge(100) buckled dimer. Structural analysis, quantitative Lewis acidity/basicity measurements and solution-phase reactivity reveal pronounced surface-like features, but clear divergence from conventional digermenes. The rigid geometry creates spatially separated, exceptionally strong Lewis acidic and basic sites that govern distinct reactivity patterns. Accordingly, this work establishes constrained main-group complexes as molecular surrogates for interrogating solid–vacuum interface chemistry in solution.",nature_html,0
Programmable arene ring opening unlocks the diversification of phenols,https://www.nature.com/articles/s41557-026-02204-8,Nature Chemistry,2026-07-14 00:00:00 UTC,2026-07-14 00:00:00+00:00,10.1038/s41557-026-02204-8,Ning Jiao,"The inert carbon–carbon bonds of aromatic systems have long impeded the direct diversification of phenolic feedstocks into value-added scaffolds. Although enzymatic or energy-intensive strategies enable limited arene modifications, the controlled and programmable ring opening of phenols to unlock both skeletal and functional group diversity remains a fundamental challenge. Here we report an operationally simple and efficient nitrogenation strategy for cleaving phenolic arene rings, converting phenols into uniquely structured acyclic N-containing products including cyanopenta-dienoates, cyanopenta-dienamides and cyanopenta-dienoic acids. The method also enables scaffold hopping of corresponding arene rings, leading to important five-, six- and seven-membered N-heterocycles. The strategy demonstrates broad utility in late-stage modification of bioactive molecules, diversified skeletal remodelling of phenolic feedstocks, and the application of ring-opening products in polymer development. This approach transforms phenols into programmable linchpins for accessing underexplored chemical space, offering broad potential for synthetic chemistry and materials science.",nature_html,0
Facing a harsh climate: terrestrial plant functional strategies in a changing world,https://academic.oup.com/nsr/advance-article/doi/10.1093/nsr/nwag416/8733954?rss=1,National Science Review Advance Access,2026-07-14 00:00:00 UTC,2026-07-14 00:00:00+00:00,10.1093/nsr/nwag416,Chengjin Chu,"Understanding how terrestrial plant functional strategies (Competitive, Stress-tolerant, Ruderal; CSR) respond to environmental conditions is crucial for predicting ecosystem dynamics under global climate change, yet remains unexplored at the global community level. Leveraging a machine learning approach, and utilizing multi-source satellite remote-sensing and field-collected sPlotOpen measurements data, we generated the first global community-level map of CSR functional strategy variations. Results show that S-selected strategies are globally dominant (C: S: R = 23.66 : 62.40 : 13.94%), with substantial spatial variations across biomes. This variability is strongly influenced by climatic variables (e.g. mean annual precipitation, diurnal temperature range) and soil properties (e.g. cation exchange capacity, total nitrogen). Future projections show that climate change favours S- (+0.33%) and R- (+0.31%) at the expense of C-selected strategy (-0.64%), alongside marked biome-specific shifts. Despite potential underestimation of localized climate uncertainties, these findings provide critical insights into global plant community dynamics under challenging abiotic conditions.",rss_oup,0
Rethinking energy density limits in dielectric materials,https://www.nature.com/articles/s41578-026-00946-y,Nature Reviews Materials,2026-07-14 00:00:00 UTC,2026-07-14 00:00:00+00:00,10.1038/s41578-026-00946-y,Ce-Wen Nan,"Dielectrics with high energy storage density are essential for device miniaturization and system integration. As advances in materials fabrication technologies push the breakdown strength of dielectric materials ever closer to their theoretical limits, greater emphasis should be placed on polarization enhancement for further improving the energy storage performance.",nature_html,0
