title,link,source,published_str,pub_date,doi,last_author,abstract,abstract_source,must_have_abstract
Electrocatalytic galvanic cells: A paradigm toward spontaneous chemicals synthesis and electricity generation,https://academic.oup.com/nsr/advance-article/doi/10.1093/nsr/nwag396/8719657?rss=1,National Science Review Advance Access,2026-06-27 00:00:00 UTC,2026-06-27 00:00:00+00:00,10.1093/nsr/nwag396,Zhong-Shuai Wu,Electrocatalytic galvanic cells redefine electrochemical energy conversion by enabling the spontaneous co-production of chemicals and electricity from renewable and waste feedstocks.,crossref,0
In-scanner thoughts contribute to resting-state functional connectivity,https://www.nature.com/articles/s41467-026-74953-6,Biological sciences : Nature Communications subject feeds,2026-06-27 00:00:00 UTC,2026-06-27 00:00:00+00:00,,Peter A. Bandettini,"Resting-state fMRI (rsfMRI) scans—acquired in the absence of experimentally controlled stimuli or task demands—are widely used to identify aberrant patterns of functional connectivity (FC) in clinical populations. To minimize interpretational uncertainty, researchers routinely control for across-cohort disparities in age, gender, comorbidities, and head motion. Yet, studies rarely consider the possibility that systematic differences in inner experience (i.e., how subjects think and feel during the scan) directly affect FC measures. Here, using an rsfMRI dataset comprising 469 scans with retrospective experiential annotations, we show that summary descriptors of in-scanner experience are reproducible across visits and subject-specific, consistent with trait-like characteristics. We further show that widespread significant differences in FC are observed between scans that are associated with different reported experiential profiles, and that FC can predict specific experiential dimensions with performance comparable to that reported for demographic, cognitive, and clinical variables. Together, these findings highlight the key role that in-scanner experience should play when interpreting FC in the context of rsfMRI. Given that the available experiential measures are retrospective summaries, these results speak to stable experiential tendencies rather than potential moment-to-moment, state-dependent relationships between ongoing experience and concurrent brain activity.",nature_html,0
Multilayered control of mRNA delivery to cell protrusions drives localized mini-cytoplasm establishment for stress-induced cell activation,https://www.nature.com/articles/s41467-026-74864-6,Biological sciences : Nature Communications subject feeds,2026-06-27 00:00:00 UTC,2026-06-27 00:00:00+00:00,,Giacomo Donati,"In response to stress, cells exploit plasticity to self-activate and form protrusions that explore the environment and guide migration. While protrusion initiation is well characterized, their maturation and functional composition remain poorly understood. Here, using a new pooled genetic approach (ReGenT-seq) to interrogate chromatin factors controlling epidermal progenitor activation, we unexpectedly identified Cbx3 as a critical determinant of protrusion formation. Beyond its nuclear activities, we revealed a cytoplasmic moonlighting function of CBX3 that governs the subcellular localization of specific mRNAs within polarizing protrusions of migrating epidermal progenitor cells, as well as in invadopodia of squamous carcinoma cells. CBX3-dependent mRNA transport promotes the localized establishment of multiple organelles, including the endoplasmic reticulum and lysosomes, within maturing protrusions, and regulates focal adhesion dynamics. Together, our findings uncover a multilayered gene regulatory mechanism controlling cell motility through protrusionogenesis and identify a chromatin-to-cell-protrusion mRNA transport pathway that represents a potential therapeutic target for enhancing wound healing and limiting cancer invasion.",nature_html,0
Brain-inspired spatial intelligence for embodied agents,https://www.nature.com/articles/s41467-026-74358-5,Biological sciences : Nature Communications subject feeds,2026-06-27 00:00:00 UTC,2026-06-27 00:00:00+00:00,,Hang Su,"Spatial cognition enables adaptive goal-directed behavior through structured internal models of space. Robust biological systems consolidate spatial knowledge into three interconnected forms: landmarks for salient cues, route knowledge for movement trajectories, and survey knowledge for map-like representations. While recent advances in multi-modal large language models (MLLMs) have enabled visual-language reasoning in embodied agents, these efforts lack structured spatial memory and instead operate reactively, limiting their generalization and adaptability in complex real-world environments. Here we present Brain-inspired Spatial Cognition for Navigation (BSC-Nav), a unified framework for constructing and leveraging structured spatial memory in embodied agents. BSC-Nav builds allocentric cognitive maps from egocentric trajectories and contextual cues, and dynamically retrieves spatial knowledge aligned with semantic goals. Integrated with powerful MLLMs, BSC-Nav achieves state-of-the-art efficacy and efficiency across diverse embodied navigation tasks (e.g., improving success weighted by path length from 17.6% to 44.9% in instance-level navigation and from 42.7% to 53.1% in zero-shot long-horizon instruction-following), while also supporting versatile embodied behaviors in the real physical world. These results highlight a scalable path toward general-purpose spatial intelligence.",nature_html,0
"Harnessing interfacial click polymerization using pyridinium-yne films as photochromic, radical generation and sensing platforms",https://www.nature.com/articles/s41467-026-74956-3,Physical sciences : Nature Communications subject feeds,2026-06-27 00:00:00 UTC,2026-06-27 00:00:00+00:00,,Yu Fang,"Convenient and effective fabrication of free-standing organic polymer films with tunable properties is highly desirable towards visual sensing applications. Herein, we pioneered an innovative interfacial pyridinium-yne click polymerization strategy to in situ fabricate uniform, defect-free, and large-area films. Using pyridinium salt (HDPP-BF4) as an acceptor and tricarbonylbenzene activated alkyne (TFB-3EK) as a donor, a free-standing HDPP-TFB-BF4 film (Film #1) with precisely tunable thickness from tens to hundreds of nanometers was formed at the air-DMSO interface. Interestingly, Film #1 exhibited promising photochromism, showing a 100 nm hypsochromic shift and a 5-fold fluorescence enhancement under continuous UV irradiation, which induced the formation of a radical-based Film #2. Film #2 served as a portable visual sensing platform for gaseous ammonia, achieving a detection limit as low as 0.16 ppm, and was successfully applied as a colorimetric chart for seafood spoilage. Strategically, an anion exchange of Film #2 with TCNQ- yielded a fluorescence-silent Film #3, which enabled efficient detection and elimination of reactive oxygen species through turn-on fluorescence visualization. This work not only provides a straightforward approach for in situ fabricating versatile polymer films but also establishes a generalizable strategy for developing multi-responsive visualization systems through the rational molecular design and controlled polymer variability.",nature_html,0
Hierarchical self-assembly of atomically precise Au6 nanoclusters into fibrillar superstructures with collective optical properties,https://www.nature.com/articles/s41467-026-74923-y,Physical sciences : Nature Communications subject feeds,2026-06-27 00:00:00 UTC,2026-06-27 00:00:00+00:00,,Sourov Chandra,"Self-assembly, a key approach in material science, enables modulation of nanostructures to achieve distinct materials properties. Atomically precise metal nanoclusters (NCs), consisting of a few metal atoms, exhibit distinctive optical and electronic properties due to their “molecule-like” discrete energy levels. Such NCs offer advantages over conventional metal nanoparticles by avoiding dispersity in size and uncontrolled aggregation. Here we demonstrate a study on crystalline aggregates of Au6 NCs, formed under varying conditions. Notably, the controlled aggregation of these Au6 NCs, synchronising by protonation or employing specific hydrogen bonding, yields self-assembled nanoribbons and percolated networks of nanofibers that further produce extended 3D fibrillar architectures. X-ray scattering and electron microscopy reveal two distinct packing modes: a monoclinic 2D oblique lattice with sparse NC arrangement, and a nematic 2D hexagonal packing, resembling liquid-crystalline rod-like assemblies. The resulting superstructures exhibit enhanced optical responses, retaining the photoluminescence of their constituents, and manifesting third-harmonic generation, slow photoluminescence decay driven by charge-migration effects, and polarization effects influenced by the ordered structure with the periodicity of the NCs. Overall, this work emphasizes the potential of NCs as versatile building blocks for tunable and responsive optoelectronic materials, providing insights into the mechanisms of self-assembly.",nature_html,0
Unifying network connectivity from geodesics to random walks via the random cluster model,https://www.nature.com/articles/s41467-026-72587-2,Physical sciences : Nature Communications subject feeds,2026-06-27 00:00:00 UTC,2026-06-27 00:00:00+00:00,,Renaud Lambiotte,"Connectivity is a fundamental concept in network science, characterizing how interactions propagate through indirect pathways. While numerous connectivity metrics exist, such as shortest paths, effective resistance and minimum cut, each highlighting distinct structural features, their relationships remain largely fragmented. Here we show that these classical notions arise as limiting cases of a unified statistical-physics framework based on the random cluster (RC) model, which interprets connectivity as a principled synthesis of series and parallel transmission. By tuning its parameters, the RC model not only recovers classical connectivity measures but also extrapolates into unexplored regimes, leading to emergent notions of connectivity which yield practical tools for network learning tasks. In particular, RC connectivity naturally encodes the kinetics of growing paths, enhancing learning performance in dynamical settings such as epidemic spreading and neurodynamics. By linking structural, dynamical, and learning-based perspectives, RC connectivity establishes a general and interpretable foundation for the analysis of networked systems.",nature_html,0
Lithosphere as a bottom-up modulator of mountain vegetation resilience,https://www.nature.com/articles/s41467-026-74875-3,Earth and environmental sciences : Nature Communications subject feeds,2026-06-27 00:00:00 UTC,2026-06-27 00:00:00+00:00,,Pat J.-F. Yeh,"Understanding vegetation resilience, defined as the recovery speed of vegetation following external perturbations, is essential for predicting ecosystem stability under climate change, yet the role of lithosphere in mountain systems remains poorly understood. Here, we assess how lithology and tectonics modulate vegetation resilience across global mountains using integrated climate, soil, topography, human footprint, lithology, land-cover, and vegetation datasets. Vegetation type and temperature dominate global patterns, with resilience highest in trees, followed by herbs and shrubs, together explaining 86% of the spatial variability. After accounting for climatic and anthropogenic effects, resilience across vegetation types is strongly mediated by lithospheric pathways. Tree resilience peaks in steep, actively incising terrains underlain by erosion-resistant plutonic and metamorphic rocks, as well as dissolution-prone carbonate rocks. Herb resilience is strongly linked to soil organic carbon enriched on mafic and metamorphic rocks. Shrub resilience is primarily temperature-dependent (93%) but shows reduced warming sensitivity on nutrient-poor substrates. Moreover, resilience peaks at intermediate channel steepness (ksn ≈ 500), suggesting that moderate tectonic uplift promotes vegetation resilience. These findings identify the lithosphere as a fundamental modulator of mountain vegetation resilience and highlight geological constraints on ecosystem stability across heterogeneous landscapes.",nature_html,0
Plasmonic nanocomposite helices for weather-adaptive LiDAR function,https://www.nature.com/articles/s41467-026-75037-1,Physical sciences : Nature Communications subject feeds,2026-06-27 00:00:00 UTC,2026-06-27 00:00:00+00:00,,Hyeon-Ho Jeong,"Reliable light detection and ranging (LiDAR) is often challenged by multiscale water droplets on protective covers, as macroscopic raindrops cause refraction and diffraction, while microscopic fog condensation scatters light, distorting returned signals. Here, we present a bioinspired strategy for multiscale droplet clearance using plasmonic nanocomposite helices that couple passive photothermal antifogging with pressure-stable hydrophobic water repellence. Inspired by penguin feather barbules, copper nanoparticles are embedded within three-dimensional silica nanohelices via glancing angle co-deposition. The copper nanoparticles provide visible-light plasmonic heating while preserving >85% transmittance at 905 nm, and the helical architecture imparts hierarchical roughness, yielding a 143° contact angle. Under 1 sun illumination, the surface shows a 9.3°C temperature rise, clearing condensation within 6 seconds. During natural rainfall (3-5 mm/h), LiDAR transmission through the plasmonic nanohelices remains at 100%, whereas bare glass drops to 70% after 5 minutes. These results demonstrate weather-adaptive LiDAR operation for robust autonomous sensing.",nature_html,0
Broadband Radiative Heat Transfer Suppression via Dispersion-Engineered Metasurfaces,https://www.nature.com/articles/s41467-026-74805-3,Physical sciences : Nature Communications subject feeds,2026-06-27 00:00:00 UTC,2026-06-27 00:00:00+00:00,,Andrea Alù,"Suppressing radiative heat transfer using metallic reflectors fails where electrical conduction or material incompatibility are prohibitive, whereas non-metallic alternatives that rely on conventional thermophotonic approaches face fundamental performance-bandwidth trade-offs, bounded by the Bode-Fano limit. Here, we redefine the strategy for broadband radiative suppression by leveraging complementary dispersion engineering in a dielectric metasurface pair. Using stochastic gradient descent (SGD) optimization, we co-design aperiodic distributed Bragg reflector (DBR) pairs with deliberately misaligned passbands across the broad thermal band of interest, enabling effective broadband thermal decoupling within a small thickness and fabrication budget, beyond the limits of conventional approaches. Experimental validation reveals that our optimized 7-layered (7-L) metasurface pair reduces radiative heat exchange significantly compared to fused silica benchmarks, as confirmed through both angle-resolved emissivity measurements (82% reduction) and direct radiometric power quantification (62.5% reduction). Importantly, our compact system exhibits strong robustness against design and fabrication tolerance and operational temperature drift (320–500 K). This work establishes a generalizable framework for bandwidth-unconstrained thermal radiation engineering, with applications in energy-efficient systems, thermal insulation and thermal management. By circumventing the need for metallic components, our approach opens new possibilities for controlling radiative heat transfer in an all-dielectric ultrathin platform.",nature_html,0
Negative temperature coefficient metamaterial absorber for uniform microwave heating,https://www.nature.com/articles/s41467-026-74811-5,Physical sciences : Nature Communications subject feeds,2026-06-27 00:00:00 UTC,2026-06-27 00:00:00+00:00,,Yingguang Li,"Microwave heating is widely used in daily applications but is fundamentally limited by non-uniform temperature distribution. Despite extensive efforts to manipulate energy distribution around materials, achieving uniform heating remains elusive due to the intrinsic inhomogeneity of electromagnetic fields. Here, we report a self-regulating solution that adaptively modulates the absorbance distribution using a Negative Temperature Coefficient (NTC) Metamaterial Absorber (MA). Distinct from electromagnetic field-shaping strategies, our approach intrinsically suppresses overheating in high-temperature regions and redistributes energy to cooler areas. We demonstrate, for the first time, that uniform heating—quantified by over 90% reduction in the coefficient of variation—can be achieved across diverse configurations, including planar, polyhedral, curved, and multiple objects, as well as under power variations spanning two orders of magnitude. This work not only provides a theoretical resolution to the longstanding challenge of non-uniform microwave heating but also opens new avenues for development and application of temperature-adaptive metamaterials.",nature_html,0
Multidirectional strain-insensitive stretchable RF electronics,https://www.nature.com/articles/s41467-026-74900-5,Physical sciences : Nature Communications subject feeds,2026-06-27 00:00:00 UTC,2026-06-27 00:00:00+00:00,,Chaoyun Song,"Stretchable radio-frequency (RF) electronics underpin emerging wearable systems for body-centric communication, continuous health monitoring, and wireless power transfer. However, on-body stretchable antennas undergo multidirectional in-plane strain during natural motion, which detunes resonance and destabilizes wireless links. Existing strain-insensitive designs are typically effective only along prescribed loading directions and often compromise radiation performance. Here, we establish a systematic directional mechano-electromagnetic analysis framework for resonant planar antennas and introduce a dual-port multidirectional strain-insensitive antenna (DP-MSiA), whereby strain-insensitive resonance (shift ≤ 40 MHz at 2.45 GHz) is achieved under up to 45% strain across diverse in-plane directions. Based on the stable resonance and high realized gain of the DP-MSiA, we demonstrate strain-insensitive wireless energy harvesting with rectifiers under in-plane strain of varying direction and magnitude, as well as a strain-robust on-body communication system that sustains stable multimodal health-data transmission during natural motion. Our work opens new opportunities for creating deformation-insensitive electronics and enables integrated functionalities in wearable and embodied systems.",nature_html,0
3D nanoprinting of metals by spatiotemporally confined hot electrons via multiple-electron excitations in nanocrystals,https://www.nature.com/articles/s41467-026-74926-9,Physical sciences : Nature Communications subject feeds,2026-06-27 00:00:00 UTC,2026-06-27 00:00:00+00:00,,Heng Pan,"For decades, multi-photon polymerization has been a key technology for fabricating complex 3D micro- and nanoscale structures from polymer materials. However, extending this capability beyond polymers remains a significant challenge. In particular, nanoscale metal printing is challenging because solid metal formation typically requires energy-driven reactions or thermally activated processes that are difficult to spatially localize, resulting in compromised feature resolution. Here, we demonstrate 3D nanoprinting of metals with depth and lateral resolution",nature_html,0
Direct observation of long-range many-body coherence in quasi-one-dimensional attractive Bose gases,https://www.nature.com/articles/s41467-026-74763-w,Physical sciences : Nature Communications subject feeds,2026-06-27 00:00:00 UTC,2026-06-27 00:00:00+00:00,,Chen-Lung Hung,"Macroscopic coherence is an important feature of quantum many-body systems exhibiting collective behaviors, with examples ranging from atomic Bose-Einstein condensates, and quantum liquids to superconductors. Probing many-body coherence in a dynamically unstable regime, however, presents an intriguing and outstanding challenge in out-of-equilibrium quantum many-body physics. Here, we experimentally study the first- and second-order coherence of degenerate quasi-one-dimensional (1D) Bose gases quenched from repulsive to modulationally unstable attractive interaction regimes. The resulting dynamics, monitored by in situ density and matter-wave interference imaging, reveals phase-coherent density wave evolutions, clearly distinguished from iconic soliton trains previously observed in attractive gases. This arises from the interplay between noise-amplified density modulations and dispersive shock waves of broad interest in nonlinear physics, plasmas, granular systems, and beyond. At longer times, the gases become phase-scrambled, exhibiting a finite correlation length. Interestingly, following an interaction quench back to the repulsive regime, we observe that quasi-long-range coherence can be spontaneously re-established. This captivating rephasing dynamics can be attributed to the nucleation and annihilation of density defects in the quasi-1D geometry. These results shed light on out-of-equilibrium phase coherence in quantum many-body systems in a regime where beyond mean-field effects may arise and theoretical approaches have not been well-established.",nature_html,0
Confined ionic order in atomic nanowires of rare-earth chlorides unveiled via symmetry-guided structural screening,https://www.nature.com/articles/s41467-026-74793-4,Physical sciences : Nature Communications subject feeds,2026-06-27 00:00:00 UTC,2026-06-27 00:00:00+00:00,,Masahiro Yamashita,"Low-dimensional materials can exhibit unusual structural, electronic, and magnetic properties that arise from nanoscale confinement and quantum effects. However, determining their local atomic structures remains challenging, especially when long-range periodicity is limited and conventional crystallographic approaches are difficult to apply. Here, we show a symmetry-guided screening strategy for resolving confined one-dimensional materials by combining scanning transmission electron microscopy with reactive force-field molecular dynamics and density functional theory. We encapsulate rare-earth chlorides within single-walled carbon nanotubes (SWCNTs) to form stable LnCl3@SWCNTs hybrids (Ln = Y, Gd, Dy, Er), which contain ordered one-dimensional atomic nanowires. The screening strategy identifies structural models that are consistent with experimental imaging and energetic stability, enabling local configurations to be distinguished. Electronic and magnetic analyses, particularly for Dy-based systems using complete active space self-consistent field calculations and Boltzmann transport theory, reveal how local symmetry and confinement influence their functional properties. This experiment–theory framework provides a broadly applicable route for probing short-range-ordered nanostructures, establishing structure–property correlations, and guiding the design of functional low-dimensional materials.",nature_html,0
Long-distance lanthanide migration regulated by interfacial lattice strain in nanostructures,https://www.nature.com/articles/s41467-026-74447-5,Physical sciences : Nature Communications subject feeds,2026-06-27 00:00:00 UTC,2026-06-27 00:00:00+00:00,,Qianqian Su,"Interfacial strain engineering by controlling lattice mismatch holds implications for both fundamental studies and technological applications of heterostructured nanomaterials. However, defining its role remains challenging because the type, magnitude, and spatial distribution of strain are difficult to regulate at the nanoscale. Here, we establish a controllable model system to regulate interfacial lattice strain in lanthanide-doped core-shell-shell nanolattices by tuning lanthanide composition and shell deposition rate. We show that lattice mismatch governs lanthanide migration across heterointerfaces, thereby dictating crystal growth and optical properties. In hexagonal-phase NaErF4@NaYF4@NaLnF4 nanolattices, when the lattice mismatch exceeds 5.1%, lanthanide ions migrate by up to 13 nm from the core into the shell along the crystallographic direction. Mechanistic studies reveal that large interfacial strain not only promotes anisotropic shell growth by triggering preferential deposition of shell precursors onto specific crystal surfaces but also facilitates the formation of lanthanide vacancies at the core-shell interface. These findings identify interfacial strain as a key regulator of ion diffusion and structural evolution in heterostructured nanocrystals, providing a design principle for constructing heterostructures with spatially confined active ions for applications in bioimaging, nanocatalysis, and quantum information.",nature_html,0
