title,link,source,published_str,pub_date,doi,last_author,abstract,abstract_source,must_have_abstract
"Catecholamine modulation of frontal cortical ignition during wakefulness, sleep, and anesthesia",https://academic.oup.com/nsr/advance-article/doi/10.1093/nsr/nwag412/8725483?rss=1,National Science Review Advance Access,2026-07-06 00:00:00 UTC,2026-07-06 00:00:00+00:00,10.1093/nsr/nwag412,Yang Dan,"Conscious awareness—diminished during non-rapid-eye-movement (NREM) sleep and general anesthesia—is prevalent during wakefulness, but the underlying mechanism remains poorly understood. Here we show that activity of catecholamine neurons, known to be higher during wakefulness than NREM sleep, enhances cortical ignition, a process closely associated with conscious awareness. Chemogenetic activation and inactivation of catecholamine neurons, particularly dopaminergic neurons in the ventral tegmental area (VTA), respectively increased and decreased the amplitude of anterior cingulate area (ACA) excitation evoked by visual cortex (V1) stimulation. Ketamine and isoflurane, two commonly used general anesthetics, greatly reduced V1-to-ACA activity propagation. In addition to suppressing ongoing cortical activity, these general anesthetics significantly reduced the activity of VTA dopaminergic and basal forebrain (BF) cholinergic neurons, with dopaminergic activity dropping well below its level during NREM sleep. The strong inhibition of frontal cortical activity evoked by V1 stimulation, prominent during NREM sleep, was also absent under ketamine and isoflurane anesthesia. These results indicate that general anesthesia and NREM sleep suppress global ignition through overlapping but non-identical mechanisms.",rss_oup,0
NIR-II photothermal-driven pulsatile PTH release for osteoporotic bone repair,https://academic.oup.com/nsr/advance-article/doi/10.1093/nsr/nwag407/8725485?rss=1,National Science Review Advance Access,2026-07-06 00:00:00 UTC,2026-07-06 00:00:00+00:00,10.1093/nsr/nwag407,Changsheng Liu,"Integrating light-controlled intelligent materials into 3D printing technology holds great promise for bone tissue engineering, enabling spatiotemporal control over in situ drug dosing. However, this integration faces a critical molecular design challenge, as incorporated photoresponsive molecules must simultaneously fulfill the dual demands of high UV-stability during UV-mediated photopolymerization, and strong long-wavelength absorption for deep-tissue activation. Here, we report a wavelength-selective quinolinium dye (QC7CN) as photoresponsive ‘dye ink’ for addressing this dilemma. This dye features high UV-transparency that ensures stability during printing process, while possessing robust second near infrared (NIR-II) absorbance for deep-seated photothermal responsiveness. Leveraging these properties, we engineer a NIR-II light-controlled 3D-printed scaffold, composed of methacryloylated gelatin and calcium phosphate oligomers as printing matrix, thermosensitive phase-transformable microspheres as parathyroid hormone (PTH) drug carrier, and QC7CN as photothermal trigger. Upon NIR-II laser irradiation, QC7CN induces localized mild hyperthermia to drive gel-sol phase transition of microspheres, thereby manipulating pulsatile PTH release for deep-tissue osteoporotic bone repair. As such, our study provides a full demonstration in molecular design and additive manufacturing to push the limits of intelligent materials in precision medicine.",rss_oup,0
Time to give hydration breaks the red card? What science says about keeping cool,https://www.nature.com/articles/d41586-026-02097-0,Nature,2026-07-06 00:00:00 UTC,2026-07-06 00:00:00+00:00,10.1038/d41586-026-02097-0,Harry Brown,Inappropriate use of cooling breaks in sport is undermining trust in heat-health research. Inappropriate use of cooling breaks in sport is undermining trust in heat-health research.,nature_html,0
Deep-sea oddities and boatloads of other new species — June’s best science images,https://www.nature.com/articles/d41586-026-02087-2,Nature,2026-07-06 00:00:00 UTC,2026-07-06 00:00:00+00:00,10.1038/d41586-026-02087-2,Dhruv Shenai,"The month’s sharpest science shots, selected by Nature’s photo team.",nature_html,0
Universities are relying on AI-detection software to catch cheating. How well do the programs work?,https://www.nature.com/articles/d41586-026-01358-2,Nature,2026-07-06 00:00:00 UTC,2026-07-06 00:00:00+00:00,10.1038/d41586-026-01358-2,Anna McKie,"Technology companies say that their services can sniff out AI-generated writing, but their tools vary in technique and quality. Technology companies say that their services can sniff out AI-generated writing, but their tools vary in technique and quality.",nature_html,0
From cloning to gene-editing: the enduring legacy of Dolly the sheep,https://www.nature.com/articles/d41586-026-02096-1,Nature,2026-07-06 00:00:00 UTC,2026-07-06 00:00:00+00:00,10.1038/d41586-026-02096-1,,Dolly’s brush with celebrity could hold lessons for current discussions about reproductive technologies. Dolly’s brush with celebrity could hold lessons for current discussions about reproductive technologies.,nature_html,0
Germanium ligand redox cooperativity: A key to ambiphilicity and switchable two- and four-electron transfer,https://www.cell.com/chem/fulltext/S2451-9294(26)00193-2?rss=yes,Chem,2026-07-06 00:00:00 UTC,2026-07-06 00:00:00+00:00,10.1016/j.chempr.2026.103127,Seung Jun Hwang,"This work shows that a main-group compound can be designed to engage in multielectron transfer chemistry often associated with transition metals. By pairing germanium with a redox-active ligand, the molecule can direct either two- or four-electron pathways and display both electron-donating and electron-accepting behavior at one site. This design offers a simple principle for building more versatile, earth-abundant systems for oxygen activation and related transformations in main-group chemistry.",rss_cell,0
Multimodal scanning-probe quantum sensing of quantum materials,https://www.nature.com/articles/s41563-026-02648-w,Nature Materials,2026-07-06 00:00:00 UTC,2026-07-06 00:00:00+00:00,10.1038/s41563-026-02648-w,Chunhui Rita Du,"Spin-defect-based quantum microscopy has recently made transformative advances in cutting-edge scientific research and technological innovation. The high sensitivity, high spatial resolution and excellent measurement modalities of quantum spin defects open up a range of opportunities at the forefront of condensed-matter physics research. Many of the advantages of this approach result from the quantum mechanical nature of the sensors, which offer functionalities that are not available with their classical counterparts. In this Review, we provide an overview of progress on scanning-probe nitrogen-vacancy quantum sensing research and its application to investigating the physics of emergent quantum materials with nanoscale spatial resolution. We also discuss quantum sensing platforms built on more recently discovered spin defects in one-dimensional and two-dimensional materials beyond nitrogen-vacancy centres. We conclude with an outlook on future directions and opportunities for these rapidly advancing quantum sensing technologies.",nature_html,0
Twist-angle-controlled anomalous gating in bilayer graphene/BN heterostructures,https://www.nature.com/articles/s41563-026-02667-7,Nature Materials,2026-07-06 00:00:00 UTC,2026-07-06 00:00:00+00:00,10.1038/s41563-026-02667-7,Rebeca Ribeiro-Palau,"Anomalous gating effects—such as ineffective electrostatic control and strong hysteresis in resistance—have been observed in graphene-based systems encapsulated in boron nitride (BN) and linked to a possible ferroelectric state. However, their origin, stability and reproducibility remain under debate. Here we show, using dual-gated, dynamically rotatable van der Waals heterostructures based on bilayer graphene encapsulated in BN, that the angular alignment between the two BN layers—rather than the presence of a moiré superlattice with graphene—is the key parameter governing these effects. The relevant alignment between the two BN layers, to observe the anomalous gating effect at room temperature, lies between approximately 15° and 45°, with no evidence of the expected 60° periodicity. Both gate ineffectiveness and hysteresis are highly sensitive to small angular changes, which we classify into three distinct regimes. Our results clarify the conditions necessary to reproduce these phenomena and pave the way for theoretical investigation of their microscopic origins.",nature_html,0
Engineered living materials need engineered EU regulation,https://www.nature.com/articles/s41563-026-02651-1,Nature Materials,2026-07-06 00:00:00 UTC,2026-07-06 00:00:00+00:00,10.1038/s41563-026-02651-1,Justus Wesseler,Kai Purnhagen and Justus Wesseler discuss how EU law needs reform to address market access bottlenecks for living composites.,nature_html,0
Charged grain boundaries limit short-circuit endurance in garnet solid-state battery electrolytes,https://www.nature.com/articles/s41565-026-02206-0,Nature Nanotechnology,2026-07-06 00:00:00 UTC,2026-07-06 00:00:00+00:00,10.1038/s41565-026-02206-0,Jennifer L. M. Rupp,"Grain boundaries in lithium lanthanum zirconate solid-state electrolytes feature elevated electronic conduction and act as preferential sites for the nucleation of electrically isolated lithium metal during galvanostatic cycling in battery cells. However, the origin of local electronic conductivity variations remains unresolved. Here we show that lithium lanthanum zirconate grain boundaries carry ionic built-in charge, with lithium vacancies accumulating at the interface generating localized electric potentials (−0.15 V at 20 °C). This potential alters carrier distributions near the grain boundary, impeding ionic transport and increasing electronic conduction by a factor of 30 compared with bulk. This imbalance initiates internal lithium metal nucleation during cell operation and accelerates short-circuit failure. To mitigate charge build-up, we propose tailoring the processing oxygen activity and dopant stoichiometry, precisely tuning atomic-scale chemistry and interfacial potential. These modifications homogenize ionic transport and reduce electronic leakage, enabling the intrinsic critical current density to 1 mA cm−2. Our findings uncover how local defect landscapes shape charge transport and provide a pathway for chemically guided optimization of inorganic solid-state electrolytes at the nanoscale.",nature_html,0
Clocked stepping of an artificial protein walker along a DNA track,https://www.nature.com/articles/s41565-026-02211-3,Nature Nanotechnology,2026-07-06 00:00:00 UTC,2026-07-06 00:00:00+00:00,10.1038/s41565-026-02211-3,Paul M. G. Curmi,"Molecular motors are fundamental to life because they transduce free energy into mechanical work, a capability rooted in the chemical and structural complexity of their constituent proteins. Although motors based on small molecules and DNA have been developed, the creation of an artificial protein motor has remained an elusive goal in synthetic biology. Here we report the realization of an artificial, externally controlled protein motor, termed Tumbleweed (TW). TW was engineered using a modular design strategy that combines proteins with well-characterized properties to produce emergent motor function and directionality. TW comprises three ‘legs’, each containing a ligand-gated DNA-binding domain that enables selective interaction with specific sites along a DNA track. Using single-molecule fluorescence assays in conjunction with a programmable microfluidic device, we show that TW takes directional 16 nm steps along a designed DNA substrate in response to a defined sequence of ligand inputs. Moreover, both the timing and direction of stepping can be precisely controlled on a timescale of seconds. This approach provides a versatile platform for engineering dynamic and sophisticated protein-based nanomachines, as well as for probing the physical principles governing protein walkers with precisely defined architectures.",nature_html,0
Spectral visualization of excitonic pair breaking at individual impurities in Ta2Pd3Te5,https://www.nature.com/articles/s41565-026-02218-w,Nature Nanotechnology,2026-07-06 00:00:00 UTC,2026-07-06 00:00:00+00:00,10.1038/s41565-026-02218-w,Ying-Shuang Fu,"Excitonic insulators host the condensates of bound electron–hole pairs, offering a platform for studying correlated bosonic quantum states and for next-generation device applications. However, how macroscopic coherence emerges from locally collapsed pairing remains elusive. Here, using scanning tunnelling spectroscopy, we report the impurity-induced pair breaking in the excitonic insulator Ta2Pd3Te5. Individual Te vacancies generate a pair of spectral peaks within the excitonic gap. Their energies depend sensitively on the defect configurations and are continuously tunable using tip electric field, indicating controllable impurity scatterings. Spectral mapping shows spatially anisotropic and electronically coupled electron–hole components of the subgap states. These observations, together with mean-field modelling, suggest an excitonic pair-breaking origin. In the strongly electron–hole-imbalanced region, a secondary pair-breaking effect, manifesting an additional pair of subgap states with distinctly lower energies, emerges and displays the interplay of pairing breakings with different excitonic order parameters. Our findings demonstrate the spectroscopic fingerprint of local excitonic depairing at the atomic level, offering a crucial clue to the critical behaviour across excitonic condensation.",nature_html,0
Stepping ahead toward custom-designed autonomous motor proteins,https://www.nature.com/articles/s41565-026-02210-4,Nature Nanotechnology,2026-07-06 00:00:00 UTC,2026-07-06 00:00:00+00:00,10.1038/s41565-026-02210-4,Ryota Iino,"An artificial protein walker ‘Tumbleweed’ demonstrates ligand-driven stepping on DNA tracks, marking a key advance toward modular, custom-designed autonomous motor proteins.",nature_html,0
A non-viral path to efficient and safe prime editing in vivo,https://www.nature.com/articles/s41565-026-02205-1,Nature Nanotechnology,2026-07-06 00:00:00 UTC,2026-07-06 00:00:00+00:00,10.1038/s41565-026-02205-1,Hyongbum Henry Kim,Solving four delivery bottlenecks enables lipid nanoparticles to achieve curative prime editing in mice.,nature_html,0
Breaking steric hindrance restriction: compressed metal bonds realizing deep-level orbital delocalization,https://academic.oup.com/nsr/advance-article/doi/10.1093/nsr/nwag388/8725481?rss=1,National Science Review Advance Access,2026-07-06 00:00:00 UTC,2026-07-06 00:00:00+00:00,10.1093/nsr/nwag388,Yi Xie,"The introduction of large functional groups is a well-established strategy to enhance the stability and value of chemicals. However, the accompanying steric hindrance effects can significantly impede reaction progress, presenting a critical dilemma in synthetic design. Herein, a vacancy-constrained strategy was proposed to breaking steric hindrance restriction by realizing the deep-level delocalization of catalyst with compressed metal bonds. In detail, the delocalized deep-level orbit exhibits strong penetrating capability to overcome the steric hindrance effect of large functional groups by enhancing the charge-transfer process between the active sites and substrates. By taking bismuth atoms supported on defective CeO2 as an example, an ‘O4-Bi-Bi-O4’ ensemble was constructed by confining two adjacent Bi atoms in the vacancy of CeO2 nanosheets, where the Bi–Bi bond was strongly constrained from 3.10 Å to 3.05 Å. Such a functional Bi2/CeO2 catalyst exhibits enhanced photocatalytic efficiency in overcoming the steric hindrance from large functional groups, which is three times and two times higher than that of Bi single-atom catalyst and Bi clusters catalyst. This work proposed an applicable way in overcoming steric hindrance effects during high value-added chemical synthesis.",rss_oup,0
Overcoming the Dexter distance constraint: a relay strategy for asymmetric photocatalysis,https://academic.oup.com/nsr/advance-article/doi/10.1093/nsr/nwag410/8725478?rss=1,National Science Review Advance Access,2026-07-06 00:00:00 UTC,2026-07-06 00:00:00+00:00,10.1093/nsr/nwag410,Jie Wu,,,0
Microseismic monitoring with the quake neural operator,https://www.nature.com/articles/s41467-026-73965-6,Earth and environmental sciences : Nature Communications subject feeds,2026-07-06 00:00:00 UTC,2026-07-06 00:00:00+00:00,,Hongyu Sun,"Accurate monitoring of small-scale seismic events is essential for seismological studies. Traditional techniques rely on manual or automated seismic phase picking, which often leads to inaccuracies in microseismic monitoring due to unclear phase onsets. Here we introduce the Quake Neural Operator (QNO), a deep learning algorithm that builds earthquake catalogs directly from continuous data without explicit phase picking. As a multi-task operator, QNO utilizes classification and regression to detect and locate events across arbitrary seismic network geometries. We show that QNO successfully characterizes events where state-of-the-art phase picking fails. Applying QNO to the Geysers geothermal field, we identify nearly an order of magnitude more seismic detections than reported in routine catalogs. These results are validated through comparison with the Phase Neural Operator and visual inspection. QNO holds the potential to reveal undetected seismic activity, enhancing our understanding of subsurface processes critical to both natural phenomena and industry applications.",nature_html,0
"Retraction for Shaked and Frenkel, Curiouser and curiouser: Meningeal lymphoid structures in the aging brain",https://www.pnas.org/doi/abs/10.1073/pnas.2621866123?mi=eymic2&af=R&access=on&content=articlesChapters&publication=pnas&sortBy=Earliest&target=default,Proceedings of the National Academy of Sciences: Keyword search for query,2026-07-06 07:00:00 UTC,2026-07-06 07:00:00+00:00,10.1073/pnas.2621866123,,,,0
Small but mighty: The outsized role of small water bodies in the global carbon cycle,https://www.pnas.org/doi/abs/10.1073/pnas.2614198123?mi=eymic2&af=R&access=on&content=articlesChapters&publication=pnas&sortBy=Earliest&target=default,Proceedings of the National Academy of Sciences: Keyword search for query,2026-07-06 07:00:00 UTC,2026-07-06 07:00:00+00:00,10.1073/pnas.2614198123,Marcia N. Macedo,,,0
Magnetically actuated microrobotic system for sequential treatment of biofilm,https://www.pnas.org/doi/abs/10.1073/pnas.2535216123?mi=eymic2&af=R&access=on&content=articlesChapters&publication=pnas&sortBy=Earliest&target=default,Proceedings of the National Academy of Sciences: Keyword search for query,2026-07-06 07:00:00 UTC,2026-07-06 07:00:00+00:00,10.1073/pnas.2535216123,Sijia Feng,"Biofilm-associated infections present a critical therapeutic challenge due to antibiotic resistance and impaired tissue healing. Here, we present a microrobotic system (MZ-8) that integrates real-time human-steered navigation with autonomous, microenvironment-responsive therapy to actively eradicate biofilms and promote tissue regeneration. This microrobotic system features a spine-inspired structure for mechanical biofilm disruption, a pH-responsive ZIF-8 coating for immunomodulatory Zn
                    2+
                    release, and closed-loop actuation under second near-infrared fluorescence guidance. In a rat model of periprosthetic joint infection, MZ-8 achieved effective biofilm removal, induced a pro-regenerative immune response by polarizing macrophages toward the M2 phenotype, and significantly enhanced tissue regeneration. Transcriptomic analysis further revealed the activation of immunomodulatory pathways and upregulation of M2-associated genes, confirming the system’s sequential shift from eradication to repair. Moreover, validation in a rabbit model and human knee joint confirmed its operational feasibility under clinical imaging guidance and excellent biosafety. This work establishes that integrating physical eradication, biochemical immunomodulation, and interactive control within a single system is essential for advancing from infection clearance to functional tissue restoration. Thus, it provides a therapeutic paradigm for biofilm-associated diseases and lays a foundation for future intelligent, clinically adaptive anti-infective systems.",crossref,0
Energy costs of Hannibal’s alpine crossing,https://www.pnas.org/doi/abs/10.1073/pnas.2612764123?mi=eymic2&af=R&access=on&content=articlesChapters&publication=pnas&sortBy=Earliest&target=default,Proceedings of the National Academy of Sciences: Keyword search for query,2026-07-06 07:00:00 UTC,2026-07-06 07:00:00+00:00,10.1073/pnas.2612764123,Fritz Vollrath,"Hannibal crossed the Alps with a large army containing 37 war elephants in 218 BC. Details of his route have scholars regularly debate historical reports in the light of logistical and topographical considerations. Among the possible alpine passes, the route crossing at the Col du Clapier was considered the most likely candidate. Recent philological and geomorphological analyses suggest instead a route via the Col de la Traversette. Here, we examined these options focusing on the energy costs of the crossing with an emphasis on the war elephants. Our analysis favors the route of the Traversette while also providing possible insights into Hannibal’s thinking concerning both the logistics and psychology of elephant warfare.",crossref,0
"Long-term cultural continuity across the Neanderthal–modern human sequence at Üçağızlı II Cave, northern Levant",https://www.pnas.org/doi/abs/10.1073/pnas.2609061123?mi=eymic2&af=R&access=on&content=articlesChapters&publication=pnas&sortBy=Earliest&target=default,Proceedings of the National Academy of Sciences: Keyword search for query,2026-07-06 07:00:00 UTC,2026-07-06 07:00:00+00:00,10.1073/pnas.2609061123,Naoki Morimoto,"We present evidence from Üçağızlı II Cave in the northern Levant, Türkiye, documenting the sequential occupation by Neanderthals (
                    Homo neanderthalensis
                    ; 77–59 ka) and modern humans (
                    Homo sapiens
                    ; 59–47 ka). The combined evidence of human fossils, faunal and floral remains, lithics, and manuports demonstrates significant behavioral and technological continuity across this taxonomic sequence, characterized by consistent subsistence strategies and the persistent selection and transport of specific nondietary mollusk shells. The lithic assemblages largely align with late Middle Paleolithic traditions, exhibiting characteristic Mousterian variants. The association of diagnostic human fossils with these archaeological remains demonstrates that the shift from Neanderthals to modern humans occurred within a cultural continuum. Our findings suggest shared behaviors between Neanderthals and modern humans that extended beyond subsistence to include nonutilitarian behaviors within the specific geographic and temporal context studied here.",crossref,0
"Correction for Brodeur et al., AI-assisted teams outperform AI-led teams but not human-only teams in assessing research reproducibility in quantitative social science",https://www.pnas.org/doi/abs/10.1073/pnas.2621051123?mi=eymic2&af=R&access=on&content=articlesChapters&publication=pnas&sortBy=Earliest&target=default,Proceedings of the National Academy of Sciences: Keyword search for query,2026-07-06 07:00:00 UTC,2026-07-06 07:00:00+00:00,10.1073/pnas.2621051123,,,,0
Science in service: Behavioral research applications across federal agencies,https://www.pnas.org/doi/abs/10.1073/pnas.2608196123?mi=eymic2&af=R&access=on&content=articlesChapters&publication=pnas&sortBy=Earliest&target=default,Proceedings of the National Academy of Sciences: Keyword search for query,2026-07-06 07:00:00 UTC,2026-07-06 07:00:00+00:00,10.1073/pnas.2608196123,Baruch Fischhoff,,,0
