title,link,source,published_str,pub_date,doi,last_author,abstract,abstract_source,must_have_abstract
The role of supraoptic hypothalamic arginine vasopressin neurons in aging-associated water balance and thermoregulatory deficits in male mice,https://www.nature.com/articles/s41467-026-74819-x,Biological sciences : Nature Communications subject feeds,2026-06-27 00:00:00 UTC,2026-06-27 00:00:00+00:00,,Celine E. Riera,"Aging disrupts physiological homeostasis, impairing thermoregulation, metabolism, and water balance, but the underlying neural mechanisms remain unclear. Here, we identify arginine vasopressin (AVP) neurons in the supraoptic nucleus (SON) of the hypothalamus as a critical driver of these changes in male mice. Single-nucleus RNA-sequencing revealed Avp among the most upregulated neuronal transcripts with age. Aged SONAVP neurons displayed enlarged size and heightened excitability, features consistent with hyperactivity. Chemogenetic activation of SONAVP neurons in young mice reproduced aging-associated phenotypes including hypothermia, reduced energy expenditure, and suppressed water intake. Conversely, knockdown of Avp in the SON of aged mice restored water balance, partially improved thermoregulation and metabolism. Pharmacological studies demonstrated that neuroendocrine AVP signaling mediates these deficits through distinct contributions of V1A and V2 receptors. These findings identify SONAVP neurons as a central regulator of physiological aging and a potential therapeutic target for age-related homeostatic dysfunction.",nature_html,0
Bispecific antibody engineered extracellular vesicles redirect T cells to prevent postoperative epidural fibrosis,https://www.nature.com/articles/s41467-026-74883-3,Biological sciences : Nature Communications subject feeds,2026-06-27 00:00:00 UTC,2026-06-27 00:00:00+00:00,,Zheng Zhang,"Epidural fibrosis (EF) is a frequent and debilitating complication that impairs recovery following spinal surgery, yet effective targeted therapies are lacking. Here we observe enrichment of FAP⁺ fibroblasts at surgical sites in patients after laminectomy. To therapeutically target this subset, we develop bispecific antibody–decorated extracellular vesicles (BsAb EVs), which redirect endogenous T cells to eliminate FAP⁺ fibroblasts in situ. In a preclinical model, BsAb EVs selectively eliminate pathogenic fibroblasts, reduce fibrotic collagen accumulation, and prevent the development of postoperative epidural fibrosis without detectable systemic toxicity under the tested conditions. Single-cell RNA sequencing reveals that FAP⁺ fibroblasts represent a transcriptionally distinct subset from α-SMA⁺ myofibroblasts, characterized by enhanced extracellular matrix remodeling and TGF-β production. Together, these findings highlight a critical stromal subset in EF pathogenesis and position BsAb EVs as a promising immunotherapeutic strategy for targeting pathogenic stromal cells in fibrotic and tissue-remodeling disorders.",nature_html,0
Prediction error correlates in the striosome-dopamine circuit emerge from information gain,https://www.nature.com/articles/s41467-026-73994-1,Biological sciences : Nature Communications subject feeds,2026-06-27 00:00:00 UTC,2026-06-27 00:00:00+00:00,,Alexander Friedman,"The striosome compartments in the striatum gate cortical inputs to dopamine neurons, which then feed back to the striosomes and surrounding matrix. This loop underlies decision-making, learning, and movement. Dopamine signals strongly correlate with reward prediction errors (RPEs) in certain tasks. However, many dopaminergic responses, such as to high costs, novelty, aversive stimuli, and real-time movement guidance, do not align with RPE. Separately, information theory explains how dopamine responds to uncertainty and encodes when rewards are expected to occur. Here, we show that apparent RPE correlations arise mathematically from the information gain of the policy of actions (policy-IG). Policy-IG quantifies how much newly arriving information changes choice. In simple reward tasks, policy-IG reduces to classic RPEs, but it also predicts dopamine responses to aversive events, nonlinear reward scaling, novelty, movement, state valuation, and moment-by-moment decision control. Thus, RPE could be a special case of this more general function. We show that policy-IG is mathematically related to a range of information-centric, Bayesian, active inference, and casual association models, allowing those models to formally incorporate the experimental RPE literature in their support. Simulating impaired policy-IG replicates basal ganglia disorder features, suggesting policy-IG as a target for therapies.",nature_html,0
No cloning of quantum ensembles,https://www.nature.com/articles/s41467-026-74924-x,Physical sciences : Nature Communications subject feeds,2026-06-27 00:00:00 UTC,2026-06-27 00:00:00+00:00,,Xiao Yuan,"Modern quantum physics now enables control of quantum systems at the level of individual trajectories, opening a new frontier that links quantum information theory, quantum many-body physics, and quantum thermodynamics, and uncovers novel non-equilibrium phenomena such as deep thermalization and measurement-induced entanglement. However, a central challenge remains: their characterization relies on measuring nonlinear properties of individual quantum states, a task tantamount to fine-grained cloning of a quantum ensemble. Here, the fundamental laws governing the cloning of quantum ensembles are investigated. First, a general no-cloning theorem for arbitrary ensembles is established from an information-theoretic perspective, even assuming multiple copies of the ensemble’s purification. It is then shown that this barrier can be unexpectedly circumvented for physical ensembles generated by finite-time evolutions. Nevertheless, these tasks are proven to remain computationally intractable, even when the full circuit description of state preparation is known. This stands in sharp contrast to the conventional no-cloning theorem, which relies on the state being unknown. Together, these results establish new fundamental principles of quantum mechanics, reveal intrinsic trade-offs among sample complexity, computational complexity, and quantum measurements, and highlight the necessity of problem-specific strategies for probing measurement-induced quantum phenomena.",nature_html,0
Enhancing molecular property prediction of transformer models with dual graph representation,https://www.nature.com/articles/s41467-026-75005-9,Biological sciences : Nature Communications subject feeds,2026-06-27 00:00:00 UTC,2026-06-27 00:00:00+00:00,,Alexei A. Lapkin,"Accurate prediction of molecular properties is central to advancing chemistry, materials science, and drug discovery. Machine learning on molecular graphs depends critically on representations that capture the topology and structure of molecules. Here we propose the dual graph transformer (DGT), a self-attention architecture that jointly models atom and bond graphs to achieve comprehensive molecular encodings. DGT fuses atom and bond features, graph topology and structure, and stereogeometric information within its self-attention module for an effective molecular representation. We benchmark DGT across a range of datasets for molecular property prediction, showing that it considerably outperforms the current state of the art. DGT demonstrates performance contributions from its dual graph representation, relative positional and structural encodings, and stereogeometric information incorporation while also offering interpretability at the molecular structural level. We envision DGT advancing molecular machine learning by improving both the prediction accuracy and interpretability of molecular properties.",nature_html,0
Highly robust molecular information carriers for traceability of plastic materials,https://www.nature.com/articles/s41467-026-73889-1,Physical sciences : Nature Communications subject feeds,2026-06-27 00:00:00 UTC,2026-06-27 00:00:00+00:00,,Filip E. Du Prez,"Sequence-defined oligomers offer programmable molecular architectures with potential in data storage, authentication, and anticounterfeiting. However, their deployment in real-world materials has been constrained by their low scale, limited thermal resilience and the need for specialized analytical methods. Here we introduce a molecular tagging strategy based on abiotic sequence-defined oligoamides incorporated at ultralow concentrations (",nature_html,0
Probing mixed-state phases on a quantum computer via Renyi correlators and variational decoding,https://www.nature.com/articles/s41467-026-73814-6,Physical sciences : Nature Communications subject feeds,2026-06-27 00:00:00 UTC,2026-06-27 00:00:00+00:00,,Yijian Zou,"Recent advances have defined nontrivial phases of matter in open quantum systems such as many-body quantum states subject to environmental noise. In this work, we experimentally probe and characterize mixed-state phases on Quantinuum’s H1 quantum computer using two measures: Renyi correlators and the coding performance of a quantum error-correcting code associated with the phase. As a concrete example, we probe the low-energy states of the critical transverse field Ising model under different dephasing noise channels. First, we employ shadow tomography to extract a newly proposed Renyi correlator in two distinct phases obtained by applying two different channels, observing one with faster decay and the other with slower decay. Second, we investigate the decoding fidelity of the associated quantum error-correcting code using a variational quantum circuit. We find that a shallow circuit of depth-3 is sufficient to distinguish the above-mentioned two mixed-state phases, up to L = 24. Experimentally, we observe this distinction for system sizes up to L = 8 with a depth-1 decoder. Our work is a proof of concept for the quantum simulation and characterization of mixed-state phases.",nature_html,0
Chronic suppression of a multidrug-resistant Pseudomonas aeruginosa in prosthetic joint infection using personalized bacteriophage treatment,https://www.nature.com/articles/s41467-026-74326-z,Biological sciences : Nature Communications subject feeds,2026-06-27 00:00:00 UTC,2026-06-27 00:00:00+00:00,,Kenneth L. Urish,"Multidrug resistant (MDR) bacterial infections without antibiotic options are a public health emergency. Infections associated with medical implants serve as an example. Conventional antibiotics have limited ability to eradicate these infections as they are associated with antibiotic-tolerant biofilms. Here, we report the use of bacteriophage therapy for the treatment of a MDR, non-operable Pseudomonas aeruginosa periprosthetic joint infection that had failed multiple antibiotic and surgical interventions. Treatment with intermittent bacteriophage therapy alone without antibiotics over a 2 year time period resulted in clinical resolution of the infection, but not microbiological eradication. Bacteriophage therapy established this control, in part, by altering virulence as defined by disease severity and symptoms and disrupting biofilm. Whole genome sequencing demonstrated the continued presence of bacteriophage during treatment. This provides preliminary evidence that bacteriophage therapy can be used to treat MDR infections in salvage cases when surgical and antibiotic options do not exist.",nature_html,0
Metal-center electron affinity modulates multicolor electrochromism in 2D conjugated metal-organic frameworks,https://www.nature.com/articles/s41467-026-74941-w,Physical sciences : Nature Communications subject feeds,2026-06-27 00:00:00 UTC,2026-06-27 00:00:00+00:00,,John Wang,"Two-dimensional conjugated metal-organic frameworks are emerging platforms for electrochromic devices, yet the current stage is limited by monotonous color and an unclear coloration mechanism. While prior studies emphasize the ligand-centered redox process, the role of metal centers is often overlooked. Herein, we report a metal-center electron-affinity mechanism that is critical to electrochromic performance. We first employ an unsupervised machine learning method to screen divalent metal-catecholate (CAT) systems, identifying Zn, Ni, and Cu as optimal candidates. All three systems exhibit multicolor transitions from green to blue and eventually to purple; however, Zn- and Ni-CAT-1 significantly outperform Cu-CAT-1, with nearly threefold faster switching speeds (4.8/5.4 vs. 14.4 s) and cycling stability enhanced by two orders of magnitude ( > 20000 vs. 2+ (3d9) possesses a redox-active configuration that favors electron affinity, thereby requiring additional electron participation and a higher energy demand than the relatively inert Ni2+ (3d8) and Zn2+ (3d10). This valence variation also induces stronger metal-oxygen coupling, ultimately leading to slower redox kinetics and structural degradation. As proof of concept, we demonstrate the applicability of these findings to camouflage, displays, and wearables for designing multicolor electrochromic devices.",nature_html,0
Hyperbranched dielectric polymer networks exhibiting giant energy storage density at 250 °C,https://www.nature.com/articles/s41467-026-74830-2,Physical sciences : Nature Communications subject feeds,2026-06-27 00:00:00 UTC,2026-06-27 00:00:00+00:00,,Qi Li,"Harsh-environment requirements of electrical and electronic systems demand advanced dielectrics with high energy storage density at elevated temperatures. Heat-resistant polymers are usually designed with densely packed molecular chains to maintain structural integrity. Unfortunately, the narrowed inter-chain spacing causes severe charge transfer under high electro-thermal fields, prohibiting capacitive energy storage beyond 200 °C. Here we report hyperbranched dielectric polymer networks as a solution to the persistent challenge. The hyperbranched topological junctions not only transform the linear polymer chains into a robust network to tolerate thermal stress, but also expand the inter-chain spacing to inhibit charge transfer. Results suggest that the hyperbranched networks exhibit suppressed secondary chain relaxation alongside expanded free volume. Moreover, the customizable chemical structure of hyperbranched centers renders this method general to capacitive polymer design. The hyperbranched polymer networks exhibit an exceptionally high discharged energy density of 4.9 J/cm3 above 90% efficiency at 250 °C, surpassing the existing polymeric dielectrics.",nature_html,0
Large‐Area 2D Metasurface‐Based Triboelectric E‐Skin Arrays: Contact & Proximity Tactile Mapping with Broadband Acoustic Readouts (Adv. Mater. 36/2026),https://advanced.onlinelibrary.wiley.com/doi/10.1002/adma.73715?af=R,Wiley: Advanced Materials: Table of Contents,2026-06-27 14:55:55 UTC,2026-06-27 14:55:55+00:00,10.1002/adma.73715,Amit Das,"Large-Area 2D Metasurface-Based Triboelectric E-Skin Arrays An engineered triboelectric metasurface enables multimodal sensing of tactile pressure, inductive non-contact stimuli, and broadband acoustic waves. By integrating microstructured active pixels into a conformable electronic skin, the dielectric metasurface achieves spatially resolved transduction of mechanical and field-mediated inputs for advanced human-machine interfaces. More details can be found in the Research Article by Injamamul Arief and co-workers (DOI: 10.1002/adma.202521525).",openalex,0
Digital Microneedles for Multiplexed Transdermal Sensing via Fluorescent QR Codes (Adv. Mater. 36/2026),https://advanced.onlinelibrary.wiley.com/doi/10.1002/adma.73716?af=R,Wiley: Advanced Materials: Table of Contents,2026-06-27 14:55:55 UTC,2026-06-27 14:55:55+00:00,10.1002/adma.73716,Giuseppe Barillaro,"Digital Microneedles for Multiplexed Transdermal Sensing Digital microneedles convert biochemical signals in skin into binary fluorescent outputs that assemble into scannable QR codes. By transforming analog chemistry into on-off fluorescence states, digital microneedles enables calibration-free, multiplexed transdermal biosensing and establishes a digital paradigm for decentralized health monitoring. More details can be found in the Research Article by Giuseppe Barillaro and co-workers (DOI: 10.1002/adma.202518935).",openalex,0
Intelligent Acousto‐Electrical Metamaterials (IAM) for Sound Source Detection (Adv. Mater. 36/2026),https://advanced.onlinelibrary.wiley.com/doi/10.1002/adma.73717?af=R,Wiley: Advanced Materials: Table of Contents,2026-06-27 14:55:55 UTC,2026-06-27 14:55:55+00:00,10.1002/adma.73717,Xiaoyu (Rayne) Zheng,"Intelligent Acousto-Electrical Metamaterials This cover illustrates an architected piezoelectric hydrophone composed of distinct 3D micro-architectures. Unlike traditional crystals, these Intelligent Acousto-Electrical Metamaterials dynamically program piezoelectricity through geometry rather than chemistry. This structural variety yields unique electromechanical responses, enabling a single device to perform real-time, automatic sound localization of diverse underwater targets, such as marine wildlife and submerged vehicles, thereby advancing next-generation acoustic sensing. More details can be found in the Research Article by Xiaoyu (Rayne) Zheng, Victor Couëdel, and co-workers (DOI: 10.1002/adma.202513205).",openalex,0
The Resolution–Throughput Conflict In Material Extrusion Additive Manufacturing (Adv. Mater. 36/2026),https://advanced.onlinelibrary.wiley.com/doi/10.1002/adma.73718?af=R,Wiley: Advanced Materials: Table of Contents,2026-06-27 14:55:55 UTC,2026-06-27 14:55:55+00:00,10.1002/adma.73718,Jochen Mueller,"From Microscale Architected Features to Large Structural Prints This frontispiece captures the fundamental resolution–throughput tradeoff in material extrusion additive manufacturing. The flowing multiscale paths represent the interplay of material behavior, transport, and print architecture, emphasizing emerging system-level approaches that could decouple precision and speed to enable robust manufacturing across diverse materials and scales. More details can be found in the Research Article by Jochen Mueller (DOI: 10.1002/adma.73039).",openalex,0
In‐situ p‐Doping of Nanometer Tellurium‐based Oxide for Room‐Temperature CMOS Circuits (Adv. Mater. 36/2026),https://advanced.onlinelibrary.wiley.com/doi/10.1002/adma.73719?af=R,Wiley: Advanced Materials: Table of Contents,2026-06-27 14:55:55 UTC,2026-06-27 14:55:55+00:00,10.1002/adma.73719,Ao Liu,"Room-Temperature CMOS Circuits A room-temperature in-situ redox strategy enables intrinsic p-doping of nanometer tellurium-based oxide films by creating tunable Te conductive channels within an oxide matrix. The resulting p-type transistors exhibit high mobility and broadly tunable carrier density, and can be monolithically integrated with n-type oxide devices to realize fully room-temperature all-oxide CMOS circuits. More details can be found in the Research Article by Ao Liu, Mingyang Wang, Huihui Zhu, Yong-Young Noh, and co-workers (DOI: 10.1002/adma.72813).",openalex,0
Spectrally selective c-Si agrivoltaic modules: Evaluating a new approach,https://www.sciencedirect.com/science/article/pii/S0306261926009207?dgcid=rss_sd_all,ScienceDirect Publication: Applied Energy,2026-06-28 00:00:00 UTC,2026-06-28 00:00:00+00:00,,Timothy W. Schmidt,,,0
Deep learning-based health monitoring and prognostics for nuclear power plants: a systematic review,https://www.sciencedirect.com/science/article/pii/S0306261926009062?dgcid=rss_sd_all,ScienceDirect Publication: Applied Energy,2026-06-28 00:00:00 UTC,2026-06-28 00:00:00+00:00,,Xuefeng Chen,,,0
Wind power forecasting with deep representation: A survey,https://www.sciencedirect.com/science/article/pii/S0306261926007580?dgcid=rss_sd_all,ScienceDirect Publication: Applied Energy,2026-06-28 00:00:00 UTC,2026-06-28 00:00:00+00:00,,Haibin Zhang,,,0
Spatiotemporal supply-demand matching in residential building rooftop photovoltaics (PV) under climate change: a cross-climate zone assessment,https://www.sciencedirect.com/science/article/pii/S0306261926008640?dgcid=rss_sd_all,ScienceDirect Publication: Applied Energy,2026-06-28 00:00:00 UTC,2026-06-28 00:00:00+00:00,,Jian Zuo,,,0
Enhancing current distribution estimation in parallel battery modules using neural network ensembles,https://www.sciencedirect.com/science/article/pii/S0306261926008962?dgcid=rss_sd_all,ScienceDirect Publication: Applied Energy,2026-06-28 00:00:00 UTC,2026-06-28 00:00:00+00:00,,Limei Wang,,,0
Dynamic responses of wind turbines under unwaked and waked conditions,https://www.sciencedirect.com/science/article/pii/S0306261926009098?dgcid=rss_sd_all,ScienceDirect Publication: Applied Energy,2026-06-28 00:00:00 UTC,2026-06-28 00:00:00+00:00,,Zheng Li,,,0
Prediction of high-frequency resistance for automotive PEMFC stacks using a Bayesian-optimized LSTM-XGBoost fusion model,https://www.sciencedirect.com/science/article/pii/S030626192600872X?dgcid=rss_sd_all,ScienceDirect Publication: Applied Energy,2026-06-28 00:00:00 UTC,2026-06-28 00:00:00+00:00,,Zixuan Cheng,,,0
Steady-state dynamics of an offshore hybrid wind-wave energy conversion system,https://www.sciencedirect.com/science/article/pii/S0306261926008810?dgcid=rss_sd_all,ScienceDirect Publication: Applied Energy,2026-06-28 00:00:00 UTC,2026-06-28 00:00:00+00:00,,Feifei Cao,,,0
Integrated multiscale modeling and coordinated balance-of-plant optimization to maximize vehicle system efficiency in a heavy-duty fuel cell electric vehicle,https://www.sciencedirect.com/science/article/pii/S0306261926009128?dgcid=rss_sd_all,ScienceDirect Publication: Applied Energy,2026-06-28 00:00:00 UTC,2026-06-28 00:00:00+00:00,,Kyoungdoug Min,,,0
Physics-informed neural networks for wind turbine wake prediction: Constraint hierarchy under varying data density,https://www.sciencedirect.com/science/article/pii/S0306261926008901?dgcid=rss_sd_all,ScienceDirect Publication: Applied Energy,2026-06-28 00:00:00 UTC,2026-06-28 00:00:00+00:00,,Yong Jiang,,,0
A stochastic simulation framework for EV charging station dynamic pricing with leader-driven dream optimization algorithm,https://www.sciencedirect.com/science/article/pii/S0306261926008998?dgcid=rss_sd_all,ScienceDirect Publication: Applied Energy,2026-06-28 00:00:00 UTC,2026-06-28 00:00:00+00:00,,YuanBin Mo,,,0
Digital twin-driven deep reinforcement learning for coordinated scheduling and state prediction of distributed energy storage clusters,https://www.sciencedirect.com/science/article/pii/S0306261926009049?dgcid=rss_sd_all,ScienceDirect Publication: Applied Energy,2026-06-28 00:00:00 UTC,2026-06-28 00:00:00+00:00,,Li Zhou,,,0
Adaptive risk-difference-based network pricing for shared energy storage in distribution networks,https://www.sciencedirect.com/science/article/pii/S0306261926009153?dgcid=rss_sd_all,ScienceDirect Publication: Applied Energy,2026-06-28 00:00:00 UTC,2026-06-28 00:00:00+00:00,,Siyu Ma,,,0
"How geopolitical risks, green finance, and environmental technologies dynamics shape energy trilemma in BRICS economies?",https://www.sciencedirect.com/science/article/pii/S0301421526003873?dgcid=rss_sd_all,ScienceDirect Publication: Energy Policy,2026-06-28 00:00:00 UTC,2026-06-28 00:00:00+00:00,,Daniel Balsalobre-Lorente,,,0
Alleviating energy poverty through grid modernization: Micro-evidence from China's ultra-high-voltage transmission projects,https://www.sciencedirect.com/science/article/pii/S030142152600385X?dgcid=rss_sd_all,ScienceDirect Publication: Energy Policy,2026-06-28 00:00:00 UTC,2026-06-28 00:00:00+00:00,,Xin Zhao,,,0
Reconciling fiscal resilience with low-carbon energy goals: Sri Lanka's carbon-aligned fuel pricing,https://www.sciencedirect.com/science/article/pii/S0301421526003927?dgcid=rss_sd_all,ScienceDirect Publication: Energy Policy,2026-06-28 00:00:00 UTC,2026-06-28 00:00:00+00:00,,HyeMin Park,,,0
Dynamic degradation mechanisms of PEM water electrolysis membrane electrode assembly under multiple operating conditions,https://www.sciencedirect.com/science/article/pii/S0306261926008755?dgcid=rss_sd_all,ScienceDirect Publication: Applied Energy,2026-06-28 00:00:00 UTC,2026-06-28 00:00:00+00:00,,Depeng Kong,,,0
