title,link,source,published_str,pub_date,doi,last_author,abstract,abstract_source,must_have_abstract
Transparency‐Photothermal Efficiency Coordinated Dual‐Invisible Soft Robots,https://advanced.onlinelibrary.wiley.com/doi/10.1002/adma.74147?af=R,Wiley: Advanced Materials: Table of Contents,2026-07-17 10:31:25 UTC,2026-07-17 10:31:25+00:00,10.1002/adma.74147,Jiatao Zhang,"ABSTRACT
                  Soft robots capable of seamless environmental integration and unobtrusive operation are essential for covert monitoring, camouflage, and preserving optical integrity. Near‐infrared (NIR) photo‐actuation offers an ideal route for invisible control; however, it is traditionally governed by a fundamental trade‐off where strong photo‐responses necessitate dark materials and high filler loadings that compromise transparency. Here, we report a system achieving spectral decoupling of visible transparency and photothermal responsiveness through interfacial engineering of two‐dimensional atomically thin CuS (AT–CuS) nanosheets to form a stable monolayer dispersion in the polymer matrix. Such material reaches a record‐breaking photothermal efficiency of 96.3% in the NIR‐II window. At an ultralow loading of 0.01 wt % At‐CuS, the composite maintains over 80% visible‐light transmittance while exhibiting rapid NIR responses (&gt;130°C within 2 s). We further demonstrate “dual‐invisible” soft robots with imperceptible bodies and hidden NIR control, where the body and the NIR control signal remain imperceptible, performing agile amphibious locomotion.",crossref,0
Self‐Limiting Ultrathin Heterocycle‐Bridged Interface Enabling Efficient p–i–n PbS Quantum Dot Solar Cells,https://advanced.onlinelibrary.wiley.com/doi/10.1002/adma.74170?af=R,Wiley: Advanced Materials: Table of Contents,2026-07-17 10:47:17 UTC,2026-07-17 10:47:17+00:00,10.1002/adma.74170,Wanli Ma,"ABSTRACT
                  
                    Hole‐transporting self‐assembled monolayers (SAMs) have driven rapid efficiency gains in solution‐processed p–i–n solar cells over the past few years. By contrast, while efficient electron extraction is equally crucial for device operation, electron‐transporting SAMs remain scarcely explored, thereby constraining further improvements in device performance. Here, we present an electron‐extraction‐modulating self‐limiting ultrathin molecular layer strategy for PbS quantum dot (QD) solar cells. The designed thiophene‐based molecules feature thiol anchors that coordinate with surface Pb
                    2
                    +
                    ions to suppress nonradiative recombination, while their electron‐rich aromatic rings engage in π–π interactions with the top C
                    60
                    layer to enhance electron extraction. Critically, their high volatility enables the removal of excess molecules during annealing, yielding a compact, ultrathin molecular modification at the interface. This interface engineering delivers a power conversion efficiency of 14.47% in p–i–n PbS QD solar cells‐the highest value reported to date. These results provide a robust and scalable pathway for applying self‐limiting ultrathin molecular layer as a powerful paradigm for interfacial design.",crossref,0
Orbital and Spin Edelstein Effects in KTaO3(110) Two‐Dimensional Electron Gases,https://advanced.onlinelibrary.wiley.com/doi/10.1002/adma.73899?af=R,Wiley: Advanced Materials: Table of Contents,2026-07-17 11:09:10 UTC,2026-07-17 11:09:10+00:00,10.1002/adma.73899,Manuel Bibes,"ABSTRACT
                  The orbital Edelstein effect converts an electric field into a non‐equilibrium orbital polarization, opening new opportunities for orbitronics. Although signatures of the orbital Edelstein effect have been reported, its microscopic mechanisms and quantitative validation remain underexplored. Here, by directly linking the atomic structure of (110) two‐dimensional electron gases to both their calculated and measured electronic band dispersions, we predict and provide experimental evidence for a significant orbital Edelstein contribution that governs the anisotropy of its harmonic transport response. Scanning transmission electron microscopy and electron energy‐loss spectroscopy resolve the interfacial atomic configuration, which is used as input for density‐functional calculations. Angle‐resolved photoemission spectroscopy then confirms the resulting band structure, which is fitted by a tight‐binding model enabling computation of the spin and orbital Edelstein responses. Harmonic magnetotransport measurements reveal an anisotropic response that cannot be accounted for within a purely spin Edelstein framework, and is quantitatively reproduced by including an orbital contribution of order 20%. Our results establish (110) as a model platform for orbitronics and demonstrate a pathway to generate and harness orbital polarization in quantum oxide systems while also offering new insights into pairing mechanisms in their superconducting state.",crossref,0
Chessboard Microneedle Array for Inflammation Regulation via Spatiotemporally Controlled Drug Delivery,https://advanced.onlinelibrary.wiley.com/doi/10.1002/adma.74168?af=R,Wiley: Advanced Materials: Table of Contents,2026-07-17 11:10:55 UTC,2026-07-17 11:10:55+00:00,10.1002/adma.74168,Haisheng Qian,"ABSTRACT
                  Excessive production of reactive oxygen species during photodynamic therapy (PDT) can exacerbate inflammation at the infection site and increase the risk of tumor metastasis, thereby posing significant challenges to treatment efficacy. In this study, a chessboard‐structured microneedle patch (HPC@PCN CMN) was designed using a micromolding technique. This design spatially separates and encapsulates photosensitizers and antioxidants within distinct fast‐ and sustained‐release microneedle systems, respectively, thereby achieving spatiotemporally ordered control of PDT and anti‐inflammatory treatment. Additionally, by adjusting the crosslinking degree of hyaluronic acid, the release rate of antioxidant drugs can be regulated, which facilitates a prolonged anti‐inflammatory effect. The results indicate that the anti‐inflammatory process of HPC@PCN CMN can alleviate inflammation by inhibiting the ATP‐P2RX4 pathway, demonstrating promising efficacy in the treatment of acne and melanoma. Overall, the developed chessboard microneedle platform is programmable, enabling not only the sequential regulation of oxidation‐antioxidation but also the potential for broader applications in drug‐delivery scenarios.",crossref,0
Hierarchical Assembly of Multilayer Core–Shell DNA Origami Crystals,https://advanced.onlinelibrary.wiley.com/doi/10.1002/adma.74163?af=R,Wiley: Advanced Materials: Table of Contents,2026-07-17 11:13:51 UTC,2026-07-17 11:13:51+00:00,10.1002/adma.74163,Ye Tian,"ABSTRACT
                  
                    A multilayer core–shell architecture capable of selectively capturing distinct nanomaterials into a predetermined layer is anticipated to facilitate multifunctional isolation or cascade processes at the microscale. However, fabricating single‐crystal architectures featuring numerous shells with intricate distribution patterns remains challenging. In this study, we employed DNA nanotechnology to construct microscale multilayer core–shell DNA origami crystals. The internal layers exhibit tunable properties, including size, quantity, self‐similarity, and morphology. The shell size can be regulated from 700 to 1800 µm
                    3
                    , and the layer quantity can be extended to five. We also fabricated eight distinct crystals exhibiting non‐self‐similarity and two types of heteromorphic core–shell crystals. Each layer has operational independence, allowing the customized capture of nanomaterials and implementation of compartmentalized reactions. These multilayer core–shell crystals have potential for serving as compartmentalization templates for functional units, which may provide possibilities for simulating cell work or constructing artificial organelles.",crossref,0
Upcycling of Silicone Rubber into Value‐Added Polyborosiloxane via Boron‐Assisted Mechanochemistry,https://advanced.onlinelibrary.wiley.com/doi/10.1002/adma.74158?af=R,Wiley: Advanced Materials: Table of Contents,2026-07-17 11:14:40 UTC,2026-07-17 11:14:40+00:00,10.1002/adma.74158,Jinrong Wu,"ABSTRACT
                  Silicone rubber is indispensable in modern life owing to its exceptional thermal resistance, chemical inertness and long‐term stability. However, the robustness of its Si–O–Si backbone makes it among the most difficult materials to recycle, leading to persistent waste accumulation and serious environmental concerns. Herein, we report a boron‐assisted thermomechanical scission (BATS) upcycling strategy that directly converts crosslinked silicone rubber waste into high‐value polyborosiloxane (PBS), a classic strain‐rate‐responsive material known as Silly Putty. Under mild conditions, BATS cleaves Si–O–Si backbones and reconstructs them into dynamic Si–O–B linkages, transforming silicone rubber waste into a high‐value dynamic polymer through a solvent‐free, byproduct‐free process. Because this boron‐assisted scission process acts directly on siloxane chains, it is broadly applicable to diverse silicone rubber wastes and can be implemented using conventional polymer‐processing equipment. Moreover, the resulting PBS exhibits practical utility in impact protection and rate‐responsive sensing. To the best of our knowledge, the BATS strategy appears to be the first example of direct polymer‐to‐polymer upcycling of silicone rubber waste into a substantially higher‐value material. This work establishes a general, scalable, and sustainable polymer‐to‐polymer upcycling platform for silicone rubber waste and offers a promising strategy for advancing a circular organosilicon economy.",crossref,0
21.26% Efficiency Organic Solar Cells Enabled by Mixed Self‐Assembled Multilayers,https://advanced.onlinelibrary.wiley.com/doi/10.1002/adma.74193?af=R,Wiley: Advanced Materials: Table of Contents,2026-07-17 11:26:30 UTC,2026-07-17 11:26:30+00:00,10.1002/adma.74193,Menglan Lv,"ABSTRACT
                  Insufficient surface coverage persists as a critical limitation for self‐assembled monolayers/multilayers (SAMs/SAMULs) in photovoltaic field. The co‐assembled SAMULs (Co‐SAMULs) strategy, which incorporates a guest self‐assembled molecule, offers an effective solution. However, the working mechanism of the guest molecule is still not fully understood. Herein, benzo[b]thien‐2‐ylboronic acid (BBA) was introduced as a guest material into the host molecule system based on (4‐(3,6‐di(thiophen‐3‐yl)‐9H‐carbazol‐9‐yl)butyl) phosphonate (4PAThCz) to construct efficient Co‐SAMULs. We found that BBA can fused into 4PAThCz micelles rather than forming individual micelles, respectively, thereby inhibiting micelle growth. During the film‐forming process, BBA engages in synergistic adsorption with the host molecules, selectively fills the voids between host molecule and substantially improving surface coverage. Such a homogeneous and high‐quality film effectively suppresses surface defect states, enhances interfacial charge transport capacity and minimizes non‐radiative exciton recombination. As a result, a champion power conversion efficiency (PCE) of 21.26% (certificated as 20.79%) with an outstanding fill factor (FF) of 83.54% is achieved, representing the highest performances reported for organic solar cells (OSCs) to date.",crossref,0
Emissive BN‐Embedded Cumulenes: Synthesis and Bidirectional Photocurrent Modulation,https://onlinelibrary.wiley.com/doi/10.1002/anie.7973657?af=R,Wiley: Angewandte Chemie International Edition: Table of Contents,2026-07-17 12:12:17 UTC,2026-07-17 12:12:17+00:00,10.1002/anie.7973657,Rong Zhu,"ABSTRACT
                  
                    Embedding boron and nitrogen (BN) units into π‐conjugated frameworks provides an effective strategy to tune electronic structures by introducing intrinsic orbital polarization arising from the vacant p orbital of boron and the lone pair of nitrogen. While BN‐embedding has been extensively explored in C(sp
                    2
                    ) polyaromatic hydrocarbons (PAHs), its impact on the optoelectronic properties of C(sp)‐rich systems remains underexplored. Here we report air‐ and moisture‐stable BN‐capped sp‐carbon chains that are isoelectronic to [3]‐ and [5]cumulenes (
                    [n]BN
                    ,
                    n
                    = 3, 5). Structural and spectroscopic analyses reveal that BN‐embedding induces pronounced polarization and localizes the high‐frequency skeletal vibrations. Consequently,
                    [n]BN
                    exhibit excimer‐like solid‐state fluorescence, whereas the all‐carbon counterparts remain weakly or non‐emissive. Leveraging the characteristics of excited‐state charge separation and asymmetric carrier injection, heterojunction optoelectronic devices incorporating
                    [3]BN
                    display unique bidirectional photocurrent modulation, establishing BN‐embedding as an effective strategy to tune the electronic structure and emergent functions of C(sp)‐rich systems.",crossref,0
Encoding and Encryption via Dual‐Wavelength 3D Digital Light Processing,https://onlinelibrary.wiley.com/doi/10.1002/anie.1978756?af=R,Wiley: Angewandte Chemie International Edition: Table of Contents,2026-07-17 12:14:46 UTC,2026-07-17 12:14:46+00:00,10.1002/anie.1978756,Eva Blasco,"ABSTRACT
                  Additive manufacturing of multi‐responsive materials is opening new opportunities in a wide range of applications, including information storage, security, and sensing. Herein, complex structures enabling both the encoding and encryption of information in three dimensions (3D) are achieved by combining photo‐ and pH‐responsive chromophores, spiropyran and phenolphthalein derivatives, respectively, within a single ink formulation. To this end, a multi‐wavelength digital light processing (DLP) system is employed to fabricate initially colorless structures using a 405 nm wavelength LED to trigger the photopolymerization process. In parallel, a 365 nm wavelength LED integrated into the same system can induce locally controlled isomerization of spiropyran to the colored merocyanine, enabling information encoding in 3D in a layer‐by‐layer fashion. The stored information can be reversibly encrypted on demand via pH variation. The pH‐responsive chromophore, phenolphthalein, enables modulation of optical contrast, rendering the encoded patterns temporarily unreadable. This work opens new pathways toward engineering multi‐responsive functionality in complex 3D architectures.",crossref,0
A Chemically Fueled Logic Gate With Temporally Programmable Output Delays by Harnessing Transient States of One Molecule in Two Independent Reaction Pathways,https://onlinelibrary.wiley.com/doi/10.1002/anie.5439859?af=R,Wiley: Angewandte Chemie International Edition: Table of Contents,2026-07-17 12:15:42 UTC,2026-07-17 12:15:42+00:00,10.1002/anie.5439859,Yunfeng Li,"ABSTRACT
                  Temporal output delays in logic gates are ubiquitous in biological systems, especially in the nervous system, which sustains the signal transmission with enhanced computational complexity and transmission accuracy. However, temporally programmable output delays in chemically fueled logic gates (CFLGs) have not been achieved in an artificial system. Here, we report a bioinspired CFLG with programmable time delays of the output signal by harnessing transient states of the same molecule in two independent reaction networks. The CFLGs show programmable transient states by regulating reaction networks of urea‐urease and adenosine triphosphate and potato apyrase, respectively. Notably, a transient state with delayed output emerges, mimicking the signal processing in the synaptic delay of biological systems. A self‐destructive information encryption with enhanced coding capacity and safety is achieved in the arrays of CFLGs with spatiotemporally programmable output states. The findings in this work expand the range of non‐equilibrium soft materials and will accelerate the development of innovative materials that can execute exquisite logic functions with enhanced coding capacity and biomimetic time delays.",crossref,0
Protonation‐Gated Orthogonal Control of Highly Efficient Molecular Motors With Broad Visible‐Light Responsiveness,https://onlinelibrary.wiley.com/doi/10.1002/anie.4214875?af=R,Wiley: Angewandte Chemie International Edition: Table of Contents,2026-07-17 12:17:33 UTC,2026-07-17 12:17:33+00:00,10.1002/anie.4214875,Ben L. Feringa,"ABSTRACT
                  Molecular motors with red‐shifted absorption are highly attractive for biomedical applications, yet remain challenging to realize because conventional strategies for extending excitation wavelengths often compromise photochemical efficiency and directional motor function. Here, we report a protonation‐gated strategy in which reversible modulation of conjugation topology enables state‐dependent molecular motor operation across a broad visible‐light window. Modifying coumarin‐derived overcrowded alkenes with benzazole substituents, the resulting motors undergo efficient photoisomerization under blue–green light irradiation. Photophysical studies supported by DFT calculations reveal that protonation induces a pronounced conformational inversion with the formation of intramolecular hydrogen bonds, thereby promoting molecular planarization and enhanced electronic delocalization, leading to the efficient photoisomerization under 530–600 nm irradiation while quantitative photoconversion is retained. Overall, these findings establish reversible protonation as a powerful chemical gating strategy to expand the visible‐light responsiveness of the motor without permanent structural modification, paving the way for its application in multimodal responsive bioimaging and advanced optical devices.",crossref,0
Andrej Emanuel Cotman,https://onlinelibrary.wiley.com/doi/10.1002/anie.6798392?af=R,Wiley: Angewandte Chemie International Edition: Table of Contents,2026-07-17 12:19:53 UTC,2026-07-17 12:19:53+00:00,10.1002/anie.6798392,Andrej Emanuel Cotman,"""I chose chemistry as a career because I like hexagons, but I am afraid of bees… I advise my students to listen to my advice but not to obey it. Instead, they should find a better way…"" Find out more about Andrej Emanuel Cotman in his Introducing… Profile.",openalex,0
"Reactant‐Sustained Dynamically Stable Interfacial Hydrogen‐Bond Network for Highly Selective, Ampere‐Level Ethylene Glycol Electrooxidation",https://onlinelibrary.wiley.com/doi/10.1002/anie.7083269?af=R,Wiley: Angewandte Chemie International Edition: Table of Contents,2026-07-17 12:19:58 UTC,2026-07-17 12:19:58+00:00,10.1002/anie.7083269,Junyi Ji,"ABSTRACT
                  
                    The catalyst‐electrolyte interfacial microenvironment fundamentally governs the activity and selectivity of electrochemical reactions. However, engineering a dynamically stable interface capable of sustaining continuous reactant delivery and facilitating proton‐coupled electron transfer remains challenging, particularly under ampere‐level current densities. Herein, a reactant‐enhanced hydrogen‐bond network constructed on an ultrathin metal‐organic framework (MOF)‐derived electrocatalyst (Co‐PET@NF) enables highly selective ethylene glycol electrooxidation (EGOR). Mechanistic investigations reveal that abundant exposed unsaturated Co sites promote preferential EG adsorption for increased EG surface coverage and accelerated replenishment dynamics, ensuring the connectivity and integrity of the interfacial hydrogen‐bond network. This dynamically reinforced network facilitates rapid proton transfer from the catalyst surface into the bulk electrolyte, stabilizing the dehydrogenated active sites while preserving a localized alkaline surface microenvironment. Consequently, Co‑PET@NF achieves a high Faradaic efficiency for formate (FE
                    FA
                    ) of 92.8% at 1.0 A cm
                    −2
                    . In a coupled hydrogen co‑production system, the cell voltage is reduced by 260 mV at 1.0 A cm
                    −2
                    compared to water electrolysis, with stable operation over 120 h while delivering an FE
                    FA
                    of 96.9%. Moreover, this mechanism can be extended to other alcohol‐based substances (e.g., methanol and glycerol), elucidating the importance of reactant‐catalyst interfacial hydrogen‐bond interactions in steering alcohol oxidation selectivity and providing a sustainable strategy for biomass and plastic upgrading.",crossref,0
Theoretical Screening and Structural Optimization of High‐Performing Li2S/Alkaline‐Earth Metal Sulfides Cathodes for Advanced Anode‐Free Li−S Batteries,https://onlinelibrary.wiley.com/doi/10.1002/anie.7062131?af=R,Wiley: Angewandte Chemie International Edition: Table of Contents,2026-07-17 12:22:11 UTC,2026-07-17 12:22:11+00:00,10.1002/anie.7062131,Guoqiang Tan,"ABSTRACT
                  
                    Anode‐fre Li−S batteries can achieve extremely high energy density and excellent intrinsic safety by circumventing the direct use of metallic Li. However, the actual output performance is largely constrained by sluggish reaction kinetics and severe structural deterioration of Li
                    2
                    S cathode. Here, we report an anchor‐encapsulated nanostructure cooperated with alkaline‐earth metal sulfides’ catalysis to promote Li
                    2
                    S kinetics and simultaneously stabilize sulfur species. DFT calculations are first implemented to screen out an optimized MgS electrocatalyst, then a synthetic paradigm of metallothermic‐sulfidation‐carbonization via burning LiMg alloy in CS
                    2
                    vapor is proposed to in situ construct Li
                    2
                    S‐MgS@graphene nanocapsules. Systematic studies reveal its integrated anchor‐encapsulated structure and synergistic physicochemical interactions among three key components: robust C−S bonding facilitates fast electron/ion transport and stable interface, compact graphene encapsulation alleviates volume change and electrolyte's erosion, and symbiotic MgS bears excellent electrocatalytic effect on Li
                    2
                    S dissociation, greatly reducing activation barrier. Owing to the improvement on electrical, catalytic and volumetric properties, this cathode design enables promising electrochemical performance. It demonstrates a great potential for anode‐free Li−S battery and Li
                    2
                    S‐MgS@graphene//Cu cell exhibits 823 mAh g
                    −1
                    initial specific capacity and 73% capacity retention after 100 cycles. Findings in this work are expected to spark a promising direction for designing high‐performing anode‐free batteries.",crossref,0
Engineered Substrates for a Sulfurtransferase Enhance Endogenous Hydropersulfides and Inhibit Ferroptosis,https://onlinelibrary.wiley.com/doi/10.1002/anie.4893359?af=R,Wiley: Angewandte Chemie International Edition: Table of Contents,2026-07-17 12:23:42 UTC,2026-07-17 12:23:42+00:00,10.1002/anie.4893359,Harinath Chakrapani,"ABSTRACT
                  
                    Cellular hydropersulfides (RS‐SH) derived from hydrogen sulfide (H
                    2
                    S) such as glutathione hydropersulfide (GS‐SH) are excellent hydrogen atom transfer agents, and quench radicals to protect cells from ferroptosis, a form of iron‐mediated cell death associated with an unchecked build‐up of lipid radicals. Here, using principles of enzyme‐inhibitor design, a series of new artificial substrates for the endogenous hydropersulfide‐generating enzyme, 3‐mercaptopyruvate sulfurtransferase (3‐MST) was developed. We find that the lead molecules generated GS‐SH, catalyzed by 3‐MST, permeated cells to enhance endogenous hydropersulfides, protected cells from ferroptosis, and reduced systemic inflammation in an animal model. Together, this calibrated approach to promote cell's own radical trapping antioxidants using its biosynthetic machinery to prevent ferroptosis has tremendous implications in redox biology and therapeutics.",crossref,0
