title,link,source,published_str,pub_date,doi,last_author,abstract,abstract_source,must_have_abstract
Sialic acid-anchored haemagglutinin stalk neutralizing antibody M-SiaB enhances protection against highly pathogenic influenza H5N1/Texas/2024,https://www.nature.com/articles/s41467-026-74633-5,Biological sciences : Nature Communications subject feeds,2026-06-29 00:00:00 UTC,2026-06-29 00:00:00+00:00,,Zhiwei Chen,"The recently emerged cattle H5N1/Texas/2024 strain highlights the need for effective prophylactic and therapeutic drug interventions, yet most existing neutralizing antibodies (NAbs) have limited efficacy against genetically divergent pathogenic influenza viruses. Here we engineer a sialic acid-anchored tandem M-SiaB by fusing a hemagglutinin (HA) stalk-specific monoclonal NAb with a sialic acid-receptor-binding domain (SiaB). M-SiaB shows 4- to 20-fold greater neutralizing potency against diverse authentic influenza viruses compared to the parental NAb and suppresses multiple stages of the viral life cycle, including viral attachment, entry and release. Importantly, intranasal M-SiaB confers markedly enhanced protection against nasal challenges with the pathogenic H1N1/PR8 and H5N1/Texas/2024 strains. Notably, a single dose of M‑SiaB maintains survival after a highly lethal H5N1/Texas/2024 challenge for up to 21 days. These findings demonstrate that simultaneously targeting HA stalk and sialic acid-receptor is a promising strategy to enhance the potency and breadth of NAbs against genetically divergent pathogenic influenza viruses.",nature_html,0
Zebrafish oligodendrocyte lineage cells use the postsynaptic protein Gephyrin to myelinate GABAergic axons and limit myelin sheath growth,https://www.nature.com/articles/s41467-026-74902-3,Biological sciences : Nature Communications subject feeds,2026-06-29 00:00:00 UTC,2026-06-29 00:00:00+00:00,,Bruce Appel,"Axon myelination can tune neuronal circuits through placement and modulation of different patterns of myelin sheaths on distinct types of axons. How myelin formation is coordinated on distinct axon classes remains largely unknown. Recent work indicates neuronal activity and vesicle release promote myelin formation, and myelin-producing oligodendrocytes express canonical postsynaptic factors that potentially facilitate oligodendrocyte-axon interaction for myelin ensheathment. Here, we examined whether the inhibitory postsynaptic scaffold protein Gephyrin (Gphn) mediates selective myelination of specific axon classes in the larval zebrafish. Consistent with this possibility, Gphn was enriched in myelin on GABAergic and glycinergic axons. In gphnb deficient larval oligodendrocytes, myelin sheaths were longer and the frequency of myelin placement on GABAergic axons was reduced. Collectively, our results indicate that oligodendrocyte lineage cells use Gphn to promote myelin formation on GABAergic axons and limit myelin sheath length.",nature_html,0
Cellular replisomes are powered by flex-fuel motors for unwinding DNA,https://www.nature.com/articles/s41467-026-73652-6,Biological sciences : Nature Communications subject feeds,2026-06-29 00:00:00 UTC,2026-06-29 00:00:00+00:00,,James M. Berger,"DNA replication relies on hexameric, ring-shaped helicases to unwind parental DNA for supporting fork progression over tens of thousands of base pairs. Oddly, biochemical studies have suggested that, on their own, replicative helicases are rather limited motors that struggle to couple rapid movement to nucleotide turnover (typically believed to be solely ATP). Here, single-molecule studies reveal that when properly loaded, the Escherichia coli (E. coli) replicative helicase, DnaB, is a tremendously fast single-stranded DNA translocase that moves up to three times more rapidly than the replisome (3 knt/s). Translocation is highly processive, resistant to pulling force/high salt, and can displace short, 3’-tailed DNA duplexes without apparent changes in speed. Surprisingly, we find that the loader for DnaB, DnaC, can use any rNTP or dATP for depositing DnaB onto ssDNA and that the helicase itself also must hydrolyze nucleotide for stable loading. DnaB translocation also turns out to be supported by any r/dNTP, a property shown to extend to the eukaryotic CMG replicative helicase. Overall, the DNA unwinding engines that support cellular replisomes are highly indiscriminate of their fuel source, a feature that may be of utility during times when cells encounter nucleotide pool stress but have committed to DNA synthesis.",nature_html,0
Replication-independent eviction of the histone variant H2B.8 reveals chromatin reprogramming during seed imbibition,https://www.nature.com/articles/s41467-026-74230-6,Biological sciences : Nature Communications subject feeds,2026-06-29 00:00:00 UTC,2026-06-29 00:00:00+00:00,,Aline V. Probst,"The transition from seed to seedling involves major changes in nuclear organization and gene expression, yet the extent to which this developmental transition requires chromatin reprogramming remains largely unexplored. Here, we report that Arabidopsis dry seed embryos accumulate the histone variant H2B.8, which contributes to higher-order chromatin organization by forming spatial clusters that structure the 3D nuclear space. H2B.8 predominantly assembles into heterotypic nucleosomes, is enriched at euchromatic transposons and lowly expressed genes and, during imbibition, modulates the transcriptional activation of a subset of these genes. Water uptake triggers a decrease in H2B.8 transcripts and the eviction of the H2B.8 variant from chromatin, in a process that operates independently of DNA replication but requires de novo transcription. Histone eviction is not restricted to H2B.8, as imbibition also induces turnover of the H3.3 histone variant and therefore initiates a replication-independent chromatin reprogramming process. These findings highlight a fundamental mechanism of epigenetic regulation during early plant development.",nature_html,0
Gas-phase unfolding assay rapidly predicts structure-function relationships in engineered antibodies with tuned flexibilities,https://www.nature.com/articles/s41467-026-75137-y,Biological sciences : Nature Communications subject feeds,2026-06-29 00:00:00 UTC,2026-06-29 00:00:00+00:00,,Brandon T. Ruotolo,"Human (h)IgG2 monoclonal antibodies (mAbs) are potent agonists due, in part, to their ability to undergo disulfide shuffling within their hinge regions. Herein, we describe a rapid, sensitive, collision-induced unfolding (CIU) assay that possesses a predictive relationship between gas-phase protein unfolding and agonism in hIgG2 variants. Furthermore, our results highlight the significance of hinge engineering in tuning mAb structure-function relationships for the development of future biotherapeutics.",nature_html,0
Plate tectonic history and ocean oxygenation shaping biogeography of hydrothermal bacterial community,https://www.nature.com/articles/s41467-026-74853-9,Biological sciences : Nature Communications subject feeds,2026-06-29 00:00:00 UTC,2026-06-29 00:00:00+00:00,,Shang Wang,"The influence of plate tectonics on microbial distributions remains poorly understood. Here, we demonstrate that the global biogeography of hydrothermal vent-endemic chemoautotrophic microbiota is structured by the tectonic history of the global major oceans. These microbiota, particularly anaerobic ones, are significantly more abundant in early-origin Pacific, Arctic, and Mediterranean oceans, whereas they are notably scarce in late-formed Atlantic and Indian Oceans. This pattern was attributed to the timing of ocean formation and its interplay with global redox evolution. Fully oxygenated conditions in the Phanerozoic during the formation of the latter two oceans imposed a dual-dispersal barrier among oceans: toxicity of molecular oxygen to anaerobes and depletion of energy sources (especially reduced chemicals) for aerobes, but such a barrier didn’t exist before the Phanerozoic, when the former three oceans started. These results integrate microbial biogeography into a geodynamic framework, revealing that even microbial life is subject to planetary-scale geological constraints.",nature_html,0
Isotopic constraints in methane inversions reveal larger trends in wetland emissions with improved linkage to terrestrial water storage,https://www.nature.com/articles/s41467-026-74777-4,Earth and environmental sciences : Nature Communications subject feeds,2026-06-29 00:00:00 UTC,2026-06-29 00:00:00+00:00,,Giulia Zazzeri,"Accurately separating the contributions of different sources to recent atmospheric methane (CH4) growth is crucial for better quantifying the present and future responses of CH4 emissions to changing climate and anthropogenic activity. Here, we run atmospheric inversions to assess global and regional CH4 emissions from microbial, fossil, and pyrogenic sources from 2000 to 2022, using measurements of atmospheric CH4 and its stable carbon isotope ratio (13C:12C, expressed relative to a standard as δ13C-CH4). We confirm that global total CH4 emissions has increased by 15% from 2000 to 2022, with dominated contribution from microbial emissions. Both microbial and fossil emissions increased during 2007–2013 relative to 2000–2006, with the largest contributions from temperate Asia. From 2014–2017, microbial emissions from tropical regions, particularly South America and Africa, were the dominant driver of the overall increase, while fossil emissions remained stable in Europe and North America. Between 2020 and 2022, microbial emissions surged in the African and Asian tropics, whereas fossil emissions declined across most industrial regions. Notably, inversions constrained only by CH4 observations did not capture the decline in fossil emissions during 2020–2022, a decline potentially related to the COVID-19 pandemic, policy-driven changes, and decreases in CH4 emissions intensity, highlighting the critical role of isotopic measurements in independently verifying changes in fossil emissions. Further, our inversion with isotopic constraints estimates a more prominent increase in wetland emissions that is 20–30% more strongly correlated with variations in terrestrial water storage during 2003–2022, demonstrating the importance of climate-driven natural sources in explaining long-term CH4 growth.",nature_html,0
Autonomous Motion Vision with Tri-bulk-heterojunctioned Organic Adaptation Transistor,https://www.nature.com/articles/s41467-026-74905-0,Physical sciences : Nature Communications subject feeds,2026-06-29 00:00:00 UTC,2026-06-29 00:00:00+00:00,,Chong-an Di,"Motion vision is increasingly critical in scenarios such as autonomous driving and embodied intelligence. Existing sensors perform motion analysis and moving‑object extraction as separate tasks, which increases computation and storage needs to challenge highly efficient applications. Here, we design an organic tri-bulk-heterojunctioned adaptation phototransistor (OTAT) that integrates both functionalities in a single device. Notably, the OTAT incorporates a gate-adjacent semiconductor-insulator heterojunction as a photosensitive percolation channel, providing fine-tuned photoadaptation under illumination spanning six orders of magnitude. In imaging experiments, the device exhibits in‑sensor moving‑object extraction with a 45.3% highlight ratio, approaching the capability of the human visual system, while yielding motion analysis accuracy over 99.4% in both direction and speed detection. Importantly, the OTAT-based agents generated the lowest risk in multiple route-planning simulation. These results show that the OTAT effectively bridges the gap between motion extraction and analysis, marking a significant step forward for next-generation in‑sensor motion vision systems.",nature_html,0
Field-induced non-linear magnetic responses of all-metal Jellium σ-aromats,https://www.nature.com/articles/s41467-026-74403-3,Physical sciences : Nature Communications subject feeds,2026-06-29 00:00:00 UTC,2026-06-29 00:00:00+00:00,,Stephen T. Liddle,"In recent times all-metal aromaticity has arisen, challenging classical views of aromaticity. All-metal aromaticity invokes metal-metal bonding, but this remains rare for the actinides. Recently, one-electron trithorium superatom clusters exhibiting exalted diamagnetism and hence open-shell Jellium aromaticity have been reported. Those clusters complement closed-shell two-electron congeners, but computational assessments advanced conflicting interpretations. Here, we report one- and two-electron trithorium clusters that all exhibit exalted diamagnetism, demonstrating open- and closed-shell Jellium aromaticities. We show that these Jellium aromats exhibit non-linear magnetic responses, so a foundational assumption of ring current calculations is not met, accounting for the experimental-computational disagreement. This work suggests that while π-aromaticity results from preorganized coherent wave functions, for σ-aromats there may be an electronic reorganization barrier to cohesive wave functions and Jellium aromatic ring currents. This work demonstrates the importance of caution when using ring current calculations to assign aromatic character if the experimental magnetic response is not understood.",nature_html,0
Interplay between oxygen redox and interfacial stability of Li-rich positive electrodes in sulfide-based all-solid-state batteries,https://www.nature.com/articles/s41467-026-74601-z,Physical sciences : Nature Communications subject feeds,2026-06-29 00:00:00 UTC,2026-06-29 00:00:00+00:00,,Yong Yang,"Understanding and manipulating the interplay between lattice oxygen redox and interfacial stability is critical for realizing the full potential of lithium-rich manganese-based oxide positive electrodes in all-solid-state lithium batteries. Herein, we comprehensively investigate interfacial evolution of Li-rich manganese-based positive electrodes in sulfide electrolyte (Li6PS5Cl) systems and report that a potential mechanism where irreversible lattice oxygen redox at high potential induces severe electrolyte decomposition, forming porous oxygenated by-products that dominate interfacial impedance and hinder anionic redox reactions. Discharge-driven reduction of these by-products—particularly between 2.6-2.0 V—could facilitates interphases reconstruction via lithium incorporation, enhancing ionic transport kinetics and enabling reversible oxygen redox. Building on this identified mechanism, we propose a pre-activation strategy (3.9-2.0 V pre-cycling) with oxygen-modified Li6PS5Cl, which accelerates interphases stabilization and enables high oxygen redox utilization during the first cycle. It delivers a specific capacity of 318 mAh g−1 at 10 mA g−1, and 226 mAh g−1 at 200 mA g−1 with 83.2% retention over 500 cycles at 60 °C. This work has the potential to provide an effective interfacial reconstruction strategy to enhance anionic redox reversibility, providing a design framework for high-energy lithium-rich positive electrodes in all-solid-state lithium batteries.",nature_html,0
Freestanding ferroelectric membranes via ionic unlocking van der Waals interface,https://www.nature.com/articles/s41467-026-74894-0,Physical sciences : Nature Communications subject feeds,2026-06-29 00:00:00 UTC,2026-06-29 00:00:00+00:00,,Yixin Yang,"Freestanding oxide films have attracted significant interest for their potential applications in flexible electronics. However, the common use of sacrificial layers hinders the development of freestanding oxide films that meet industrial demands for larger area, device-scalable thickness and low cost. Here, we present a water-assisted ionic unlocking strategy that enables the rapid exfoliation of centimeter-scale, freestanding ferroelectric Pb(Zr,Ti)O3 membranes from Pb(Zr,Ti)O3/Pt/Mica. Leveraging density functional theory and ab initio molecular dynamics simulations, we identify water-induced potassium ion leaching from the Mica substrate as a key interfacial weakening pathway that substantially reduces the Pt/Mica interfacial binding energy, thereby enabling crack propagation driven by capillary forces along the weakened interface. The resulting 1×1 cm2 Pb(Zr,Ti)O3 membranes demonstrate a remarkable piezoelectric coefficient of 528 pC N−1, approximately twice that of their clamped counterparts on Mica. Moreover, by incorporating these membranes, we fabricate self-powered flexible acoustic sensors for high-fidelity sound recording and speech recognition, achieving a speech recognition accuracy exceeding 93%. This work represents a significant advance in both the scalable fabrication of freestanding ferroelectric membranes and the engineering of high-performance flexible sensors.",nature_html,0
Reverse Tesla valve modulated efficient water evaporation and cooling,https://www.nature.com/articles/s41467-026-75062-0,Physical sciences : Nature Communications subject feeds,2026-06-29 00:00:00 UTC,2026-06-29 00:00:00+00:00,,Zuankai Wang,"Water evaporation, a physical process effectively driving natural hydrological cycles, has long suffered from rate limitations in industrial applications. Particularly in scenarios such as solar steam generation and evaporation cooling, the evaporation rate of conventional evaporators struggles to meet the practical request, due to the unresolved boundary layer resistance at the liquid-air interface. Here, we reinvent Nikola Tesla’s fluidic diode into a reverse Tesla valve modulated bulk-effect evaporation system (BEES). By leveraging structure-induced vortex airflow to disrupt thermal and mass transfer boundary layers, BEES unlocks previously unattainable evaporation dynamics at the inner liquid-air interface and achieves an evaporation rate of 21.29 kg m−2 h−1, with a total energy/solar efficiency of 627%. Our BEES enables all-day freshwater harvesting and efficient evaporative cooling, achieving energy savings of 414 GJ m−3 month−1. This work establishes a bulk-effect evaporation framework complementary to traditional interfacial engineering for addressing the water-energy nexus.",nature_html,0
Complementary nonlinear optics for polarimetric computing in tellurium,https://www.nature.com/articles/s41467-026-75197-0,Physical sciences : Nature Communications subject feeds,2026-06-29 00:00:00 UTC,2026-06-29 00:00:00+00:00,,Yi Shi,"Polarization serves as a high-dimensional information carrier, yet current polarization-sensitive optical systems typically separate sensing from processing, generating massive redundancy and latency. Here, we demonstrate an intelligent paradigm based on the complementary integration of low-dimensional tellurium nanowires and nanosheets, leveraging their intrinsic optical anisotropy and opposite bias-modulated second-harmonic generation behaviors. We systematically exploit these mechanisms across two key domains. In information security, optical anisotropy serves as an entropy source for physical unclonable functions, while integrating tellurium nanowires and nanosheets constructs robust encryption units. In polarized image processing, anisotropy facilitates optical filtering of interference, and, crucially, the complementary bias modulation empowers the system to synergistically perform background denoising and edge extraction. This strategy effectively executes complex information encoding and image pre-processing tasks directly at the detection stage, offering a compact solution for next-generation intelligent optical systems.",nature_html,0
The chemistry of habitable oceans in the Solar system,https://www.nature.com/articles/s41467-026-74955-4,Earth and environmental sciences : Nature Communications subject feeds,2026-06-29 00:00:00 UTC,2026-06-29 00:00:00+00:00,,Christopher R. Glein,"Liquid water exists on the Earth and several other planetary bodies in our solar system. The chemical character of these aqueous reservoirs is central to evaluating their habitability. Here, we synthesize the chemical features of water reservoirs and their biological implications on the modern Earth. We then outline constraints on the evolutionary history of Earth’s ocean chemistry and discuss its interplay with the biosphere. Furthermore, we examine the inferred chemical environments of water bodies on early Mars, dwarf planet Ceres, Jupiter’s moon Europa and Saturn’s moons Enceladus and Titan. We conclude by outlining priority questions for future planetary habitability studies.",nature_html,0
"Single-crystal, 4-inch and ultrathin gallium oxide for sundial-inspired high-dimensional solar-blind photodetection metasystem",https://www.nature.com/articles/s41467-026-75058-w,Physical sciences : Nature Communications subject feeds,2026-06-29 00:00:00 UTC,2026-06-29 00:00:00+00:00,,Cheng-Wei Qiu,"Ultra-wide bandgap gallium oxides offer tremendous possibilities to develop short-wave optoelectronic devices. However, it is formidably challenging to produce single-crystal gallium oxide wafer and develop high-performance high-dimensional optoelectronics. Here we show a liquid-metal-assisted strategy to directly synthesize and transfer single-crystal, large-area and ultrathin β-Ga2O3. Benefiting from the UV-exposure oxidation of liquid gallium and strong interaction with gallium, our β-Ga2O3 film shows a 4-inch wafer-scale size, a 7.5-nm thickness and a flexible transfer operation. The solar-blind β-Ga2O3 detector achieves high responsivity (16.3 A W−1), fast response (2O3-based detectors. Moreover, we develop a sundial-inspired metasystem to simultaneously detect the incident direction, polarization, and intensity of solar-blind irradiation. These findings illustrate the potential of high-quality Ga2O3 wafer for high-dimensional photodetection, paving the way for next-generation solar-blind communications.",nature_html,0
Cobalt-catalyzed asymmetric three-component reductive addition of alkynes with alkyl halides and imines,https://www.nature.com/articles/s41467-026-74433-x,Physical sciences : Nature Communications subject feeds,2026-06-29 00:00:00 UTC,2026-06-29 00:00:00+00:00,,Yifeng Chen,"The catalytic dicarbofunctionalization of alkynes is a highly efficient strategy for the rapid assembly of complex, multi-substituted acyclic alkenes from simple feedstocks. Despite significant progress having been made in various racemic transformations, the direct enantioselective construction of multi-substituted acyclic alkenes bearing sterically congested tetrasubstituted stereocenters via multicomponent radical pathways remains a formidable and unsolved challenge in organic chemistry. Herein, we report a cobalt-catalyzed asymmetric three-component radical addition of terminal alkynes, ketimines, and unactivated alkyl iodides, which efficiently delivers polysubstituted allylamine derivatives featuring challenging tetrasubstituted stereocenters. This enantioselective addition protocol proceeds under mild reductive conditions and exhibits broad substrate scope with high functional group tolerance, delivering products with excellent stereoselectivity. Preliminary mechanistic investigations suggest a radical-based cascade process involving stereospecific alkyl radical addition to the alkyne followed by stereoselective addition to the ketimine. This work provides a straightforward and modular strategy to access highly functionalized chiral allylic amines from readily available starting materials.",nature_html,0
Complete enzyme clustering enhances coenzyme Q biosynthesis via substrate channeling,https://www.nature.com/articles/s41467-026-74806-2,Biological sciences : Nature Communications subject feeds,2026-06-29 00:00:00 UTC,2026-06-29 00:00:00+00:00,,Eugene I. Shakhnovich,"Metabolons - transient assemblies of sequential metabolic enzymes - facilitate the reactions of multi-step metabolic pathways, yet, how they mechanistically bolster metabolic flux remains unknown. Here, we investigate the molecular determinants of metabolon formation in coenzyme Q (CoQ) biosynthesis using coarse-grained molecular dynamics simulations and biochemical experiments. We show that the COQ metabolon forms at the critical region of a phase transition, where both metabolon clustering and metabolic flux exhibit coordinated sigmoidal responses to changes in protein-protein interaction strength. These complete metabolons enable substrate channeling between sequential enzymes, leading to a crucial enhancement of CoQ production efficiency. Selectively disrupting protein-protein interactions and randomly shuffling the interaction network demonstrate that protein-proximity rather than a defined spatial organization of the metabolon clusters is imperative for substrate channeling. Grounded in both experiments and simulations, these findings provide a framework for understanding the organization and function of metabolons across diverse metabolic pathways.",nature_html,0
