title,link,source,published_str,pub_date,doi,last_author,abstract,abstract_source,must_have_abstract
Atmospheric CO₂-to-acetaldehyde artificial photosynthesis in metallo hydrogen-bonded organic frameworks,https://www.nature.com/articles/s41467-026-75384-z,Physical sciences : Nature Communications subject feeds,2026-07-12 00:00:00 UTC,2026-07-12 00:00:00+00:00,,Rong Tan,"Artificial photosynthesis of acetaldehyde from atmospheric CO2 is highly promising, yet remains severely limited by low CO2 concentration in air and sluggish proton transfer kinetics. Herein, we report metallo hydrogen-bonded organic frameworks (MHOFs) of HNNU-X (X = O, S, Se) which enable acetaldehyde synthesis directly from air, water, and natural sunlight. Among them, HNNU-Se exhibits a competitive acetaldehyde production rate of 557.1 μmol g⁻¹ h⁻¹ with high electron-based selectivity of 95% under outdoor conditions, without need of sacrificial agents. Mechanistic studies reveal that HNNU-X creates a proton-rich microenvironment in which [Zn(tpy)]2+ cations function as CO2 capture and activation sites for direct air capture, while [XCN]– anions serve as proton shuttles, facilitating rapid transfer of in-situ generated H⁺ from solar-driven water oxidation to adsorbed CO2. This work enables the synergistic coupling of CO2 reduction and H2O oxidation, thereby achieving efficient artificial photosynthesis of acetaldehyde.",nature_html,0
Investigation on the high-temperature creep and irradiated damage behaviours of plasma-facing components material fabricated by selective laser melting,https://iopscience.iop.org/article/10.1088/1741-4326/ae7738,Nuclear Fusion - latest papers,2026-07-12 23:00:00 UTC,2026-07-12 23:00:00+00:00,10.1088/1741-4326/ae7738,Jiefeng Wu,"Oxide dispersion-strengthened (ODS) steel is a promising structural material in fusion reactors, nanoparticles in matrix pin grain boundaries, and capture point defects and they delay the performance degradation caused by creep and irradiation. In this paper, RAFM steel with Y2O3 was formed by selective laser melting (SLM) and the microstructural evolution under creep and irradiation were closely studied. SLM-formed ODS-RAFM steel had a longer high-temperature creep life than RAFM steel at the same stress and temperature, the fined grains were closely related to recrystallisation and pinning of oxide. The ODS-RAFM steel exhibited great irradiation stability, the lath width slightly increased, and the hardening rate was smaller than RAFM steel. During the irradiation process, continuously precipitated new MX carbides and Y–Ta–O oxide occurred in ODS-RAFM steel, which resisted the growth of grains. The above research results explained the microstructural evolution of RAFM steel and the change of performance under high temperature and an irradiation environment of fusion reactors, which verified the significant role of Y2O3 nanoparticles in maintaining high temperature stability and irradiation resistance, hence providing a strong theoretical basis for the ODS-RAFM steel of the future to be fully used as the blanket structural material of nuclear fusion reactors.",rss_description,0
Isoflux plasma shape control under large transient disturbances on EAST via reinforcement learning,https://iopscience.iop.org/article/10.1088/1741-4326/ae8313,Nuclear Fusion - latest papers,2026-07-12 23:00:00 UTC,2026-07-12 23:00:00+00:00,10.1088/1741-4326/ae8313,B.J. Xiao,"Magnetic shape control is fundamental to stable tokamak operation, where the plasma boundary must be maintained with high accuracy and robustness against external disturbances. Experimental observations on EAST indicate that, under large transient-error conditions, a fixed-parameter PID-based controller may drive the actuators into saturation, degrading regulation performance and potentially leading to loss of shape control. To address this limitation, this work develops a deep reinforcement learning plasma shape controller for EAST within the existing Isoflux control scheme. The controller is trained in a disturbance-rich simulation environment designed to reproduce large transient-error conditions, and employs a tailored reward design that explicitly targets large-disturbance robustness while improving early-stage learning stability under actuator constraints. Simulation results show that the learned policy achieves improved disturbance rejection and higher control accuracy in regimes where PID control tends to saturate and recover slowly. The controller is further deployed and experimentally validated on EAST, demonstrating stable plasma shape regulation with acceptable accuracy and enhanced robustness during long-pulse operation.",rss_description,0
"Development of time-evolving NBCD simulation in the LHD, consistent with neutron and impurity measurements",https://iopscience.iop.org/article/10.1088/1741-4326/ae8281,Nuclear Fusion - latest papers,2026-07-12 23:00:00 UTC,2026-07-12 23:00:00+00:00,10.1088/1741-4326/ae8281,M. Yokoyama,"We have developed a simulation code for the plasma current driven by the neutral beam in the large helical device (LHD). To compare the results between the experiment and the simulation, not only the beam-driven current, but also the other components, must be estimated. In this paper, we have integrated the codes that solve electromagnetic induction, neoclassical transport (DKES/PENTA), and the fast-ion distribution function (TASK3D-a and TASK/FP) to achieve Neutral beam current drive simulation. The code has been benchmarked against the analytical solution for the evolution of the plasma current. Then the code has been applied to actual LHD discharges. Although the trend and the absolute value of the simulated plasma current became similar to the measured one, the time constant of the current evolution disagreed. By considering the mutual induction between the plasma and the external coils, the simulated time constant of the plasma current evolution became closer to the experimental one.",rss_description,0
Integrated numerical analysis of impurity transport and sources for high current—high power baseline pulses with T in JET-ILW,https://iopscience.iop.org/article/10.1088/1741-4326/ae827e,Nuclear Fusion - latest papers,2026-07-12 23:00:00 UTC,2026-07-12 23:00:00+00:00,10.1088/1741-4326/ae827e,The Eurofusion Tokamak Exploitation Team,"This work consists of integrated numerical modelling applied to JET high-current, high-power baseline pulses with 92% tritium + 8% hydrogen with tungsten divertor and beryllium wall in corner configuration. These simulations are performed using the COREDIV code, which self-consistently solves one-dimensional radial transport equations for the plasma and impurities in the core region, coupled with two-dimensional multi-fluid transport in the scrape-off layer. It should be noted that the simulations are ‘semi-interpretative’, in the sense that transport coefficients are tuned in order to match experimental data: profile of the radiation, Ni concentration, radiation in SOL and Zeff. The simulations suggest that, within the assumptions of the COREDIV model and the available experimental constraints, the observed increase in core plasma radiation can be most consistently reproduced by changes in impurity transport rather than by an increase in the impurity source. The simulations show that sputtering of tungsten due to tritium is negligible. The Be is the main source of sputtering and the dominant contribution to tungsten sputtering comes from Be2+.",rss_description,0
Active control of ion-ITB using RMP in the EAST tokamak,https://iopscience.iop.org/article/10.1088/1741-4326/ae827c,Nuclear Fusion - latest papers,2026-07-12 23:00:00 UTC,2026-07-12 23:00:00+00:00,10.1088/1741-4326/ae827c,B.N. Wan,"Resonant magnetic perturbations (RMPs) have been demonstrated to trigger sustainable internal transport barriers in the ion temperature channel (ion-ITB) in the EAST tokamak (Sheng et al 2025 PRX Energy4 043012). This paper further examines the diverse effects of RMPs on ion-ITB. In addition to triggering and sustaining ion-ITB using RMPs, the barrier can also be actively controlled by adjusting the phasing, toroidal mode number ( ), and current of the RMP coils. The formation of ion-ITBs exhibits robust reproducibility, achievable solely by adjusting the RMP coil configuration with all other discharge settings held fixed. Comparative results indicate that high- RMPs are more favorable for ion-ITB formation than low- RMPs. Both experimental and modeling results demonstrate that strong magnetic perturbations in the core region suppress the formation of the ion-ITB in these cases. Preliminary results from RMP-modulated ITB experiments reveal that fishbone is not essential for ion-ITB formation, nor is sawtooth essential for its collapse, whereas the plasma current profile appears likely to play an important role. Overall, these results demonstrate that RMPs can serve as an effective method for controlling ITBs and investigating their underlying physics.",rss_description,0
Axisymmetric global Alfvén eigenmodes in the TCV tokamak,https://iopscience.iop.org/article/10.1088/1741-4326/ae827b,Nuclear Fusion - latest papers,2026-07-12 23:00:00 UTC,2026-07-12 23:00:00+00:00,10.1088/1741-4326/ae827b,the EUROfusion Tokamak Exploitation Team,"Global Alfvén eigenmodes (GAEs) with toroidal mode number n= 0 (i.e. axisymmetric) have been observed in the toroidicity-induced, ellipticity-induced, and above non-circularity-induced frequency ranges in the TCV tokamak. Observation of n = 0 GAEs at multiple frequencies, caused by the periodic structure of the Alfvén continuum in frequency, demonstrates the fundamental nature of these modes. A radial splitting of the n = 0 GAEs has been predicted by linear MHD calculation. This calculation is consistent with the recently observed radial splitting of GAEs in the sub-cyclotron frequency range. Linear MHD codes were used to compute the n = 0 Alfvén continuum and the corresponding eigenmode structures. The modeling confirms that the n = 0 GAEs are located mainly below the minima of the Alfvén continuum, although some modes are observed above the continuum maxima, similar to the sub-cyclotron-frequency GAEs, for which modes above the continuum maxima have also been reported. The n = 0 GAEs have been observed in a variety of discharge types, including low- and high-density plasmas, positive- and negative-triangularity configurations, and discharges with neutral beam injection in both co-current and counter-current directions. A key factor for the appearance of n = 0 GAEs is a positive gradient in the particle energy distribution function, ∂f/∂E > 0 (bump-on-tail), which has been confirmed by TRANSP calculations for all discharges.",rss_description,0
ICRF system for the HL-3 tokamak,https://iopscience.iop.org/article/10.1088/1741-4326/ae827a,Nuclear Fusion - latest papers,2026-07-12 23:00:00 UTC,2026-07-12 23:00:00+00:00,10.1088/1741-4326/ae827a,Qi Wang,"The HL-3 tokamak is a new medium-sized copper conductor tokamak at the Southwestern Institute of Physics (SWIPs). In order to provide central ion heating as well as generate energetic particles whose energy levels are equivalent to the fusion born alpha particles, a 6 MW ion cyclotron range of frequencies heating system is under construction at SWIP and will be available at HL-3 in September 2026. Radio frequencies (RFs) in the range of 25–50 MHz with pulses up to 5 s is considered. For a deuterium plasma, the hydrogen minority and the 2nd harmonic of deuterium are the main ion heating schemes with f= 33 MHz at B0 = 2.2 T. For a deuterium–tritium plasma, the fundamental He-3 and the 2nd harmonic of tritium with f= 25 MHz at B0 = 2.5 T is considered. The RF generator consists of 4×1.5 MW transmitters. The transmission line incorporates 3 dB hybrid couplers so as to divert the reflected power away from the transmitters. The matching unit is provided by a 1/4λ stub tuner and a 1/2λ phase shifter, with an additional pre-matching stub for each of the four transmission lines. Two 2-strap antennas with parallel wavenumber k// ∼ 6.5 m−1 are designed since the impurity issue is supposed to be moderate under a carbon wall.",rss_description,0
Upgraded Pilot-PSI: a new high flux linear plasma device for operando ion beam studies,https://iopscience.iop.org/article/10.1088/1741-4326/ae81c7,Nuclear Fusion - latest papers,2026-07-12 23:00:00 UTC,2026-07-12 23:00:00+00:00,10.1088/1741-4326/ae81c7,B. Tyburska-Pueschel,"To investigate dynamic plasma surface interaction processes, we developed the linear plasma generator Upgraded Pilot-PSI (UPP). It couples high-flux plasma exposure with operando ion-beam analysis (IBA) for the first time. UPP generates steady-state hydrogen plasma up to with electron temperatures ranging from to and densities up to . Simultaneously, up to p, He, or He ion beams may be used to analyse the top few of the material using IBA techniques, allowing the study of hydrogen-isotope transport and exchange, dynamic retention, sputtering, and related processes. Alternatively, the ion beam can be used to induce radiation damage in the material while it is simultaneously exposed to plasma, enabling studies of defect stabilisation under plasma conditions. This paper details the design and technical specifications of UPP, focusing on the engineering challenges and solutions involved in integrating operando IBA with a high-flux plasma generator. Our first studies on tungsten exposed to deuterium plasma reveal the mechanism of transport in the surface (first ) and the bulk (beyond up to the beam penetration depth) as well as the time to reach saturation.",rss_description,0
Calibration strategy and uncertainty analysis of the ITER neutron activation system for deuterium–deuterium plasma operation *,https://iopscience.iop.org/article/10.1088/1741-4326/ae81c4,Nuclear Fusion - latest papers,2026-07-12 23:00:00 UTC,2026-07-12 23:00:00+00:00,10.1088/1741-4326/ae81c4,Bruno Coriton,"The International Thermonuclear Experimental Reactor (ITER) neutron activation system (NAS) is an essential diagnostic system designed to measure the total neutron yield and the first-wall fluence in the ITER Tokamak. NAS principle is based on the neutron activation of small sample materials placed in the vicinity of the plasma using pneumatic transfer lines. The induced activity in the samples is subsequently measured using a gamma-ray counting station, enabling reconstruction of the total neutron yield. Accurate neutron transport modelling of both the NAS apparatus and the tokamak is essential for reliable measurements. This study systematically quantifies the primary sources of uncertainty in the NAS neutronic model, focusing on the geometric modelling of the NAS irradiation ends and tokamak environment, as well as uncertainties in nuclear data. Results indicate that the NAS can achieve a measurement accuracy of approximately 13% in deuterium–deuterium (DD) plasmas, with the largest uncertainty attributed to the detailed geometry of the diagnostic first-wall (DFW). To address this, in-situ calibration is paramount to identify unforeseen measurement errors and to mitigate the uncertainties in computational models. Utilizing a well-characterized neutron generator for NAS calibration could reduce the neutron yield measurement errors below 8%. These findings underscore the importance of precise modelling and calibration procedures for accurate neutron measurements during ITER’s start of research operation (SRO).",rss_description,0
Toroidal phase of post-disruption runaway electron loss to wall in presence of applied 3D fields in DIII-D,https://iopscience.iop.org/article/10.1088/1741-4326/ae80e4,Nuclear Fusion - latest papers,2026-07-12 23:00:00 UTC,2026-07-12 23:00:00+00:00,10.1088/1741-4326/ae80e4,Claudio Marini,"The toroidal distribution of runaway electrons (REs) striking the centre post in DIII-D post-disruption RE final loss events is simulated utilizing the MARS-F code combined with the REORBIT module, by tracing the guiding-centre drift orbits of test REs in the presence of external (applied) plus internal (intrinsic instability) 3D fields. To better recover the experimental results, three different equilibria with different safety factor profiles are adopted. Dominant resistive magnetohydrodynamic instabilities are found to be m/n= 2/1, 3/2 and 1/1 modes (where m and n are the poloidal and toroidal mode numbers). Externally applied n= 1 resonant magnetic perturbations (RMPs), with both even and odd parity configuration, are considered in each equilibrium. Locking of MHD instability to the applied RMPs is simulated by minimizing the total perturbed magnetic energy in the plasma. The simulated toroidal locations, where most REs strike in the presence of an edge m/n = 2/1 instability and the n = 1 RMPs in even parity, are found to agree well with experiments. Modelling also captures the measured n = 2 RE loss pattern on the wall for experiments where an edge m/n = 3/2 instability is dominant instead of the m/n = 2/1 mode. The key overall findings include (a) the measured global RE toroidal impact pattern in experiments can be explained by a locked resistive kink instability, (b) the toroidal phase of the locked mode is well predicted by minimizing the total perturbed magnetic energy, and (c) this edge locked mode determines the toroidal phase of the peak RE wall impact.",rss_description,0
Analysis of the alpha particle transport induced by Alfven eigenmodes and fish-bones in JET DT discharges: multiple energetic particle simulations,https://iopscience.iop.org/article/10.1088/1741-4326/ae827d,Nuclear Fusion - latest papers,2026-07-12 23:00:00 UTC,2026-07-12 23:00:00+00:00,10.1088/1741-4326/ae827d,the EUROfusion Tokamak Exploitation Team,"The present study is dedicated to analyze the extensive fast ion (FI) induced perturbations in ion cyclotron resonance heating (ICRH) dominated plasmas in JET deuterium–tritium (D–T) discharges, the closest experiment to reactor-like operation. A set of nonlinear simulations are performed with the gyro-fluid FAR3d code to reproduce the FI induced activity and energetic particle (EP) transport observed in the discharge by multiple EP populations. Well validated simulations with JET D–T diagnostics show that Toroidal Alfvén eigenmodes (TAEs) and fish-bone are destabilized by ICRH accelerated passing D and trapped H ions, respectively. Multiple EP simulations show important nonlinear couplings between EP species, leading to a strong effect on the alpha particle confinement even in the alpha particles do not destabilize EP modes. Simulations including trapped H and alpha particles indicate fish-bones may induce alpha particle losses up to . The situation is different with respect to TAEs, which have a smaller impact on the alpha particle transport, leading to negligible losses. In addition, the generation of shear flows during the saturation phase of TAE and fish-bones is observed in the simulations. Shear flows induced by TAEs in the inner-middle plasma region are almost two times larger compared to the shear flows caused by the fish-bone in the inner plasma region. Shear flow generation by AE/fish-bones may have an important impact in the thermal plasma and alpha particle confinement of devices as ITER and JT60SA. Consequently, nonlinear effects in multiple EP populations must be considered in the analysis of EP transport. It is shown that this is a fundamental result that has to be considered to be properly evaluate fusion power in reactor relevant plasmas.",rss_description,0
ESR2D: a two-dimensional Fourier-space global gyrokinetic eigenvalue code for the ion-temperature-gradient modes in tokamaks,https://iopscience.iop.org/article/10.1088/1741-4326/ae7f33,Nuclear Fusion - latest papers,2026-07-12 23:00:00 UTC,2026-07-12 23:00:00+00:00,10.1088/1741-4326/ae7f33,Shiqi Xiao,"A two-dimensional (2D) Fourier-space global gyrokinetic eigenvalue solver, ESR2D, has been developed to solve the 2D gyrokinetic eigenvalue problem for the ion-temperature-gradient (ITG) modes in tokamaks. With no simplifying assumptions made for passing or trapped ions, the 2D gyrokinetic eigenvalue equations in the poloidal Fourier space have been derived and numerically solved in the ESR2D code. In the linear ITG Cyclone test with adiabatic electrons, the ESR2D code benchmarks well against the gyrokinetic initial-value codes GENE, NLT and ORB5. It is found that two toroidal branches of ITG modes coexist in the system.",rss_description,0
"SONIC simulation studies of power and particle exhaust, alongside impurity concentration, for JA DEMO tokamak design",https://iopscience.iop.org/article/10.1088/1741-4326/ae7a08,Nuclear Fusion - latest papers,2026-07-12 23:00:00 UTC,2026-07-12 23:00:00+00:00,10.1088/1741-4326/ae7a08,Y. Sakamoto,"SONIC divertor code facilitates simultaneous calculations of seeding impurity (Ar) and fusion product (He) transport. D2 and Ar gases were injected at the outer midplane and upper location of the outer divertor, respectively. He exhausts in the detached divertor have been investigated for a reference series of JA DEMO with an increasing deuterium gas puff rate (50–200 Pa m3s−1) where Psep ∼ 250 MW and the radiation fraction is 0.8. The outer divertor heat load (qtotdiv) peaked in the attached region on the partially detached target, and the peak-qtotdiv was reduced to lower than 10 MW m−2 by increasing the D2 puff rate while maintaining a relatively low nesep (2 × 1019 – 2.5 × 1019m−3). Neutral and gas pressures in the divertor (PD0div, PD2div) were evaluated at exhaust slots of the dome and in the sub-divertor. The total pressure (PDtotdiv) in the D-puff scan was increased from 1.4 to 3 Pa at the outer exhaust slots, and the outer peak-qtotdiv was proportional to (PDtotdiv)−0.7. Plasma flow reversals with M// = 0.2 – 0.3 were generated near the detach–attach boundary above the outer divertor target. The influence of the flow reversal on the plasma and impurity transport was determined. Convective heat flux was reversed, which significantly affected the ion heat flux profile in the upstream SOL. The flow reversal reduced the impurity shielding and radiation loss in the outer divertor. Inner-enhanced in–out asymmetry of Ar concentration (cAr) was large near the separatrix in SOL, suggesting that Ar ions were transported from the inner SOL to the confined plasma. In the confined plasma (edge), both cAredge and cHeedge were reduced and poloidally uniform, where cAredge was reduced to the marginal level and cHeedge was below the design reference by system code assumption (cArmain: 0.6%, cHemain: 7%). Consequently, these SONIC results are generally consistent with the JA DEMO higher-𝜅 design, and larger D-puff (and smaller ГAr,puff) operation is preferable for the large power exhaust in the divertor and the impurity control in the edge plasma.",rss_description,0
Towards digital twins of fusion systems,https://iopscience.iop.org/article/10.1088/1741-4326/ae8037,Nuclear Fusion - latest papers,2026-07-12 23:00:00 UTC,2026-07-12 23:00:00+00:00,10.1088/1741-4326/ae8037,D. Told,"Bridging the gap to next-step devices—while saving valuable time and resources—requires more than semi-empirical models, which struggle to predict plasma behavior in unexplored parameter regimes. Instead, validated simulation tools are essential, leveraging high-fidelity exascale computing and multi-fidelity models, including AI-based surrogates. To address these challenges, the ‘EUROfusion Theory and Advanced Simulation Coordination (E-TASC)’ initiative was launched in 2021. It includes 15 TSVV (Theory, Simulation, Verification, and Validation) projects supported by five Advanced Computing Hubs. This ‘team of teams’ has made substantial progress toward developing digital twins of fusion systems, with key scientific achievements to be presented in the paper. This includes the following topical areas: core performance in burning plasmas, magnetohydrodynamic transients, L–H transitions and ELM-free regimes, plasma exhaust, and plasma–wall interactions—with applications to both tokamaks and stellarators.",rss_description,0
Full noninductive plasma start-up using electron Bernstein wave current drive on high-field side injection in QUEST,https://iopscience.iop.org/article/10.1088/1741-4326/ae7b57,Nuclear Fusion - latest papers,2026-07-12 23:00:00 UTC,2026-07-12 23:00:00+00:00,10.1088/1741-4326/ae7b57,Seiya Sakai,"Electron cyclotron wave (ECW) injection is considered an effective auxiliary method for plasma start-up. In QUEST, high-field side (HFS) injection of ECW was conducted to achieve effective mode conversion to electron Bernstein wave (EBW), which can propagate in high-density plasma and provide greater heating/current-drive efficiency than ECW at low electron temperatures. The EBW-driven current, whose direction is inverted by toroidal and radial magnetic fields, was clearly observed experimentally, and this characteristic of EBW current drive (EBWCD) played an important role in closed-flux surface formation. The findings are supported by an improved current-density profile model used to reconstruct the current distribution in the open flux surface (OFS) phase. The EBWCD efficiency in the OFS is approximately evaluated 0.014 A W−1 in the OFS phase using a model calculation that includes co- and counter-directed .",rss_description,0
