title,link,source,published_str,pub_date,doi,last_author,abstract,abstract_source,must_have_abstract
An adaptive modeling method with optimal order selection for thermostatically controlled loads,https://www.sciencedirect.com/science/article/pii/S0306261926010032?dgcid=rss_sd_all,ScienceDirect Publication: Applied Energy,2026-07-13 00:00:00 UTC,2026-07-13 00:00:00+00:00,,Wen-Yan Hu,,,0
Toward trustworthy AI in real-time event-driven power system emergency control: A knowledge-surrogate-guided deep learning approach,https://www.sciencedirect.com/science/article/pii/S0306261926010007?dgcid=rss_sd_all,ScienceDirect Publication: Applied Energy,2026-07-13 00:00:00 UTC,2026-07-13 00:00:00+00:00,,Mir Nahidul Ambia,,,0
A trustworthy hybrid human-LLM assisted safe reinforcement learning method for distribution network operation,https://www.sciencedirect.com/science/article/pii/S0306261926010433?dgcid=rss_sd_all,ScienceDirect Publication: Applied Energy,2026-07-13 00:00:00 UTC,2026-07-13 00:00:00+00:00,,Jianguo Zhu,,,0
Connecting Europe through hydrogen: Cost allocation analysis of cross-border pipeline coalitions under varying subsidy policies,https://www.sciencedirect.com/science/article/pii/S030142152600426X?dgcid=rss_sd_all,ScienceDirect Publication: Energy Policy,2026-07-13 00:00:00 UTC,2026-07-13 00:00:00+00:00,,Tamás Solymosi,,,0
Nanoengineered doping overcomes sintering and grain-boundary limitations in all-solid-state lithium batteries with garnet electrolytes,https://www.nature.com/articles/s41565-026-02226-w,Nature Nanotechnology,2026-07-13 00:00:00 UTC,2026-07-13 00:00:00+00:00,10.1038/s41565-026-02226-w,Chunsheng Wang,"Li6.5La3Zr1.5Ta0.5O12 (LLZTO) garnet material is a promising inorganic electrolyte for all-solid-state lithium metal batteries because of its safety, broad electrochemical stability and low air sensitivity. However, LLZTO faces critical challenges related to sintering and grain boundaries that adversely affect its mechanical and electrochemical properties. Here we propose oversaturation doping of yttrium into Li6.72La3.00Y0.22Zr1.28Ta0.50O12 (LLYZTO) using 1.0 wt% of (Y2O3)0.08(ZrO2)0.92 (YSZ). During annealing, a La–Y–O (LYO) nanoscale interphase forms at the grain boundaries. This material nanoengineering approach improves indentation fracture toughness, increases the critical current density and enhances bulk ionic conductivity while maintaining low electronic conductivity. The LLYZTO with 1.0 wt% of YSZ (LLYZTO–1.0 wt% YSZ) is more lithiophobic than its undoped counterpart, and accommodates the volume changes of LiCoO2 during battery operation, enabling a 2.2 mAh cm−2 all-solid-state Li||LiCoO2 coin cell to deliver 2.0 mAh cm−2 at 0.66 mA cm−2 for over 100 cycles at 30 °C and 1 MPa of stack pressure. The fracture toughness of LLYZTO–1.0 wt% YSZ also allows the sintering fabrication of a square 5.29-cm2 and 150 µm-thick electrolyte membrane, which can be effectively used in lab-scale Li||LiCoO2 pouch cells. We also demonstrate the extension of the LYO interphase approach to other Li-based inorganic solid electrolytes.",nature_html,0
"Dynamic and synergic effects of energy transition, carbon policy and trade conflicts: A mixed-frequency approach",https://www.sciencedirect.com/science/article/pii/S0301421526004222?dgcid=rss_sd_all,ScienceDirect Publication: Energy Policy,2026-07-13 00:00:00 UTC,2026-07-13 00:00:00+00:00,,Yifei Lv,,,0
Author Correction: Programming local confinements in crystalline frameworks through reticular chemistry,https://www.nature.com/articles/s41563-026-02700-9,Nature Materials,2026-07-13 00:00:00 UTC,2026-07-13 00:00:00+00:00,10.1038/s41563-026-02700-9,Omar K. Farha,,,0
Unconventional skyrmions in synthetic antiferromagnets,https://www.nature.com/articles/s41563-026-02673-9,Nature Materials,2026-07-13 00:00:00 UTC,2026-07-13 00:00:00+00:00,10.1038/s41563-026-02673-9,Stephen McVitie,"Magnetic skyrmions are topologically protected spin textures that can act as reconfigurable nanoscale information carriers. In synthetic antiferromagnets, interlayer exchange coupling provides a control parameter beyond the interfacial Dzyaloshinskii–Moriya interaction and magnetic anisotropy. Here we engineer a synthetic antiferromagnet of two chemically distinct ferromagnets, CoB and CoFeB, in which the external field and interlayer exchange act asymmetrically on the sublattices. Their competition, acting as an effective field, gives rise to two skyrmion families in different field regimes: conventional-polarity skyrmions at large fields, and inverse-polarity skyrmions at smaller fields, where the effective field reverses sign. Using element-resolved X-ray magnetometry, correlative magnetic force and Lorentz transmission electron microscopies, and micromagnetic modelling, we show that all textures reside solely in the CoFeB layers, driven by a Ruderman–Kittel–Kasuya–Yosida exchange field from the CoB layers. This effective-field route enables programmable three-dimensional spin textures with layer-selected polarity for skyrmion-based computing.",nature_html,0
Perovskite–organic tandem solar cells with a photo-transformable stabilizer,https://www.nature.com/articles/s41586-026-10869-x,Nature,2026-07-13 00:00:00 UTC,2026-07-13 00:00:00+00:00,10.1038/s41586-026-10869-x,Yongfang Li,"Wide-bandgap (WBG) mixed-halide perovskites with high Br content, which are employed as the front cell material in perovskite–organic tandem solar cells (TSCs), often suffer from initial halide-mixing inhomogeneity and light-induced halide segregation1–3, limiting the performance of perovskite–organic TSCs. Here, we introduced a photo-transformable additive 4-[3-(trifluoromethyl)-3H-diazirin-3-yl]benzylamine (TDB) into the WBG perovskite precursor solution to establish a two-stage strategy for stabilizing the mixed-halide phase. During crystallization, TDB improves the initial halide homogeneity by suppressing the rapid precipitation of the Br-rich phase and accelerating halide mixing upon annealing. During operational illumination, TDB undergoes transformation to form a new species with stronger adsorption on the perovskite grain-boundary surfaces, which inhibits the formation of iodide-related defects, suppresses defect-assisted carrier trapping and ion migration, thereby mitigating light-induced halide segregation4–6. The representative WBG perovskite (Eg = 1.88 eV) solar cell achieved a power conversion efficiency (PCE) of 20.01%, with an open-circuit voltage of 1.42 V, a fill factor of 85.13% and improved stability under illumination. By integrating the WBG perovskite solar cell into a monolithic perovskite–organic TSC, we achieved a PCE of 28.80% with a certified steady-state PCE of 28.04%. The perovskite–organic TSC retained 90% of its initial PCE after 625 h of operation under the ISOS-L-1 protocol.",nature_html,0
Author Correction: OR7A10 GPCR engineering boosts CAR-NK therapy against solid tumours,https://www.nature.com/articles/s41586-026-10855-3,Nature,2026-07-13 00:00:00 UTC,2026-07-13 00:00:00+00:00,10.1038/s41586-026-10855-3,Sidi Chen,,,0
Tall and small trees are equally vulnerable to drought,https://www.nature.com/articles/d41586-026-02121-3,Nature,2026-07-13 00:00:00 UTC,2026-07-13 00:00:00+00:00,10.1038/d41586-026-02121-3,Holly Smith,The water-transport system of tropical giants called dipterocarps has evolved to defy the effects of gravity and resist water stress. The water-transport system of tropical giants called dipterocarps has evolved to defy the effects of gravity and resist water stress.,nature_html,0
Author Correction: Plasmonic printing of high-performance metal oxide electronics under room temperature,https://www.nature.com/articles/s41563-026-02698-0,Nature Materials,2026-07-13 00:00:00 UTC,2026-07-13 00:00:00+00:00,10.1038/s41563-026-02698-0,Xinge Yu,,,0
How voluntary work can boost your career in science,https://www.nature.com/articles/d41586-026-01339-5,Nature,2026-07-13 00:00:00 UTC,2026-07-13 00:00:00+00:00,10.1038/d41586-026-01339-5,Jacqui Thornton,Supporting charities can bring career benefits and provide valuable social connections. Supporting charities can bring career benefits and provide valuable social connections.,nature_html,0
The rise of evidence-based medicine and the ‘mavericks’ who championed it,https://www.nature.com/articles/d41586-026-02153-9,Nature,2026-07-13 00:00:00 UTC,2026-07-13 00:00:00+00:00,10.1038/d41586-026-02153-9,Peter John,An impeccably researched account describes how clinical trials have transformed health and social policy. An impeccably researched account describes how clinical trials have transformed health and social policy.,nature_html,0
Epigenetic editing makes its mark,https://www.nature.com/articles/d41586-026-02151-x,Nature,2026-07-13 00:00:00 UTC,2026-07-13 00:00:00+00:00,10.1038/d41586-026-02151-x,Amber Dance,Researchers are rewriting the chemical tags on DNA and chromatin to tune gene expression. Researchers are rewriting the chemical tags on DNA and chromatin to tune gene expression.,nature_html,0
This microbiologist endured a four-year court battle over COVID-19 tests,https://www.nature.com/articles/d41586-026-01654-x,Nature,2026-07-13 00:00:00 UTC,2026-07-13 00:00:00+00:00,10.1038/d41586-026-01654-x,Anne Gulland,"Linda Guamán wanted to serve her country, but became mired in a political controversy that led to her being arrested and facing years in prison. Linda Guamán wanted to serve her country, but became mired in a political controversy that led to her being arrested and facing years in prison.",nature_html,0
What money can’t buy: Company experience and community resistance to renewable energy infrastructure,https://www.sciencedirect.com/science/article/pii/S0301421526004076?dgcid=rss_sd_all,ScienceDirect Publication: Energy Policy,2026-07-13 00:00:00 UTC,2026-07-13 00:00:00+00:00,,José Vega-Araújo,,,0
Balancing climate ambition and price stability: The case of South Africa’s carbon tax,https://www.sciencedirect.com/science/article/pii/S0301421526004179?dgcid=rss_sd_all,ScienceDirect Publication: Energy Policy,2026-07-13 00:00:00 UTC,2026-07-13 00:00:00+00:00,,Abraham Lartey,,,0
Rights for rivers and ice cream for all: top reads for the summer holidays,https://www.nature.com/articles/d41586-026-02152-w,Nature,2026-07-13 00:00:00 UTC,2026-07-13 00:00:00+00:00,10.1038/d41586-026-02152-w,Patience Kiyuka,Ten Nature contributors share their current book obsessions. Ten Nature contributors share their current book obsessions.,nature_html,0
Enteroendocrine cells wire the gut–brain vagal axis,https://www.pnas.org/doi/abs/10.1073/pnas.2600339123?mi=eymic2&af=R&access=on&content=articlesChapters&publication=pnas&sortBy=Earliest&target=default,Proceedings of the National Academy of Sciences: Keyword search for query,2026-07-13 07:00:00 UTC,2026-07-13 07:00:00+00:00,10.1073/pnas.2600339123,Lihua Ye,"The vagal sensory nervous system plays important roles in mediating gut–brain communication and maintaining physiological homeostasis. Although recent research has greatly enhanced our understanding of the function of vagal sensory neurons, little is known about what guides the vagal sensory nerve fibers to innervate the intestine and form a complex gut–brain sensory network. Here, using zebrafish genetic models to trace the development of the intestinal vagal network, we found that the development of the intestinal vagal sensory network is coupled with the formation of enteroendocrine cells (EECs). Vagal sensory neurons begin to innervate the intestine at 2 d postfertilization. Vagal nerve fibers branch out toward the newly formed EECs in the intestinal epithelium. The newly formed EECs display active actin filaments at their base, enabling them to physically engage with the vagal sensory fibers and facilitate the formation of the intestinal vagal sensory network. Genetically ablating EECs impairs intestinal vagal network formation and alters the vagal central projection pattern. Ablating EECs induces apoptosis in a subset of vagal sensory neurons and reduces the number of central projecting axons of the intestine innervating vagal sensory neurons. Moreover, ablating EECs completely alters the brain’s response to nutrient ingestion and diminishes nutrient-induced hindbrain and hypothalamus neuron activation. Finally, loss of EECs increases food intake while impairing adipose tissue development and survival. Together, our study revealed that EECs guide vagal sensory neuron development and intestinal vagal network formation. Loss of EECs impairs the anatomical vagal sensory axis and alters gut–brain signaling transmission.",crossref,0
Experimental drought drives divergent succession of soil microbiota,https://www.pnas.org/doi/abs/10.1073/pnas.2537753123?mi=eymic2&af=R&access=on&content=articlesChapters&publication=pnas&sortBy=Earliest&target=default,Proceedings of the National Academy of Sciences: Keyword search for query,2026-07-13 07:00:00 UTC,2026-07-13 07:00:00+00:00,10.1073/pnas.2537753123,Jizhong Zhou,"As droughts become increasingly severe and prolonged worldwide, understanding how belowground biodiversity changes over time under water limitation is critical for assessing ecosystem resilience. However, long-term and continuous observations of soil microbial responses to drought remain rare. Here, using a 6-y experimental drought in a tallgrass prairie ecosystem, we showed that experimental drought reshaped the community compositions of soil bacteria, fungi, and protists, accompanied by progressive declines in microbial diversity and biomass. Analyses of time–decay relationships and paired community differences between drought and ambient conditions revealed increasingly divergent successional trajectories of soil microbiota under drought. Although stochastic processes dominated community assembly overall, their relative importance declined over time, particularly for bacteria in drought-treated soils, suggesting increasingly strong deterministic environmental filtering imposed by drought. In addition, drought reduced microbial network size but increased the complexity and stability of bacterial networks by favoring drought-tolerant taxa. Furthermore, drought-driven shifts in microbial community compositions significantly altered functional genes and associated ecosystem functioning. These findings suggest that microbial communities may become less variable but more vulnerable, and the detrimental effects of biodiversity loss on ecosystems could be more severe in an increasingly drought-prone world.",crossref,0
Geometry controls momentum flux in the sprinkler problem,https://www.pnas.org/doi/abs/10.1073/pnas.2537479123?mi=eymic2&af=R&access=on&content=articlesChapters&publication=pnas&sortBy=Earliest&target=default,Proceedings of the National Academy of Sciences: Keyword search for query,2026-07-13 07:00:00 UTC,2026-07-13 07:00:00+00:00,10.1073/pnas.2537479123,Leif Ristroph,"Hydro- and aero-mechanical devices convert fluid flows into useful motions, force, and power. The operating principles can involve subtle and poorly understood physics, as epitomized by open questions about systems that aspirate flows through curving tubular arms. Since its introduction by Mach and popularization by Feynman, the so-called reverse sprinkler problem has evoked many competing theories and fluid mechanical effects that have not to date been distinguished by experiments. Here we conduct a series of experiments that directly report on the motions, torques, and flows for devices whose geometries are tailored to disambiguate the leading hypotheses. Our observations run counter to several ideas, such as those based on the total angular momentum of the fluid and others focusing on the flow and pressure distributions at the outer portions of the arms. The measurements instead reveal strong correlations between the sense of torque/rotation and the fluid momentum fluxing into the device. These results suggest an operating principle for the reverse sprinkler involving isotropic input of fluid from the far field and swirl-up in the arms that generates angular momentum, a residual portion of which is injected inside and drives rotation. The mass-to-momentum flux conversion is governed by the geometry of the curving arms. The physics learned here is fundamental to flow–structure interaction problems and may inform applications for harvesting and transforming flow energy.",crossref,0
Internal stress controls tendril writhing dynamics in climbing plants,https://www.pnas.org/doi/abs/10.1073/pnas.2537010123?mi=eymic2&af=R&access=on&content=articlesChapters&publication=pnas&sortBy=Earliest&target=default,Proceedings of the National Academy of Sciences: Keyword search for query,2026-07-13 07:00:00 UTC,2026-07-13 07:00:00+00:00,10.1073/pnas.2537010123,Dražen Zanchi,"We present experimental results on the writhing dynamics of cucumber plant tendrils subjected to an axial traction force. At low forces, the tendrils’ curvature saturates exponentially in time at a limiting value. At forces higher than the critical threshold, the tendril fails to coil but develops an intrinsic coiling-prone stress, corresponding to an intrinsic residual curvature, visible if the load is released. Growth-field assessments indicate that curvature arises from differential growth. To understand these experiments we develop an autotropic morphoelastic growth model with a bi-strip geometry, in which one strip undergoes mechanosensitive growth. In the absence of an external load, curvature generation is solely limited by internal stresses. To link the actual curvature to a finite external force, the tendril is approximated as a Kirchhoff rod. The resulting model reproduces the two observed regimes: below the critical axial force, the tendril coils, and above this force, the tendril remains straight but still exhibits intrinsic curvature.",crossref,0
Orbitofrontal noradrenaline supports adaptive learning-rate adjustment in probabilistic reversal learning,https://www.pnas.org/doi/abs/10.1073/pnas.2536535123?mi=eymic2&af=R&access=on&content=articlesChapters&publication=pnas&sortBy=Earliest&target=default,Proceedings of the National Academy of Sciences: Keyword search for query,2026-07-13 07:00:00 UTC,2026-07-13 07:00:00+00:00,10.1073/pnas.2536535123,Etienne Coutureau,"Adaptive decision-making in dynamic environments requires flexible adjustment of learning speed to balance stability and flexibility. When outcomes are highly stochastic, learners must avoid over-interpreting noise and update more slowly, whereas in volatile environments where contingencies change frequently, learning should accelerate to rapidly incorporate new evidence. Theories propose that internal estimates of uncertainty tune learning rates through neuromodulation-dependent mechanisms. Here, we investigated how noradrenergic inputs from the locus coeruleus (LC) to the orbitofrontal cortex (OFC) support adaptive learning under uncertainty. We show that, in a probabilistic reversal learning task performed across different levels of stochasticity, rats exhibited behavior best explained by an adaptive reinforcement-learning model in which learning rates dynamically adjusted according to model-estimated stochasticity and volatility, outperforming standard fixed-rate models. Noradrenaline release in the OFC closely tracked trial-by-trial, model-derived volatility estimates around contingency changes. Disrupting LC→OFC noradrenergic inputs reproduced the model-predicted impairment in adaptive learning-rate adjustment associated with model-estimated volatility. Together, these findings identify OFC noradrenergic signaling as a key circuit mechanism supporting learning-rate adjustment in response to internal estimates of volatility during adaptive decision-making under uncertainty.",crossref,0
Crowding controls the scaling of bus frequency with demand,https://www.pnas.org/doi/abs/10.1073/pnas.2535998123?mi=eymic2&af=R&access=on&content=articlesChapters&publication=pnas&sortBy=Earliest&target=default,Proceedings of the National Academy of Sciences: Keyword search for query,2026-07-13 07:00:00 UTC,2026-07-13 07:00:00+00:00,10.1073/pnas.2535998123,Marc Barthelemy,"Cities must allocate limited resources to maintain mobility, with uncertainties about the resulting state of the system. Analyzing roughly 3,000 bus routes with more than 4 billion yearly riders across 19 metropolitan areas worldwide, we uncover a robust scaling law of the form
                    
                      
                        
                          f
                          ∼
                          
                            
                              (
                              d
                              /
                              t
                              )
                            
                            α
                          
                        
                      
                    
                    with exponent
                    
                      
                        
                          α
                          ∈
                          [
                          1
                          /
                          2
                          ,
                          
                          2
                          /
                          3
                          ]
                        
                      
                    
                    , linking the service frequency
                    
                      
                        f
                      
                    
                    to passenger demand
                    
                      
                        d
                      
                    
                    and route duration
                    
                      
                        t
                      
                    
                    . We show that this scaling emerges from a simple optimization principle: Cities implicitly minimize total passenger waiting time under a fixed operational budget when both schedule frequency and crowding are taken into account. This mechanism produces two universal regimes: a frequency-dominated regime with
                    
                      
                        
                          α
                          =
                          1
                          /
                          2
                        
                      
                    
                    when crowding is negligible and a capacity-dominated regime with
                    
                      
                        
                          α
                          =
                          2
                          /
                          3
                        
                      
                    
                    when most routes are overloaded. Intermediate exponents arise when only part of the network operates near capacity. Furthermore, we find that the benefits of additional investment are highly uneven across systems. For instance, our model suggests that a
                    
                      
                        
                          20
                          %
                        
                      
                    
                    budget increase yields nearly a 5-min reduction in daily waiting time per passenger in Boston, compared to only about 1 min in Paris. These findings place urban transit within a broader class of constrained capacity-allocation problems, while highlighting a distinct regime in which prescribed route demands shape the allocation of limited service resources. The resulting scaling laws show how simple optimization principles can generate systematic exponents in complex transport systems, beyond the dissipation-based frameworks usually considered in physical and biological flow networks.",crossref,0
