title,link,source,published_str,pub_date,doi,last_author,abstract,abstract_source,must_have_abstract
Unravelling the key factors governing O2 evolution upon charging a reversible LiOH-based nonaqueous Li | |O2 battery,https://www.nature.com/articles/s41467-026-75284-2,Physical sciences : Nature Communications subject feeds,2026-07-09 00:00:00 UTC,2026-07-09 00:00:00+00:00,,Tao Liu,"Achieving a reversible four-electron-per-oxygen-molecule oxygen evolution reaction is an essential yet highly challenging task for nonaqueous lithium hydroxide-based Li | |O2 batteries, as the kinetically sluggish oxygen evolution reaction tends to entangle with competing parasitic reactions, whose origins and mitigating strategies remain largely elusive. Here we construct a highly reversible lithium hydroxide-based Li | |O2 battery using iron–cobalt–nickel layered double hydroxide catalysts and tetramethylene sulfone-based electrolytes. Lithium hydroxide decomposition toward oxygen evolution involves key reactive oxygen species of surface-bound hydroxyl and hydroxyl radicals, but no singlet oxygen. These hydroxyl species corrode the electrolyte and carbon support, predominantly accounting for charging irreversibility. While oxidation-resistant solvents and electrical conductors are necessary to reduce hydroxyl-induced side reactions, the synergistic interplay of interfacial water solvation and catalytic surface structures hold the key to steering hydroxyl activity toward the desirable oxygen evolution reaction or by-product formation. This work offers insights into achieving long-life lithium hydroxide-based Li | |O2 batteries.",nature_html,0
An adaptive modeling method with optimal order selection for thermostatically controlled loads,https://www.sciencedirect.com/science/article/pii/S0306261926010032?dgcid=rss_sd_all,ScienceDirect Publication: Applied Energy,2026-07-09 00:00:00 UTC,2026-07-09 00:00:00+00:00,,Wen-Yan Hu,,,0
A two-stage distributed optimization for non-convex P2P energy trading in prosumer-based distribution networks,https://www.sciencedirect.com/science/article/pii/S0306261926010184?dgcid=rss_sd_all,ScienceDirect Publication: Applied Energy,2026-07-09 00:00:00 UTC,2026-07-09 00:00:00+00:00,,Xiaofei Wang,,,0
Bridging macro-trend and micro-dynamics: A robust mixed-frequency framework for mid-term load forecasting,https://www.sciencedirect.com/science/article/pii/S0306261926010160?dgcid=rss_sd_all,ScienceDirect Publication: Applied Energy,2026-07-09 00:00:00 UTC,2026-07-09 00:00:00+00:00,,Dalin Qin,,,0
Continuous electricity from charged total dissolved solids in wastewater using a wood-based ion-selective power generator,https://www.nature.com/articles/s41467-026-75514-7,Physical sciences : Nature Communications subject feeds,2026-07-09 00:00:00 UTC,2026-07-09 00:00:00+00:00,,Kunkun Tu,"Exploring the potential for secondary utilization of wastewater is a prudent strategy to achieve “take-make-use-reuse” circular economy. Taking advantages of wood’s hierarchical structure and large surface area, in this project, we fabricate surface-encapsulated anion-selective and cation-selective wood membranes (comprising up to 98% eco-friendly materials) through a two-step process: dip-coating with either positively charged 2(dimethylamino)ethyl methacrylate or negatively charged acrylic acid, followed by energy-efficient sunlight-induced polymerization. The output voltage and current of a single modified wood cell (20 × 20 × 3 mm3) in modulated wastewater from flue gas desulfurization are 55 mV and 0.6 µA, respectively, tenfold higher than that of untreated wood cells. When five cells are connected in series, the output voltage reaches 0.27 V, sufficient to power simple electronic devices. This underscores its potential for scaling up and its viability for future applications in industrial power plants.",nature_html,0
Household coordination can aid solar adoption,https://www.nature.com/articles/s41560-026-02103-9,Nature Energy,2026-07-09 00:00:00 UTC,2026-07-09 00:00:00+00:00,10.1038/s41560-026-02103-9,Nicole D. Sintov,Coordination and active deliberation that includes the whole household can facilitate solar adoption. Interventions targeting energy adoption are likely to be more effective when they are designed to support collective decision making rather than focusing on a single member of the household.,nature_html,0
Family dynamics are a missing piece in understanding residential solar adoption,https://www.nature.com/articles/s41560-026-02104-8,Nature Energy,2026-07-09 00:00:00 UTC,2026-07-09 00:00:00+00:00,10.1038/s41560-026-02104-8,Kristin F. Hurst,"Residential solar adoption is typically conceptualized as an individual-level decision, overlooking the relational complexity that underpins household decision-making. Here we examine how intrahousehold dynamics shape solar adoption by carrying out two studies. Using interview data from 39 couples, Study 1 identified role sets: ‘in sync’, observed among adopter households and characterized by shared goals and division of labour, and ‘oppositional’, marked by disagreement and found among non-adopters. However, catalysts (for example, expiring tax credits, escalating bills) were often necessary to move in-sync households to adoption. Using surveys of lost and current adopters (N = 394), Study 2 investigated the roles of household actors: in adopter households, romantic partners and parents played larger roles, executed more tasks, initiated more discussions and expressed greater positivity than in lost-customer households. Greater household-wide support and even disagreement predicted adoption. Together, these results highlight that household coordination is critical for adoption.",nature_html,0
Found: the toxic killer that caused an ocean catastrophe,https://www.nature.com/articles/d41586-026-02112-4,Nature,2026-07-09 00:00:00 UTC,2026-07-09 00:00:00+00:00,10.1038/d41586-026-02112-4,,Scientists identify an alga species as the culprit behind the deaths of more than one million marine animals. Scientists identify an alga species as the culprit behind the deaths of more than one million marine animals.,nature_html,0
Pair of ‘super-puff’ planets are lighter than candy floss,https://www.nature.com/articles/d41586-026-02114-2,Nature,2026-07-09 00:00:00 UTC,2026-07-09 00:00:00+00:00,10.1038/d41586-026-02114-2,,Two gas giants circling the same star are among the least dense planets ever found. Two gas giants circling the same star are among the least dense planets ever found.,nature_html,0
Graduating without a thesis: meet the people getting ‘practical’ PhDs in China,https://www.nature.com/articles/d41586-026-01242-z,Nature,2026-07-09 00:00:00 UTC,2026-07-09 00:00:00+00:00,10.1038/d41586-026-01242-z,Xiaoying You,Nature spoke to three students from China’s first cohort of PhD candidates who are allowed to graduate with products instead of papers. Nature spoke to three students from China’s first cohort of PhD candidates who are allowed to graduate with products instead of papers.,nature_html,0
Whoops! Most arXiv papers contain information never meant to be shared,https://www.nature.com/articles/d41586-026-02057-8,Nature,2026-07-09 00:00:00 UTC,2026-07-09 00:00:00+00:00,10.1038/d41586-026-02057-8,David Brzostowicki,"Passwords, GPS coordinates and private conversations have all been found in the metadata and source files of millions of preprint submissions. Passwords, GPS coordinates and private conversations have all been found in the metadata and source files of millions of preprint submissions.",nature_html,0
"‘This time, it’s the other way around’: how Indonesia is reclaiming the science of human history",https://www.nature.com/articles/d41586-026-01357-3,Nature,2026-07-09 00:00:00 UTC,2026-07-09 00:00:00+00:00,10.1038/d41586-026-01357-3,Dyna Rochmyaningsih,"After a massive restructuring of its research ecosystem, Indonesia is taking the lead on its own palaeontological research. After a massive restructuring of its research ecosystem, Indonesia is taking the lead on its own palaeontological research.",nature_html,0
A ferroelectric-induced few-nm-thick graphene membrane enables molecular sliding for ultra-fast separation,https://academic.oup.com/nsr/advance-article/doi/10.1093/nsr/nwag419/8729105?rss=1,National Science Review Advance Access,2026-07-09 00:00:00 UTC,2026-07-09 00:00:00+00:00,10.1093/nsr/nwag419,Nanping Xu,"Graphene’s atomically smooth surface offers a promising platform for achieving superlubricity, not only in solid-state contacts but also in mass transport. While its ability to minimize interfacial friction has been extensively explored in microelectromechanical systems, engines, and biomedical implants, harnessing this property for near-frictionless molecular flow to enable ultra-fast permeation remains a fundamental challenge. The principal limitation lies in the fabrication of defect-free graphene membranes with an exposed surface for probing intrinsic molecular friction and the associated transport phenomena. Here, we demonstrate a ferroelectric-polarization-assisted strategy for fabricating a 3.5 nm-thick graphene skin membrane for ultra-fast and selective separation. This is achieved by electrospinning a graphene oxide (GO)-poly(vinylidene fluoride) (PVDF) mixture, followed by thermal reduction. The crucial step involves the electric-field-induced transition of PVDF from the paraelectric (α) to the ferroelectric (β) phase, which promotes ordered chain packing and reduces the polymer’s affinity for GO, thereby driving the spontaneous segregation of GO to the PVDF nanofiber surface. The resulting graphene surface minimizes interfacial interactions with permeating molecules, reducing the molecular flow friction coefficient by 2–3 orders of magnitude. Acting either a selective layer or a support, the membrane exhibits ultra-fast permeation of water and organic solvents, surpassing current state-of-the-art membranes for water and solvent purification. For instance, water flux up to 105.1 L m-2 h-1, salt rejection of > 99.99% and long-term stability of 1000 h are achieved for desalination of hypersaline with salt concentration >150 g L-1. This work establishes a new paradigm for realizing ultra-fast molecular transport and provides a versatile platform for investigating nanoscale fluidics at material interfaces.",rss_oup,0
Author Correction: Electrostatic potentials of atomic nanostructures at metal surfaces quantified by scanning quantum dot microscopy,https://www.nature.com/articles/s41467-026-75450-6,Physical sciences : Nature Communications subject feeds,2026-07-09 00:00:00 UTC,2026-07-09 00:00:00+00:00,,Christian Wagner,,,0
Self-single-atomization of active sites in electrochemical ammonia synthesis unveiled by machine learning potential,https://academic.oup.com/nsr/advance-article/doi/10.1093/nsr/nwag417/8729103?rss=1,National Science Review Advance Access,2026-07-09 00:00:00 UTC,2026-07-09 00:00:00+00:00,10.1093/nsr/nwag417,Jianping Xiao,"Electrochemical NO reduction reaction (eNORR) has emerged as a promising route for the synthesis of green ammonia. Fe was observed experimentally with great activity and selectivity for eNORR to ammonia. However, we found the electrochemical performance over iron is not due to its intrinsic activity, but from an adaptive capability of self-single-atomization in operando condition. We first performed Grand Canonical Monte Carlo (GCMC) simulations driven by a machine learning potential (MLP), where we explored ∼2.5 million possible active structures and their evolution with increased electrode potential. Microkinetic modelling indicates that Fe surface will be predominantly covered by adsorbed N* species in reaction, resulting in the formation of FeNx motifs by self-single-atomizing. Statistical results indicate that the top sites of isolated FeNx motifs contribute higher activity of ammonia synthesis than bridge and hollow sites. Furthermore, based on the self-single-atomized active sites, we reproduced and rationalized the variation trends of experimental Faradaic efficiency of different products with electrode potential, verifying the reliability of proposed active site herein. Hence, we propose to make use of the self-single-atomization capability of catalysts in working conditions to construct active sites beyond ammonia synthesis.",rss_oup,0
Geopolymer-based electrolytes derived from industrial solid waste for structural energy storage,https://www.cell.com/joule/fulltext/S2542-4351(26)00231-X?rss=yes,Joule,2026-07-09 00:00:00 UTC,2026-07-09 00:00:00+00:00,10.1016/j.joule.2026.102547,Changwen Miao,"Turning waste into useful infrastructure is central to low-carbon energy storage. This study converts fly ash and slag into a strong, ion-conducting geopolymer electrolyte for zinc-ion brick batteries. By engineering connected pores that guide ions efficiently, the material combines mechanical durability with long-term electrochemical performance, pointing toward building components that can both bear loads and store energy.",rss_cell,0
A dilute nitrate electrolyte for all-climate batteries,https://www.cell.com/joule/fulltext/S2542-4351(26)00232-1?rss=yes,Joule,2026-07-09 00:00:00 UTC,2026-07-09 00:00:00+00:00,10.1016/j.joule.2026.102548,Chunzhong Li,"You et al. report a data-driven strategy that enables inexpensive lithium nitrate to serve as the main salt in a dilute lithium-ion battery electrolyte. The designed low-concentration electrolyte reduces cost while stabilizing battery interfaces, enabling all-climate operation in pouch cells.",rss_cell,0
Triple-junction all-perovskite solar cells with self-assembling hole contacts in all subcells,https://www.cell.com/joule/fulltext/S2542-4351(26)00259-X?rss=yes,Joule,2026-07-09 00:00:00 UTC,2026-07-09 00:00:00+00:00,10.1016/j.joule.2026.102575,Steve Albrecht,"This study presents a bilayer strategy employing graphene oxide and a self-assembled monolayer for Sn-Pb perovskite solar cells. This approach enables efficient and stable triple-junction all-perovskite solar cells, achieving a 27.3% efficiency alongside exceptional operational stability with a T90 of 770 h.",rss_cell,0
In situ growth and crystal monitoring for high-efficiency vacuum-deposited perovskite-based solar cells,https://www.cell.com/joule/fulltext/S2542-4351(26)00260-6?rss=yes,Joule,2026-07-09 00:00:00 UTC,2026-07-09 00:00:00+00:00,10.1016/j.joule.2026.102576,Henk J. Bolink,"Vacuum deposition offers an industry-compatible route for perovskite solar cells, yet controlling perovskite crystallization remains challenging. Choi et al. introduce a structure-directing layer beneath a perovskite absorber and use in situ photoluminescence to monitor the nucleation, strain, and defects of perovskite, leading to efficient devices with improved stability.",rss_cell,0
Leveraging thermal regimes and connectivity networks to promote evolutionary adaptation across coral reef seascapes,https://www.cell.com/one-earth/fulltext/S2590-3322(26)00153-3?rss=yes,One Earth,2026-07-09 00:00:00 UTC,2026-07-09 00:00:00+00:00,10.1016/j.oneear.2026.101752,Peter J. Mumby,"The rise of marine heat waves threatens coral reefs, potentially outpacing adaptation. Managing reef seascapes to support thermal evolution is well recognized, but specific actions and site prioritizations are only emerging. We present an operational framework that leverages heat-wave exposure and larval dispersal patterns to create reef functional units with distinct roles and management needs. Using the Great Barrier Reef, we explore the emergent management portfolio and find complementary regional priorities: protection and outplanting for assisted evolution are prioritized in southern reefs, while northern reefs serve as valuable heat-tolerant sources. Strategic, evolution-informed management is critical for reef survival as climate pressures intensify.",openalex,0
Self-reconfiguring modular robotic boats,https://www.nature.com/articles/s41467-026-74527-6,Physical sciences : Nature Communications subject feeds,2026-07-09 00:00:00 UTC,2026-07-09 00:00:00+00:00,,Daniela Rus,"Self-reconfiguring aquatic robots offer promise for a wide range of marine applications, including building temporary infrastructure, remote maintenance and search-and-rescue operations, environmental monitoring, and on-demand transportation. However, achieving autonomous water-based self-reconfiguration, even in two dimensions on the water surface, remains challenging, due to complex nonlinear hydrodynamics, disturbances from self-motion and neighboring robots, as well as external environmental factors. Here, we present the FloatForm platform, a group of miniature modular robotic boats capable of self-assembling into physically connected structures, self-reconfiguring, and collectively traveling as larger assemblies via a hybrid coordination framework. Each robot unit is equipped with onboard sensing, motion control, and the ability to coordinate and physically connect with its neighbors. We demonstrate the feasibility of aquatic self-reconfiguration via hybrid coordination, where distributed controllers on each robot handle coordination tasks such as aggregating into desired shapes and avoiding collisions, while a minimalist central planner oversees the overall success of each task and fixes final imperfections. This work advances the design, control, and coordination of modular robotic systems in aquatic environments, enabling flexible, robust, and scalable applications on the water.",nature_html,0
China’s new initiative on basic research,https://academic.oup.com/nsr/advance-article/doi/10.1093/nsr/nwag406/8729093?rss=1,National Science Review Advance Access,2026-07-09 00:00:00 UTC,2026-07-09 00:00:00+00:00,10.1093/nsr/nwag406,Mu-ming Poo,,,0
"Does AI work for us, or do we work for AI?",https://www.science.org/doi/abs/10.1126/science.aei9754?af=R,AAAS: Science: Table of Contents,2026-07-09 06:00:05 UTC,2026-07-09 06:00:05+00:00,10.1126/science.aei9754,Timothy Wu,"There is little enthusiasm for a technology that turns human users into “reverse centaurs,” argues a critic",crossref,0
What do we know about sex?,https://www.science.org/doi/abs/10.1126/science.aeg8740?af=R,AAAS: Science: Table of Contents,2026-07-09 06:00:05 UTC,2026-07-09 06:00:05+00:00,10.1126/science.aeg8740,Nathan H. Lents,It depends on whom you ask,crossref,0
To eat or to breathe?,https://www.science.org/doi/abs/10.1126/science.aei7713?af=R,AAAS: Science: Table of Contents,2026-07-09 06:00:05 UTC,2026-07-09 06:00:05+00:00,10.1126/science.aei7713,M. Denise Dearing,"In highland mice, the responses to low oxygen and toxins compete for a shared molecular regulator",crossref,0
Ice as a geochemical reactor,https://www.science.org/doi/abs/10.1126/science.aej2248?af=R,AAAS: Science: Table of Contents,2026-07-09 06:00:05 UTC,2026-07-09 06:00:05+00:00,10.1126/science.aej2248,Kevin M. Rosso,Freezing redirects the fate of iron in Earth’s cryosphere,crossref,0
Degron-independent recruitment of KAT2A expands the target space of CRBN molecular glues,https://www.science.org/doi/abs/10.1126/science.aef5391?af=R,AAAS: Science: Table of Contents,2026-07-09 06:00:05 UTC,2026-07-09 06:00:05+00:00,10.1126/science.aef5391,Eric S. Fischer,"Lysine acetyltransferases (KATs) cooperate with oncogenes such as c-Myc, estrogen receptor, and lysine methyltransferase 2A (KMT2A) fusions to sustain malignant programs. Targeting of KAT proteins has shown clinical efficacy; however, achieving homolog selectivity for most KATs remains a major challenge. By extending cereblon (CRBN)–based molecular glues beyond the canonical degron space, we developed an exquisitely selective degrader of KAT2A. Cryo–electron microscopy revealed that CRBN recruits KAT2A independently of a degron; instead, the molecular glue engages a surface-exposed tyrosine, mimicking antibody-like molecular recognition. Selective KAT2A degradation leads to potent ablation of histone H3 lysine 9 acetylation (H3K9Ac), antiproliferative effects in acute myeloid leukemia cell lines, and in vivo efficacy in a patient-derived xenograft model, establishing KAT2A as a targetable vulnerability to treat a wide range of malignancies. More generally, degron-independent recruitment extends the CRBN-targetable proteome.",crossref,0
A note to my younger self,https://www.science.org/doi/abs/10.1126/science.aek3445?af=R,AAAS: Science: Table of Contents,2026-07-09 06:00:05 UTC,2026-07-09 06:00:05+00:00,10.1126/science.aek3445,Becca Neumann,,,0
A phase microscope for quantum gases,https://www.science.org/doi/abs/10.1126/science.adt1712?af=R,AAAS: Science: Table of Contents,2026-07-09 06:00:05 UTC,2026-07-09 06:00:05+00:00,10.1126/science.adt1712,C. Weitenberg,"Coherence properties are central to quantum systems and are at the heart of phenomena such as superconductivity. In this work, we studied coherence properties of an ultracold Bose gas in a two-dimensional optical lattice across the thermal phase transition. To infer the phase coherence and phase fluctuation profiles, we used direct matter-wave imaging of higher Talbot revivals and introduced a phase microscope based on a site-resolved mapping of phase fluctuations to density fluctuations during matter-wave imaging. We observed the algebraic decay of the phase correlations in the superfluid phase and a linear temperature increase of the exponent. These techniques may enable studying coherence properties in strongly correlated quantum systems with full spatial resolution.",crossref,0
Relativistic collapse of the classical triple bond in the CBi− molecular ion,https://www.science.org/doi/abs/10.1126/science.aei1285?af=R,AAAS: Science: Table of Contents,2026-07-09 06:00:05 UTC,2026-07-09 06:00:05+00:00,10.1126/science.aei1285,Lai-Sheng Wang,"The conventional framework for chemical bonding between main-group elements involves separate σ and π orbitals to describe multiple bonds. However, relativistic effects mix these orbitals in molecules containing heavy elements through spin–orbit coupling, leaving the total angular-momentum projection (ω) as the only good quantum number. Direct experimental evidence that relativistic effects change the σ-π bonding framework has remained elusive. Here, we probe the carbon-bismuth triple bond in the CBi
                    −
                    anion using high-resolution cryogenic photoelectron spectroscopy, coupled with relativistic four-component Dirac-Coulomb coupled-cluster calculations. Even though the CBi
                    −
                    anion is isovalent to the well-known CN
                    −
                    species, we demonstrate that the traditional σ + 2π triple-bond picture collapses into a pure π-like |ω| = 3/2 and two |ω| = 1/2 Kramers pairs containing substantial σ/π mixing.",crossref,0
Transient assembly of precision-tuned platinum-skin intermetallic catalysts for fuel cells,https://www.science.org/doi/abs/10.1126/science.aeg2036?af=R,AAAS: Science: Table of Contents,2026-07-09 06:00:05 UTC,2026-07-09 06:00:05+00:00,10.1126/science.aeg2036,Wenbin Hu,"Highly efficient catalysts require precisely engineered intricate structures, yet conventional thermodynamically controlled syntheses often involve cumbersome procedures and limited structural precision. We report a nonequilibrium transient assembly strategy for the ultrafast synthesis of intricately structured nanocatalysts, including core-shell platinum (Pt)–skinned intermetallic nanocrystals exemplified by Pt@PtFe-i. By using a periodic thermal-pulse protocol to drive the continuous evolution of high-energy transient PtFe configurations, we achieved the synchronous assembly of a high-order PtFe intermetallic core and an atomic-layer-precise Pt skin. The Pt@PtFe-i catalyst exhibits coordination-dependent compressive strain within the Pt skin, creating a high density of highly active sites for the oxygen reduction reaction. The H
                    2
                    -air fuel cell with Pt@PtFe-i delivers a peak power of 1.25 watts per square centimeter at a cathode Pt loading of 0.1 milligrams per square centimeter, with a small peak power loss of 3.2% after 30,000 accelerated durability testing cycles.",crossref,0
The hidden logic of emotion,https://www.science.org/doi/abs/10.1126/science.aeh1665?af=R,AAAS: Science: Table of Contents,2026-07-09 06:00:05 UTC,2026-07-09 06:00:05+00:00,10.1126/science.aeh1665,Joshua P. Johansen,Internal emotion models unify research across species and spark fresh ideas for treating anxiety and trauma,crossref,0
A single freeze cycle redirects iron mineral transformation,https://www.science.org/doi/abs/10.1126/science.aee9519?af=R,AAAS: Science: Table of Contents,2026-07-09 06:00:05 UTC,2026-07-09 06:00:05+00:00,10.1126/science.aee9519,Jean-François Boily,"Polycrystalline ice formation concentrates mineral nanoparticles into liquid boundaries between growing ice crystals. Here we show that minutes of freezing dictate iron mineral fate over subsequent months of aqueous aging. A single freeze–thaw cycle irreversibly aggregates ferrihydrite through converging physical and chemical mechanisms. Freeze concentration collapses electrostatic barriers while cryosuction strips hydration layers and compresses nanoparticles into micrometer-scale planar aggregates. Chemical evidence points to interfacial (hydr)oxo bridging, alongside hydrogen bonding, that resists disaggregation. These mechanisms lock nanoparticles into mesocrystal-like assemblages that retain their nanoscale identity but inhibit dissolution–reprecipitation to goethite, instead favoring solid-state transformation to hematite. Ice formation thus acts as a geochemical reactor, driving aggregation and interfacial bonding that redirect iron speciation, with broad implications for nutrient cycling and carbon preservation across the cryosphere.",crossref,0
