title,link,source,published_str,pub_date,doi,last_author,abstract,abstract_source,must_have_abstract
Focused ultrasound blood-brain barrier opening reveals a paradoxical remote metabolic response in the primate brain,https://www.science.org/doi/abs/10.1126/sciadv.aed4944?af=R,AAAS: Science Advances: Table of Contents,2026-07-17 07:00:00 UTC,2026-07-17 07:00:00+00:00,10.1126/sciadv.aed4944,Vincent P. Ferrera,"Low-intensity focused ultrasound (LIFU) is a promising technique for opening the blood-brain barrier (BBB) for drug delivery, but its physiological consequences in remote brain regions remain a major blind spot for clinical safety and efficacy. To address this gap, we performed the quantitative mapping of brain metabolism following a focal LIFU-induced BBB opening in a nonhuman primate model, using quantitative BOLD MRI to measure the oxygen extraction fraction (OEF). We report a paradoxical response: While the targeted striatum showed no significant metabolic changes, we observed a profound and spatially specific increase in OEF in the homologous contralateral striatum, an effect predominantly driven by the putamen. These findings demonstrate that focal BBB opening is not merely a localized vascular event but a potent neuromodulatory intervention that induces metabolic stress in distant, untreated brain regions, a discovery with critical implications for the safe and effective clinical translation of all focal brain therapies.",crossref,0
Microbubble-activated CO2 regeneration in scalable microporous liquids enabled by contact electrocatalysis,https://www.science.org/doi/abs/10.1126/sciadv.aef9017?af=R,AAAS: Science Advances: Table of Contents,2026-07-17 07:00:00 UTC,2026-07-17 07:00:00+00:00,10.1126/sciadv.aef9017,Zishuai Zhang,"Conventional carbon dioxide (CO
                    2
                    ) capture systems are constrained by limited uptake capacity and energy-intensive regeneration. Here, we formulate a microporous carbon capture solution (MCCS) by dispersing a permanent-porosity framework (ZIF-67) in a liquid absorbent, coupling solvent-excluded physisorption with chemical uptake and boosting the CO
                    2
                    capture capacity by ∼45%. Instead of bulk thermal stripping, we implement interfacial, microbubble-activated regeneration (MAR) with a decreased monoethanolamine (MEA) loss rate by ∼38%. Microbubble activation refreshes gas-liquid-solid contact to liberate 100% physiosorbed CO
                    2
                    , whereas microbubble-collapse events that mechanically trigger contact electrocatalysis (CEC), enabling interfacial hydroxyl radicals (•OH) that cleave carbamates under mild conditions and regenerates a substantial additional 37 to 55% of chemically absorbed CO
                    2
                    . Theoretical analyses reveal that •OH is the key species governing CO
                    2
                    regeneration in the CEC-MAR process through oxidative carbon-nitrogen bond cleavage, followed by •H-assisted intermediate reduction to regenerate the amine. To approach engineering relevance, we realize kilogram-scale zeolitic imidazolate framework (ZIF) synthesis under ambient conditions using simple mechanical stirring, providing scalable MCCS inventory to enable (i) continuous delivery of high-purity CO
                    2
                    (1437 millimoles over 200 minutes) from a laboratory-scale integrated system and (ii) direct electroreduction to carbon monoxide (CO) with a faradaic efficiency (FE
                    CO
                    ) of 51% without CO
                    2
                    supply. More broadly, it establishes a porous-liquid, interfacial-regeneration paradigm that decouples capacity from stoichiometry and enables electrified, continuous CO
                    2
                    capture, regeneration, and utilization under scalable, low-temperature conditions.",crossref,0
Linking functional and structural dendritic spine remodeling during fear learning and extinction in vivo,https://www.science.org/doi/abs/10.1126/sciadv.aec3961?af=R,AAAS: Science Advances: Table of Contents,2026-07-17 07:00:00 UTC,2026-07-17 07:00:00+00:00,10.1126/sciadv.aec3961,Cora Sau Wan Lai,"Structural plasticity of dendritic spines has been observed during different learning paradigms, but how the functional dynamics of dendritic spines changes with memory processing and how these patterns relate to structural plasticity and dendritic integration remain unclear. Here, we perform longitudinal functional and structural in vivo imaging of the frontal association cortex in mice subject to fear conditioning and extinction over several days. We show that fear learning induced responsive spines that are more likely to be synchronous and clustered, which are consolidated over the following days but attenuated by extinction. We develop a causal inference model demonstrating that the active spine calcium signals during fear learning prevent the spines from being eliminated while promoting the elimination of neighboring spines after memory consolidation. Furthermore, the dendritic responsive signal reveals a learning-dependent tone discrimination pattern that is correlated to spines’ structural remodeling. Our findings provide in vivo evidence consistent with functional-structural link of dendritic spines in a bidirectional learning paradigm.",crossref,0
Picosecond switching of magnetic tunnel junctions by spin-orbit torque,https://www.science.org/doi/abs/10.1126/sciadv.aed0607?af=R,AAAS: Science Advances: Table of Contents,2026-07-17 07:00:00 UTC,2026-07-17 07:00:00+00:00,10.1126/sciadv.aed0607,Weisheng Zhao,"Ultrafast switching of magnetic tunnel junctions (MTJs) is essential for future high-bandwidth memory and in-memory computing. However, state-of-the-art electrical switching of MTJs remains constrained to hundreds of picoseconds, leaving a substantial gap between memory and processors. Here, we experimentally demonstrate field-free switching of three-terminal MTJs using picosecond electrical pulses driven by spin-orbit torque (SOT), surpassing the speed limit by an order of magnitude. We further use voltage-gated (VG) effect to probe SOT switching mechanisms over wide pulse-width ranges and identify a nonmonotonic VG-SOT efficiency. While the efficiency is pronounced under long-pulse excitation, it diminishes in the subnanosecond regime but reemerges as the pulse width scales down to 13.2 ps, yielding an energy consumption about 30 fJ per bit. Micromagnetic analysis reveals that, from dc to picosecond timescale, the dominant magnetization switching dynamics evolve from thermally activated reversal to incoherent precession to coherent precession. These results establish picosecond VG-SOT as a pathway toward ultrafast and energy-efficient memory and logic.",crossref,0
When trust building looks like surveillance: Public polarization toward Chicago policing,https://www.science.org/doi/abs/10.1126/sciadv.aeb7575?af=R,AAAS: Science Advances: Table of Contents,2026-07-17 07:00:00 UTC,2026-07-17 07:00:00+00:00,10.1126/sciadv.aeb7575,Shelley Liu,"Public debate about policing highlights competing views about whether community initiatives build trust or reinforce surveillance. We argue that perceptions depend on prior state orientations, which can polarize opinions across groups. Using a preregistered survey experiment in Chicago, we examined responses to the police department’s “Sentiment Dashboard,” a project designed to enhance legitimacy by collecting community feedback. Results show that the dashboard increased trust in police among non-Black respondents but reduced trust among Black respondents, especially when framed as monitoring. Among non-Black respondents, dashboard exposure also reduced support for the Black Lives Matter movement and racial equity policies unrelated to policing, such as diverse hiring and climate justice. Mechanism testing with qualitative evidence suggests that treated non-Black participants were more likely to regard police reforms as substitutes for racial equity policies, rendering further measures unnecessary. These findings reveal how state legitimacy initiatives may instead widen racial divides and weaken coalitions for structural reform.",crossref,0
Hybrid Amyloid–Boron Nitride Aerogels for Lightweight Sound Insulation,https://advanced.onlinelibrary.wiley.com/doi/10.1002/adma.74088?af=R,Wiley: Advanced Materials: Table of Contents,2026-07-17 07:00:00 UTC,2026-07-17 07:00:00+00:00,10.1002/adma.74088,Raffaele Mezzenga,"ABSTRACT
                  Boron nitride (BN) is a lightweight, thermally stable, and chemically inert material widely used in electronics and insulation, yet its synthesis typically relies on energy‐intensive, high‐temperature routes. Here, we introduce a sustainable, bottom‐up strategy to fabricate hybrid boron nitride–amyloid fibril (BNAF) aerogels, in which whey protein amyloid fibrils serve as renewable scaffolds that assist the organization of BN‐rich domains. A mild ultrasonication–freeze‐drying process yields ultralight aerogels with hierarchical porosity, increased BN‐like ordering relative to the protein‐free control, and fibril‐induced reinforcement. The hybrid aerogels combine mechanical reinforcement, thermal stability under moderate‐use conditions, and strong acoustic performance, achieving sound absorption coefficients above 0.8, noise reduction coefficients up to 0.63, and sound transmission losses of 25–30 dB. This combination of low density and strong sound shielding compares favorably with common lightweight acoustic materials such as fiberglass, establishing amyloid‐assisted BN–protein hybrid aerogels as promising candidates for moderate‐temperature, weight‐sensitive noise‐reduction applications.",crossref,0
Active thermodynamics of inertial chiral active gases: Equation of state and edge currents,https://www.pnas.org/doi/abs/10.1073/pnas.2532158123?mi=eymic2&af=R&access=on&content=articlesChapters&publication=pnas&sortBy=Earliest&target=default,Proceedings of the National Academy of Sciences: Keyword search for query,2026-07-17 07:00:00 UTC,2026-07-17 07:00:00+00:00,10.1073/pnas.2532158123,Hartmut Löwen,"One of the most fundamental quests in the physics of active matter concerns the existence of a comprehensive theory for its macroscopic properties, i.e. an “active thermodynamics.” Recently, despite progress in developing this field, crucial questions, such as the influence of chirality on the thermodynamics of active matter, remain open—even in the simplest and most generic case of the ideal active gas. Here, we derive and experimentally verify key elements of the active thermodynamics of ideal chiral active gases, unveiling edge currents and odd diffusivity as their peculiar features. Our main results are the derivation of an equation of state relating density and pressure via a chirality-dependent effective temperature, the derivation of Fick’s law, including the full diffusion matrix predicting odd diffusion, and the exact prediction of edge currents at container walls that nonmonotonically depend on chirality. Our results serve as a crucial step toward a comprehensive understanding of how chirality influences and allows us to control the macroscopic properties of active matter.",crossref,0
"Relative Thom conjectures, symplectic and beyond",https://www.pnas.org/doi/abs/10.1073/pnas.2536898123?mi=eymic2&af=R&access=on&content=articlesChapters&publication=pnas&sortBy=Earliest&target=default,Proceedings of the National Academy of Sciences: Keyword search for query,2026-07-17 07:00:00 UTC,2026-07-17 07:00:00+00:00,10.1073/pnas.2536898123,Katherine Raoux,"We establish a criterion that ensures a bounded almost complex curve in a bounded almost complex 4-manifold minimizes genus among all smooth surfaces that share its homology class and the transverse link on its boundary. An immediate corollary affirms the relative symplectic Thom conjecture and, moreover, yields obstructions coming from knot Floer homology to a link bounding a symplectic surface in a symplectic filling. Our results are applicable to knots in manifolds equipped with plane fields that admit no symplectic fillings; for instance, we show that symplectic surfaces in a thickening of any contact 3-manifold with nonzero Ozsváth-Szabó invariant minimize slice genus for their boundary. We conjecture that this phenomenon occurs precisely when the contact structure is tight, which would imply that tightness can be viewed as a symplecto-geometric notion.",crossref,0
The accuracy of electrostatic interactions captured by AI protein structure prediction models,https://www.pnas.org/doi/abs/10.1073/pnas.2609610123?mi=eymic2&af=R&access=on&content=articlesChapters&publication=pnas&sortBy=Earliest&target=default,Proceedings of the National Academy of Sciences: Keyword search for query,2026-07-17 07:00:00 UTC,2026-07-17 07:00:00+00:00,10.1073/pnas.2609610123,George I. Makhatadze,"A variant of the U1A protein containing four substitutions to ionizable residues was generated serendipitously due to a miscommunication. Biophysical measurements reveal this variant has twice the helical structure of wild-type U1A and is trimeric, unlike the monomeric wild type. In sharp contrast, structures predicted by deep-learning (AlphaFold2, RoseTTAFold2) and transformer-based tools (OmegaFold, ESMFold) are nearly identical to the wild-type (backbone RMSD &lt; 1 Å). Surprisingly, these models predict ionizable residues buried within the nonpolar core, contradicting established physico-chemical principles. To explore this effect further, we generated sequences containing up to all twelve residues that make up the nonpolar core of U1A. Across thousands of sequences, and depending on the AI model used, the majority of predicted structures contained fully buried ionizable residues while still maintaining the overall U1A fold. We then examined two additional proteins of comparable size, acylphosphatase and the de novo designed TOP7 fold, and observed the same phenomenon: AI models frequently predicted structures with buried ionizable residues that nevertheless retained the parent fold. However, short (50 ns) molecular dynamics simulations with physics-based force fields (CHARMM/AMBER) rapidly relaxed these structures, exposing the ionizable residues. We conclude that while AI-based tools perform exceptionally on natural sequences, they do not reliably encode the physico-chemical principles governing ionizable residue placement. We propose including brief molecular dynamics simulations as a vital validation step for AI-generated structures.",crossref,0
Response duration tracks confidence,https://www.pnas.org/doi/abs/10.1073/pnas.2612367123?mi=eymic2&af=R&access=on&content=articlesChapters&publication=pnas&sortBy=Earliest&target=default,Proceedings of the National Academy of Sciences: Keyword search for query,2026-07-17 07:00:00 UTC,2026-07-17 07:00:00+00:00,10.1073/pnas.2612367123,Chaz Firestone,"The timing of behavioral responses is among the most robust signatures of cognitive processing—with easier, more accurate, and more confident judgments typically made more quickly. But which aspects of response timing carry these signals? Whereas the time taken to
                    initiate
                    a response (e.g., the interval between stimulus onset and keypress) is one of the most popular and informative measures in experimental psychology, another aspect of response timing is its
                    duration
                    (e.g., how long the key is held down before being released). Here, across three preregistered experiments spanning perceptual and higher-cognitive tasks, we demonstrate that response duration reliably predicts subjective confidence, over and above response initiation time. When detecting faces (Experiment 1), judging motion coherence (Experiment 2), and answering trivia questions (Experiment 3), subjects held down a response key longer during trials in which they subsequently reported lower confidence in their judgments, as if making these judgments in a tentative fashion. In all cases, response duration accounted for variance in confidence that was not predicted by response initiation time. Our results suggest that response duration itself carries independent information about cognitive processing, advancing a useful and ubiquitously available tool to complement traditional response time measures in the study of cognition.",crossref,0
Polarons are probes of the dynamic nanoscale environments found in electrochemically doped π-conjugated polymers,https://www.pnas.org/doi/abs/10.1073/pnas.2615650123?mi=eymic2&af=R&access=on&content=articlesChapters&publication=pnas&sortBy=Earliest&target=default,Proceedings of the National Academy of Sciences: Keyword search for query,2026-07-17 07:00:00 UTC,2026-07-17 07:00:00+00:00,10.1073/pnas.2615650123,Chad Risko,"Charge carriers (i.e., polarons) in electrochemically doped organic (semi)conductors are proposed to be regulated by several physicochemical features, including the chemical compositions and structures of the π-conjugated frameworks of the semiconductor building blocks, the chemistry of the electrolyte (considering both the salt and solvent), multiscale and time-dependent morphology variations across the material as a function of electrochemical processes, and assorted permutations of these and other factors. To address these hypotheses, we investigate the energetic, optoelectronic, chemical, and local structural properties of negative polarons (radical anions) as a function of electrochemical doping in the donor–acceptor, π-conjugated redox copolymer P(NDI2OD-T2), also referred to as N2200. A critical finding is that there is not just “one type” of polaron in electrochemically doped P(NDI2OD-T2). Rather, an ensemble of polarons exists, with the polarons having optoelectronic signatures that are defined by their nanoscale environments. Importantly, the polaron optical signatures serve as local probes for how the operando electrochemical environments are dynamically working in concert to facilitate charge transport. Collectively, the distinctive and extensive integration of theory and measurement science presented here establishes a baseline for the roles that semiconductor and electrolyte chemistries and dynamic structural features have on polarons in electrochemically doped organic semiconductors and how these factors influence the energetics and rates of polaron transport.",crossref,0
Catalysis does not explain expansin-mediated wall creep: Distinguishing catalytic ERPs from creep-active expansins,https://www.pnas.org/doi/abs/10.1073/pnas.2615892123?mi=eymic2&af=R&access=on&content=articlesChapters&publication=pnas&sortBy=Earliest&target=default,Proceedings of the National Academy of Sciences: Keyword search for query,2026-07-17 07:00:00 UTC,2026-07-17 07:00:00+00:00,10.1073/pnas.2615892123,Daniel J. Cosgrove,,,0
When does exercise hinder rather than halt tumor progression? The decisive role of immunotherapy responsiveness,https://www.pnas.org/doi/abs/10.1073/pnas.2616250123?mi=eymic2&af=R&access=on&content=articlesChapters&publication=pnas&sortBy=Earliest&target=default,Proceedings of the National Academy of Sciences: Keyword search for query,2026-07-17 07:00:00 UTC,2026-07-17 07:00:00+00:00,10.1073/pnas.2616250123,Qinglu Wang,,,0
"Reply to Zhou et al.: Exercise, caloric restriction, and immunotherapy responsiveness in 4T1 breast cancer progression",https://www.pnas.org/doi/abs/10.1073/pnas.2617811123?mi=eymic2&af=R&access=on&content=articlesChapters&publication=pnas&sortBy=Earliest&target=default,Proceedings of the National Academy of Sciences: Keyword search for query,2026-07-17 07:00:00 UTC,2026-07-17 07:00:00+00:00,10.1073/pnas.2617811123,Rafael de Cabo,,,0
Reply to Cosgrove: Catalytic activity in expansin-like proteins does not explain wall creep but raises a flag,https://www.pnas.org/doi/abs/10.1073/pnas.2617956123?mi=eymic2&af=R&access=on&content=articlesChapters&publication=pnas&sortBy=Earliest&target=default,Proceedings of the National Academy of Sciences: Keyword search for query,2026-07-17 07:00:00 UTC,2026-07-17 07:00:00+00:00,10.1073/pnas.2617956123,Anikó Várnai,,,0
"Correction for Stöhr et al., Distinct synthetic Aβ prion strains producing different amyloid deposits in bigenic mice",https://www.pnas.org/doi/abs/10.1073/pnas.2622455123?mi=eymic2&af=R&access=on&content=articlesChapters&publication=pnas&sortBy=Earliest&target=default,Proceedings of the National Academy of Sciences: Keyword search for query,2026-07-17 07:00:00 UTC,2026-07-17 07:00:00+00:00,10.1073/pnas.2622455123,,,,0
Extensive parasite transmission and variation in a functional receptor associated with drug resistance in endemic Schistosoma mansoni,https://www.science.org/doi/abs/10.1126/sciadv.adt3721?af=R,AAAS: Science Advances: Table of Contents,2026-07-17 07:00:00 UTC,2026-07-17 07:00:00+00:00,10.1126/sciadv.adt3721,Joanne P. Webster,"Mass drug administration (MDA) with praziquantel is the cornerstone of schistosomiasis control and elimination efforts. To assess how long-term MDA affects parasite populations, we analyzed whole-genome sequence data from 570 
                    Schistosoma mansoni
                    samples and the closely related
                    Schistosoma rodhaini
                    across eight countries, combining new parasite material with publicly available sequence data. We observed a broad-scale genetic structure between countries alongside evidence of extensive long-distance transmission. Functional profiling of the recently identified transient receptor potential melastatin ion channel,
                    Sm.
                    TRPM
                    PZQ
                    , revealed four naturally occurring variants associated with reduced praziquantel sensitivity, indicating standing variation for resistance. Analyses of parasite infrapopulations collected from people pre– and post–praziquantel treatment further identified instances of treatment failure, supporting the potential for praziquantel resistance. As schistosomiasis is targeted for elimination as a public health problem, with interruption of transmission in selected regions by 2030, our study provides a comprehensive genomic framework for endemic populations, highlights an approach to detect potential resistance, and endorses the development of precision surveillance and adaptive treatment strategies.",crossref,0
Mesenchymal stem cells receive adaptive islet–derived miR-151–containing sEVs to promote β cell compensation in obesity,https://www.science.org/doi/abs/10.1126/sciadv.adu4196?af=R,AAAS: Science Advances: Table of Contents,2026-07-17 07:00:00 UTC,2026-07-17 07:00:00+00:00,10.1126/sciadv.adu4196,Liang Jin,"Pancreatic islets respond to obesity-related insulin resistance by increasing β cell mass and insulin secretion. However, the molecular mechanisms behind this vital compensation are not fully understood. This study shows that adaptive islet–derived small extracellular vesicles (aid-sEVs) play a key role in β cell adaptation in obesity. Aid-sEV production rises under hyperlipidemic conditions, and uptake by adjacent cells occurs via F11R-mediated recognition. Mesenchymal stem cells (MSCs) act as downstream effectors after they internalize aid-sEVs, promoting β cell–adaptive responses. These vesicles deliver
                    miR-151
                    to MSCs, triggering
                    miR-151–
                    dependent cellular reprogramming toward a Wnt-secreting phenotype. Restoration of
                    miR-151
                    in microRNA-deficient aid-sEVs restores their proadaptive effects on β cells.
                    Klf9
                    , a direct target of
                    miR-151
                    , is involved in regulating MSC proliferation and WNT secretion by controlling
                    Wnt3a
                    and
                    Ccnd1
                    transcription. These findings reveal a critical pathway controlling β cell compensation in diet-induced obesity and indicate that targeted enhancement of aid-sEV secretion could be a therapeutic strategy to counteract β cell dysfunction in diabetic patients.",crossref,0
