title,link,source,published_str,pub_date,doi,last_author,abstract,abstract_source,must_have_abstract
Production of aromatics from high density polyethylene over a hierarchical zeolite synthesised from steam-assisted crystallisation,https://www.nature.com/articles/s41467-026-74562-3,Physical sciences : Nature Communications subject feeds,2026-06-27 00:00:00 UTC,2026-06-27 00:00:00+00:00,,Buxing Han,"The conversion of high-density polyethylene wastes to aromatic feedstocks in noble-metal-free systems poses a significant challenge. Here, we report a steam-assisted synthesised zeolite (SA-HZSM-5) that can promote the conversion of high-density polyethylene to aromatics, achieving simultaneously high conversion and selectivity (85.4% and 49.2%, respectively) at 260 °C, outperforming noble metal-based catalysts, such as Ru-HZSM-5, under the same conditions. The produced aromatics predominantly consist of valuable monocyclic aromatics (circa 85%). The steam-assisted synthetic method endows a specific distribution of Lewis and Brønsted acid sites in SA-HZSM-5. In situ neutron diffraction and infrared spectroscopy, coupled with modelling, reveal a dual-site adsorption mechanism of mono-olefins intermediates, facilitating their transformation into dienes with suitable spaced double bonds, a feature that is crucial for the sequential cyclisation and dehydroaromatisation into aromatic compounds. This study underscores the potential of hierarchical zeolite materials for efficient upcycling of plastic wastes into chemical feedstocks.",nature_html,0
Enhanced crystal-melt segregation within dynamic mush systems links silicic cumulates with caldera-forming eruptions,https://www.nature.com/articles/s41467-026-74812-4,Earth and environmental sciences : Nature Communications subject feeds,2026-06-27 00:00:00 UTC,2026-06-27 00:00:00+00:00,,Miguel Â. S. Basei,"Supported by the mush model, the origin of crystal-poor, high-silica rhyolitic magmas (≥ 75 SiO₂ wt.%) is commonly linked to melt extraction in shallow, crystalline mushes, yet their complementary cumulates remain elusive in the upper crust. Here we present the “dynamic mush model” for the Campo Alegre-Corupá system (Brazil), combining textural analysis and thermodynamic modeling to show that high-silica melts formed through upper-crustal fractionation, leaving a granitic residue and feeding a caldera-forming eruption. Syenites and melasyenites represent their silicic-mafic cumulates, the syenites being formed at relatively low crystallinities (~16-33 of bulk vol.%) after extraction of large amounts of interstitial melts (~47-80 of liquid vol.%). In contrast to static models (extraction window ~50-70 vol.%), our results indicate early melt segregation in a dynamic reservoir. Alkali-feldspar crystals were size-selectively and hydraulically sorted by upward melt flow; aggregates were then formed at low crystallinities, supposedly via synneusis, enabling rapid sinking, and were repacked by recharge. This process, enhanced by relatively high magma fluxes, efficiently separated crystals from melt, explaining the origin of large-volume eruptible magmas in the upper crust. Our findings redefine mush evolution while underscoring the role of flow-driven crystal sorting (elutriation) in caldera-forming systems.",nature_html,0
Development and validation of a multiancestry and multitrait polygenic risk score for lung cancer,https://www.nature.com/articles/s41467-026-74964-3,Biological sciences : Nature Communications subject feeds,2026-06-27 00:00:00 UTC,2026-06-27 00:00:00+00:00,,Sipeng Shen,"Polygenic risk scores (PRSs) quantify genetic susceptibilities, yet ancestry imbalance in genome-wide association studies (GWASs) limits the accuracy of monoracial PRSs in non-European populations. Here, we perform a multiancestry GWAS meta-analysis for lung cancer (76,953 cases and 1,886,372 controls), identifying 87 conditionally independent genome-wide significant loci, including two unreported cytobands. We use a PRS construction method, PRS-CSx, to develop a multiancestry PRS (PRSMA"" role=""presentation"">PRSMA{{{{\rm{PRS}}}}}_{{{{\rm{MA}}}}}) which outperforms 32 published PRSs. To enhance predictive power, we construct a multitrait PRS (PRSMT"" role=""presentation"">PRSMT{{{{\rm{PRS}}}}}_{{{{\rm{MT}}}}}) using CatBoost, integrating 32 cross-trait PRSs across three ancestries. Combining PRSMA"" role=""presentation"">PRSMA{{{{\rm{PRS}}}}}_{{{{\rm{MA}}}}} and PRSMT"" role=""presentation"">PRSMT{{{{\rm{PRS}}}}}_{{{{\rm{MT}}}}}, we generate PRSMAMT"" role=""presentation"">PRSMAMT{{{{\rm{PRS}}}}}_{{{{\rm{MAMT}}}}} and validate it in independent cohorts (OncoArray, TRICL and All of Us). PRSMAMT"" role=""presentation"">PRSMAMT{{{{\rm{PRS}}}}}_{{{{\rm{MAMT}}}}} demonstrates superior discriminability in European, Asian, and African populations, improves risk stratification, and identifies approximately 10% additional lung cancer cases in the UK Biobank. Individuals with elevated PLCOm2012 scores and high genetic risk exhibit a 12.64-fold higher cumulative risk than those with low scores and low genetic risk, supporting precision prevention strategies.",nature_html,0
Targeting macrophage ferritin heavy chain mitigates ferroptosis and lung injury in experimental acute respiratory distress syndrome,https://www.nature.com/articles/s41467-026-74828-w,Biological sciences : Nature Communications subject feeds,2026-06-27 00:00:00 UTC,2026-06-27 00:00:00+00:00,,Suzanne M. Cloonan,"Ferritin, composed of heavy chain (FTH1) and light chain (FTL) subunits, is a key intracellular iron storage protein, but the origin and biological role of extracellular ferritin (ex-ferritin) remain poorly understood. Elevated serum ex-ferritin is associated with worse outcomes in acute respiratory distress syndrome (ARDS). Here, we show that both FTH1 and FTL are significantly enriched in the serum, blood monocytes, and alveolar macrophages (AM) of individuals with ARDS, findings we replicate in a murine hyperoxia-induced acute lung injury model. Myeloid-specific FTH1 (Fth1ΔLysM) deletion attenuates lung injury, and is associated with reduced macrophage ferroptosis, altered airway inflammatory responses, lower extracellular iron and compensatory secretion of FTL-ex-ferritin. While pharmacologic ferroptosis inhibition prior to hyperoxia had no effect, transplantation of FTL-ex-ferritin-enriched bronchoalveolar lavage fluid conferred protection from lung injury. These findings identify macrophage ferritin metabolism and ex-ferritin secretion as critical regulators of lung injury, offering new insights into the pathobiology of ARDS.",nature_html,0
Splenic macrophage-B cell axis drives systemic autoimmune-like pathology in Cerebral Malaria,https://www.nature.com/articles/s41467-026-74882-4,Biological sciences : Nature Communications subject feeds,2026-06-27 00:00:00 UTC,2026-06-27 00:00:00+00:00,,Dan Lu,"Cerebral malaria (CM) is a severe complication of Plasmodium infection, classically attributed to parasite sequestration and neuroinflammation. Here, we uncover a spleen-centered humoral autoimmune circuit that drives CM pathology. Proteomic analyses identify CD36 as a dominant host-derived antigen enriched in infected red blood cells (iRBCs), triggering anti-CD36 autoantibody production in patients with falciparum malaria. Although contributing to iRBCs clearance, these autoantibodies also target other CD36-expressing cells, thereby driving thrombocytopenia, endothelial injury, and macrophage activation, ultimately amplifying systemic inflammation. Mechanistically, Plasmodium infection recruits Ly6c+Glut1hi macrophages to the spleen through the CCL2-CCR2 axis. These macrophages exhibit elevated proteasome activity and drive B cell activation and anti-CD36 antibody production. Targeting Ly6c+Glut1hi macrophages, we develop Glutoborin, a GLUT1-directed proteasome inhibitor that preferentially suppresses their function, reduces autoantibody production, and alleviates CM-associated pathology in vivo. Together, these findings establish a spleen-centered anti-CD36 autoimmune circuit as a key driver of CM and nominate Ly6c+Glut1hi macrophages as therapeutic targets.",nature_html,0
A primordial synaptotagmin-independent function of complexin in regulated exocytosis,https://www.nature.com/articles/s41467-026-74947-4,Biological sciences : Nature Communications subject feeds,2026-06-27 00:00:00 UTC,2026-06-27 00:00:00+00:00,,Jingshi Shen,"In Ca²⁺-triggered exocytosis such as synaptic neurotransmitter release, vesicle fusion is tightly regulated by synaptotagmin (Syt) and complexin (Cpx), which together clamp partially assembled SNARE complexes to prevent premature fusion. However, Cpx is evolutionarily more ancient than Syt, suggesting that it may also regulate exocytosis independently of Syt. To test this possibility, we sought to identify an extant exocytic pathway that requires Cpx but naturally lacks Syt. Here, we uncovered such a pathway – hormone-triggered exocytosis of glucose transporters in adipocytes. In this pathway, Cpx acts exclusively as a positive regulator, accelerating the evoked phase of exocytosis without affecting basal fusion. Mechanistically, this Syt-independent activity depends on the central helix of Cpx for SNARE binding and on its C-terminal membrane-binding peptide, which remodels the lipid bilayer to promote exocytosis. Our findings support a model in which Cpx originally evolved to accelerate exocytosis independently of Ca²⁺, enabling rapid mobilization of exocytic cargoes in response to environmental cues. With the later emergence of Syt, Cpx acquired an additional role – acting in concert with Syt to regulate Ca²⁺-triggered exocytosis.",nature_html,0
NAD+ modulates mitochondrial vulnerability in MERTK-associated models of retinitis pigmentosa,https://www.nature.com/articles/s41467-026-74400-6,Biological sciences : Nature Communications subject feeds,2026-06-27 00:00:00 UTC,2026-06-27 00:00:00+00:00,,Shaochong Zhang,"Retinitis pigmentosa (RP) is the most common inherited retinal degenerative disease leading to blindness. RP is characterized by progressive loss of photoreceptors and retinal pigment epithelium (RPE), leading to retinal degeneration. The mechanisms that initiate RP and drive retinal vulnerability are poorly understood, and new strategies for preventing and treating RP are urgently needed. Although mitochondrial dysfunction initiates many neurodegenerative diseases, the contribution of mitochondrial dysfunction to RP is unclear. Single-cell RNA sequencing, transmission electron microscopy, and enzyme-linked immunosorbent assays revealed that photoreceptor and RPE cells have abnormal mitochondria in rats with RP. Nicotinamide adenine dinucleotide (NAD+) metabolism decreased in rats with RP, increasing the vulnerability to disease-related insults. Similar experimental results were observed in a Mer tyrosine kinase receptor (MERTK)-associated RP primary human RPE cell model. Electroretinography, immunofluorescence, and fundus photography revealed that oral administration of the NAD+ precursor nicotinamide mononucleotide (NMN) protected rats with RP from retinal degeneration. Single-cell RNA sequencing, siRNA targeting, and Adeno-associated virus applications demonstrated that NMN elicits therapeutic effects via the glyceraldehyde-phosphate dehydrogenase-mitochondria pathway. These results indicate that mitochondrial abnormalities may be drivers of RP, and NMN elicits therapeutic effects on RP.",nature_html,0
Structural basis for multivitamin recognition and transport by human SMVT,https://www.nature.com/articles/s41467-026-74948-3,Biological sciences : Nature Communications subject feeds,2026-06-27 00:00:00 UTC,2026-06-27 00:00:00+00:00,,Zhe Zhang,"The human sodium-dependent multivitamin transporter (SMVT, SLC5A6) mediates cellular uptake of essential metabolic cofactors, including biotin, pantothenate, and lipoate. Its dysfunction is associated with neurological disorders, metabolic abnormalities, and cancer. However, the molecular mechanism underlying its multi-substrate transport has remained elusive. Here, we present cryo-electron microscopy structures of human SMVT in three conformational states: occluded, outward-open, and inward-open. These structural snapshots capture the complete transport cycle and reveal a conserved substrate-binding pocket near a kinked transmembrane helix (TM1). Within this pocket, substrate carboxyl groups are electrostatically anchored, while distinct chemical moieties interact with specific polar and hydrophobic residues. Functional assays identify key binding residues and elucidate the pathogenic effects of disease-associated mutations. Further structural analysis delineates the principles of substrate discrimination within the SLC5 transporter family. Together, our work provides a structural framework for SMVT’s polyspecificity and lays a foundation for understanding related diseases and developing targeted therapeutic strategies.",nature_html,0
Volcanic eruptions caused weakening AMOC during the preindustrial past millennium,https://www.nature.com/articles/s41467-026-74873-5,Earth and environmental sciences : Nature Communications subject feeds,2026-06-27 00:00:00 UTC,2026-06-27 00:00:00+00:00,,Qin Wen,"The Atlantic Meridional Overturning Circulation (AMOC) is a key component of our climate system. However, the evolution history and the forcing mechanism of AMOC in the last millennial has remained uncertain. Here, combining available paleo AMOC-sensitive indicators with multiple climate models and paleo Data Assimilation, we show, for the first time, that the AMOC transport exhibits a slow declining trend into the Little Ice Age, with a reduction of about &#x2212;0.7&#x00B1;0.4Sv."" role=""presentation"">−0.7±0.4Sv.-0.7\,\pm 0.4{Sv}. (~4%) from AD 850-1850. This weakening is mainly caused by explosive volcanic eruptions. After a rapid strengthening in the initial decade following a volcanic eruption, the AMOC tends to show a slow weakening of centennial timescale, driven by stored cooling in the deep Atlantic and its feedback on North Atlantic climate.",nature_html,0
Active-learning-guided optimization of cell-free systems for genome-wide transcriptomic profiling reveals progressive layers of regulation,https://www.nature.com/articles/s41467-026-74559-y,Biological sciences : Nature Communications subject feeds,2026-06-27 00:00:00 UTC,2026-06-27 00:00:00+00:00,,Olivier Borkowski,"Understanding genome regulation is limited by the complexity of molecular interactions in living cells. Cell-free systems provide a simplified platform for studying gene expression, but low mRNA levels have prevented RNA-seq. To address this, we develop an active learning workflow combining Bayesian optimization with automated high-throughput experimentation to systematically explore over 1.6 million buffer compositions, experimentally testing 653. We identify a “mRNA-optimized” buffer (20-fold increase in mRNA yield) and a “trade-off” buffer (13-fold increase while maintaining protein production). Using direct RNA-seq, we profile the T7 phage transcriptome in cell-free systems and compare it with a purified T7-RNAP transcription system and phage-infected bacteria. This comparative analysis reveals distinct regulatory layers: the T7-RNAP system captures promoter-strength hierarchies but lacks RNA degradation, whereas cell-free systems provide an accurate estimation of in vivo expression and reveal mRNA maturation sites. This work establishes cell-free transcriptomics as a controlled approach to study genome regulation.",nature_html,0
The quantitative contribution of different Photosystem II compartments to non-photochemical quenching in Arabidopsis,https://www.nature.com/articles/s41467-026-74992-z,Biological sciences : Nature Communications subject feeds,2026-06-27 00:00:00 UTC,2026-06-27 00:00:00+00:00,,Roberta Croce,"Excess excitation energy in the light-harvesting antenna of Photosystem II (PSII) can cause irreversible damage to the photosynthetic apparatus. In periods of high light intensity, a feedback mechanism known as non-photochemical quenching (NPQ) induces the formation of quenchers, which can safely dissipate excess excitation energy as heat. Although quenchers have been identified in more than one compartment of the PSII supercomplex, there is currently no quantitative description of the extent to which NPQ occurs at each of these locations. Here, we perform time-resolved fluorescence measurements on Arabidopsis thaliana WT and antenna mutants lacking LHCII trimers (koLHCII) and all peripheral antenna (Ch1lhcb5). By combining the results with those from steady-state fluorescence experiments, we are able to estimate the intrinsic rate of NPQ for each plant and each PSII compartment. It is concluded that more than 70% of quenching occurs in LHCII, less than 10% in the minor antenna, and the rest is associated with the PSII core.",nature_html,0
Covalent pan-TEAD inhibitors block YAP activity and demonstrate brain penetrance in a Hippo-dependent cancer model,https://www.nature.com/articles/s41467-026-74722-5,Biological sciences : Nature Communications subject feeds,2026-06-27 00:00:00 UTC,2026-06-27 00:00:00+00:00,,Anwesha Dey,"TEAD transcription factors enable the oncogenic activity of deregulated Hippo signaling and are a promising therapeutic target in oncology. Targeting the TEAD lipid pocket is an established path to inhibit the oncogenic activities of cofactors YAP and TAZ. Here we present two pan-TEAD inhibitors, GNE-8025 and its in vivo brain-penetrant derivative GNE-2181, that covalently bind the lipid pocket at a conserved cysteine. Both small molecules show growth inhibition of YAP-driven tumor cells in vitro and in vivo. Moreover, we show that GNE-8025 increases the activity of a broad range of MAPK pathway inhibitors in vitro as well as the KRASG12C inhibitor Divarasib both in vitro and in vivo. In addition, GNE-2181 inhibits growth of an intracranial tumor model in vivo. Altogether we present a next-generation class of TEAD inhibitors representing a significant advancement towards potent, specific, and effective Hippo-targeting cancer therapies.",nature_html,0
Haplotype-resolved genome assembly sheds light on the evolutionary history of autohexaploid Tripidium arundinaceum,https://www.nature.com/articles/s41467-026-74742-1,Biological sciences : Nature Communications subject feeds,2026-06-27 00:00:00 UTC,2026-06-27 00:00:00+00:00,,Jisen Zhang,"Tripidium arundinaceum, a wild perennial grass with exceptional stress tolerance, has been tested in sugarcane breeding. Its complex polyploid genome has hindered understanding of its evolution and adaptive traits. Here, we present a high-quality, haplotype-resolved reference genome for autohexaploid T. arundinaceum Hainan92-105 (2n = 6x = 60). T. arundinaceum is likely originated from a diploid ancestor approximately 1.31 million years ago and contains abundant repetitive sequences from two major recent bursts of long terminal repeat retrotransposons following polyploidization. Phylogenetic analyses place Saccharum closer to Sorghum bicolor than to T. arundinaceum, indicating that the polyploidizations in these two lineages occurred independently. Population genomics analysis reveals southwestern China (Yunnan) as a diversity center for T. arundinaceum within China. Genotype–environment associations highlight temperature and precipitation as key local adaptation drivers mediated by stress-associated genes. This study provides a genomic resource for understanding polyploid evolution and climate adaptation in T. arundinaceum.",nature_html,0
Ecological multifunctionality of watersheds increases with tree species richness,https://www.nature.com/articles/s41467-026-74914-z,Biological sciences : Nature Communications subject feeds,2026-06-27 00:00:00 UTC,2026-06-27 00:00:00+00:00,,Kerong Zhang,"Watersheds are natural units and meta-ecosystems of the earth’s land surface providing multiple ecological functions. However, little is known about the biodiversity-ecological multifunctionality relationships of watersheds, particularly regarding how these relationships scale to large and complex landscapes. Here, we explore the impact of forest tree species richness on the ecological multifunctionality of watersheds in terms of carbon sequestration, carbon storage, water supply, water regulation, and soil conservation, by utilizing integrated ground-sourced forest inventory datasets comprising 846 forest watersheds from the Global Forest Biodiversity Initiative, the Global Streamflow Indices and Metadata Archive, and remote sensing data products. We find a consistently positive relationship between forest tree species richness and watershed ecological multifunctionality by accounting for factors such as forest structural characteristics and environmental conditions. Furthermore, we find that this biodiversity-multifunctionality link is dependent on spatial scale and climatic context, becoming stronger in larger watersheds but diminishing in arid climatic conditions. These insights enhance our understanding of ecosystem multifunctionality and underscore the importance of considering watershed-scale ecological processes and biodiversity in ecosystem management and conservation strategies.",nature_html,0
Intranasal boosting induces variant-specific responses in SARS-CoV-2 vaccine-imprinted mice,https://www.nature.com/articles/s41467-026-74762-x,Biological sciences : Nature Communications subject feeds,2026-06-27 00:00:00 UTC,2026-06-27 00:00:00+00:00,,Michael S. Diamond,"The continued evolution of SARS-CoV-2 variants that evade immunity highlights a need to develop vaccines that elicit variant-specific antibodies and neutralize emerging strains. However, immune imprinting from antecedent SARS-CoV-2 exposure can limit the generation of such antibodies. Here, we evaluate strategies to enhance variant-specific antibody responses in female mice primed with Wuhan-1 spike-based mRNA or chimpanzee adenoviral-vectored (ChAd) vaccines and boosted with Omicron variant-matched vaccines. Altering the intramuscular injection site did not substantially affect variant-specific serum antibody responses. However, increasing booster antigen doses, performing repeated boosters, and administering booster vaccines intranasally enhanced variant-specific responses against the vaccine-matched Omicron strain. Boosting intranasally with a ChAd vaccine encoding the spike protein of Omicron XBB.1.5 elicited stronger XBB.1.5-specific responses in serum, bronchoalveolar lavage fluid, and draining lymph nodes than intramuscular boosting with the same vaccine. Regardless of booster regimen, neutralizing activity against XBB.1.5 was predominantly mediated by antibodies that were non-reactive to Wuhan-1 spike. These findings establish that in mice, intranasal or repeated variant-matched boosting can overcome the effects of imprinting and enhance immunity against SARS-CoV-2 strains.",nature_html,0
Abrupt permafrost thaw drives exceptional carbon release across the Tibetan Plateau,https://www.nature.com/articles/s41467-026-74850-y,Earth and environmental sciences : Nature Communications subject feeds,2026-06-27 00:00:00 UTC,2026-06-27 00:00:00+00:00,,Cuicui Mu,"Climate warming is accelerating abrupt permafrost thaw, driving substantial carbon emissions. Retrogressive thaw slumps (RTSs) represent the most severe instance of abrupt permafrost thaw, yet their carbon emissions remain poorly quantified due to limited observations. Here, by synthesizing 4728 RTS incidents and 1862 in-situ CO2 and CH4 measurements from RTS-affected zones across the Tibetan Plateau, we estimate that the area of RTS susceptibility will expand by 17–19% by 2100 relative to 2022, driven primarily by precipitation changes. Compared to control areas, the ecosystem respiration rate in collapsed areas decreases by 14.4%, while CH4 release rate increases by 20.0%. The combined CO2 and CH4 release associated with RTS expansion increased 1.1-fold between 2016 and 2022. Under the intermediate Shared Socioeconomic Pathways scenario, carbon emissions from RTS-susceptible areas are projected to surge 2.7-fold by 2100. These findings highlight that abrupt thaw strengthens permafrost carbon-climate feedback in high-altitude regions, underscoring the urgent need for targeted permafrost protection strategies to achieve carbon neutrality goals.",nature_html,0
