title,link,source,published_str,pub_date,doi,last_author,abstract,abstract_source,must_have_abstract
CenSegNet: a generalist high-throughput deep learning framework for centrosome phenotyping at spatial and single-cell resolution in heterogeneous tissues,https://www.nature.com/articles/s41467-026-75393-y,Biological sciences : Nature Communications subject feeds,2026-07-15 00:00:00 UTC,2026-07-15 00:00:00+00:00,,Salah Elias,"Centrosome abnormalities (CA) are a hallmark of epithelial cancers, yet their spatial complexity and phenotypic heterogeneity remain poorly understood due to limitations in conventional image analysis. Here we present CenSegNet (Centrosome Segmentation Network), a modular deep learning framework for high-throughput segmentation of centrosomes and epithelial architecture, enabling accurate and generalisable centrosome phenotyping at spatial and single-cell resolution across imaging modalities and tissue contexts. Applied to tissue microarrays comprising 911 breast cancer cores from 127 patients, CenSegNet enables large-scale, spatially resolved quantification of numerical and structural CA. We show that these CA subtypes are mechanistically uncoupled, exhibiting distinct spatial distributions, age-dependent dynamics, and associations with tumour grade, hormone receptor status, genomic alterations and nodal involvement. Structural CA are associated with overall survival, whereas discordant CA profiles at tumour margins correlate with local tumour aggressiveness and stromal remodelling. These findings establish CenSegNet as a scalable platform for spatially resolved centrosome phenotyping, enabling systematic investigation of centrosome biology and its dysregulation in cancer and other epithelial diseases.",nature_html,0
Butyrate epigenetically licenses sustained epithelial-T cell crosstalk for intestinal immune tolerance,https://www.nature.com/articles/s41467-026-75600-w,Biological sciences : Nature Communications subject feeds,2026-07-15 00:00:00 UTC,2026-07-15 00:00:00+00:00,,Yingzi Cong,"Intestinal epithelial cells (IEC) are the primary cell type in direct contact with stimuli from the luminal microbiota, playing a critical role in host-microbe interactions. However, how IECs communicate with underlying immune cells to maintain homeostasis remains poorly understood. In addition, the mechanisms by which IECs sense microbiota-derived stimuli to initiate this crosstalk are not yet fully understood. Here, we demonstrate that oral administration of the gut microbiota metabolite butyrate induces sustained IL-10 production in CD4⁺ T cells, conferring long-lasting protection against intestinal inflammation even after treatment withdrawal. This persistent immunoregulatory effect is also observed in germ-free mice, indicating the establishment of a butyrate-conditioned intestinal environment. By metabolomic profiling, we identify N1-acetylspermidine as a metabolite contributing to the IL-10-inducing activity of butyrate-treated IEC-conditioned medium. Mechanistically, butyrate induces sustained transcriptional and epigenetic activation of the acetylpolyamine biosynthetic enzyme Sat1 in IECs, which catalyzes the acetylation of spermidine to generate N1-acetylspermidine, and this activation persists after butyrate withdrawal. Together, our findings reveal a mechanism by which butyrate sensing establishes persistent crosstalk between IECs and T cells, thereby maintaining intestinal immune tolerance through epigenetic regulation and reprogramming of epithelial metabolism.",nature_html,0
The oligosaccharyltransferase TaOST1B promotes viral infection by enhancement of RNA silencing suppression in wheat,https://www.nature.com/articles/s41467-026-75397-8,Biological sciences : Nature Communications subject feeds,2026-07-15 00:00:00 UTC,2026-07-15 00:00:00+00:00,,Jian Yang,"Viral suppressors of RNA silencing (VSRs) are crucial for viral infection. Here, we show that a wheat (Triticum aestivum) oligosaccharyltransferase (TaOST1B) is associated with resistance to Wheat yellow mosaic virus (WYMV). TaOST1B interacts with WYMV-encoded P1 and enhances the VSR function of P1 by N-glycosylating its asparagine residue at position 116. This increases intranuclear accumulation of P1 through interaction with the nuclear transport protein TaIMP-α2 and blocks the interaction between calmodulin (CaM3) and CaM-binding transcriptional activator (CaMTA3) to suppress RNA interference. Nevertheless, nonglycosylated P1 loses its VSR function and forms aggregates triggering endoplasmic reticulum (ER) stress and is subsequently degraded by the 26S proteasome. A natural variant of TaOST1B fails to bind P1 and regulate its N-glycosylation, which induces ER stress and proteasome-mediated degradation to attenuate WYMV infection. Our study identifies an oligosaccharyltransferases as being utilized by VSR to promote viral infection, offering insights into the arms race between plants and viruses.",nature_html,0
Induced ubiquitination of the partially disordered estrogen receptor alpha via a 14-3-3 directed molecular glue-PROTAC,https://www.nature.com/articles/s41467-026-75333-w,Biological sciences : Nature Communications subject feeds,2026-07-15 00:00:00 UTC,2026-07-15 00:00:00+00:00,,Peter J. Cossar,"Proteins lacking defined ligandable pockets remain challenging drug targets. Here, we develop a molecular glue-based PROTAC (MGPROTAC) approach that chemically conjugates a molecular glue stabilizer to a VHL-recruiting ligand to capture and ubiquitinate the 14-3-3/Estrogen receptor α (ERα) complex. Our designed MGPROTACs engage a composite interface between 14-3-3 and the disordered F-domain of ERα, promoting cooperative complex formation and targeted ubiquitination. Biophysical characterization revealed distinct linker-dependent cooperativities across the MGPROTAC series, which influenced both cellular permeability and ubiquitination efficiency. Cryo-EM of the most cooperative MGPROTAC uncovered de novo VHL–14-3-3ζ contacts, while molecular dynamics simulations rationalize the stabilizing interactions underlying cooperativity. Strikingly, fine-tuning linker design enables selective ubiquitination of distinct complex subunits. These findings establish a structural and mechanistic framework for integrating molecular glue and PROTAC principles, expanding the scope of drug discovery to previously intractable protein complexes.",nature_html,0
Integrated two-photon and photoacoustic microscopy for single-cell neurometabolic imaging,https://www.nature.com/articles/s41467-026-75603-7,Biological sciences : Nature Communications subject feeds,2026-07-15 00:00:00 UTC,2026-07-15 00:00:00+00:00,,Song Hu,"Understanding how neuronal activity couples with local energy metabolism is fundamental to brain function. Oxygen exchange between individual neurons and red blood cells (RBCs) is central to this process, yet no existing method can simultaneously capture their dynamics at single-cell resolution in vivo. Here, we introduce integrated two-photon and photoacoustic microscopy (TPM-PAM), which enables real-time imaging of single-neuron calcium activity alongside oxygen release from individual RBCs in awake mice. In TPM-PAM, a transparent micro-ring resonator-based ultrasound sensor breaks the long-standing tradeoff between optical access and acoustic sensitivity, while dual-wavelength kymography simultaneously quantifies single-RBC oxygenation and flow to derive the oxygen release rate. Incorporating nonlinear optical manipulation of the neurovascular unit with cellular precision, TPM-PAM reveals distinct neurometabolic responses to whisker stimulation, single-capillary occlusion, and single-neuron stimulation. This work establishes a powerful platform for dissecting neurometabolic coupling at the cellular scale and understanding oxygen-metabolic regulation in brain health and disease.",nature_html,0
Direct coupling of nod factor signaling to vesicular trafficking initiates legume nodulation,https://www.nature.com/articles/s41467-026-75535-2,Biological sciences : Nature Communications subject feeds,2026-07-15 00:00:00 UTC,2026-07-15 00:00:00+00:00,,Gary Stacey,"Legume–rhizobium symbiosis requires coordinated receptor signaling and membrane trafficking to initiate infection thread formation in root hairs. Here, we identify the soybean Qa-SNARE GmSYNTAXIN111a (GmSYP111a), a close paralog of the cytokinesis-associated protein KNOLLE, as a critical regulator of symbiotic infection. Kinase-client assays and in vivo immunoprecipitation–mass spectrometry showed that GmSYP111a is phosphorylated by the receptor kinase GmSymRKβ at Ser-8 and Ser-128. BiFC, co-immunoprecipitation, and kinase assays validated the interaction and phosphorylation. Nod factor perception promoted clathrin-mediated endocytosis of the GmSymRKβ–GmSYP111a complex and its relocalization to intracellular vesicles. Structural modeling and interaction assays suggest that dual phosphorylation exposes an endocytic motif that recruits the TPLATE adaptor; accordingly, non-phosphorylatable mutations impaired internalization, whereas phosphomimetic substitutions induced endocytosis without rhizobial stimulation. GmSYP111a also interacted with VAMP72, linking endocytic recruitment to vesicle fusion. Genetic analyses in soybean and Lotus japonicus established a conserved requirement for GmSYP111a in nodule initiation. These findings define a phosphorylation-dependent SNARE switch that couples Nod factor signaling to membrane trafficking during legume nodulation.",nature_html,0
Cryo-EM structures of human FANCJ reveal the mechanism of G-quadruplex unwinding and disease-associated mutations,https://www.nature.com/articles/s41467-026-75715-0,Biological sciences : Nature Communications subject feeds,2026-07-15 00:00:00 UTC,2026-07-15 00:00:00+00:00,,Huilin Li,"Guanine-rich nucleic acid sequences can fold into G-quadruplex (G4) structures that regulate DNA replication, transcription, and translation. Fanconi anemia group J helicase (FANCJ) resolves G4 structures at stalled replication forks. Despite its central role in genome maintenance, the molecular basis of G4 recognition and unwinding by FANCJ has remained unclear. Here, we report cryo-EM structures of human FANCJ bound to a G4-containing DNA substrate and ATPγS. The structures reveal direct engagement of the G4 by the Fe–S domain. Structure-guided mutagenesis demonstrates that this interface is essential for G4 binding and unwinding. The structures further capture open and closed conformational states linked to ATP hydrolysis, providing a mechanism for directional translocation along 5′ ssDNA and progressive G4 unwinding. Together, these findings establish the structural basis of G4 recognition by FANCJ and provide mechanistic insights into how disease-associated mutations linked to Fanconi anemia and breast cancer impair helicase function.",nature_html,0
E-fuels can cut battery material demand by up to 9-fold but create new dilemmas for UK net-zero transport,https://www.cell.com/one-earth/fulltext/S2590-3322(26)00174-0?rss=yes,One Earth,2026-07-15 00:00:00 UTC,2026-07-15 00:00:00+00:00,10.1016/j.oneear.2026.101773,Jon McKechnie,,,0
Augmented reality coming into focus,https://www.nature.com/articles/s41565-026-02214-0,Nature Nanotechnology,2026-07-15 00:00:00 UTC,2026-07-15 00:00:00+00:00,10.1038/s41565-026-02214-0,Edwin Cartlidge,Researchers believe that it will soon be possible to mass-produce waveguides for wearer-friendly AR glasses.,nature_html,0
Relapse,https://www.nature.com/articles/d41586-026-02133-z,Nature,2026-07-15 00:00:00 UTC,2026-07-15 00:00:00+00:00,10.1038/d41586-026-02133-z,Chris Baker,Restore previous version? Restore previous version?,nature_html,0
Fractional high-Chern insulator in twisted rhombohedral graphene,https://www.nature.com/articles/s41586-026-10762-7,Nature,2026-07-15 00:00:00 UTC,2026-07-15 00:00:00+00:00,10.1038/s41586-026-10762-7,Xiaobo Lu,"The realization of fractional Chern insulators opens the possibility of exploring fractionally charged excitations1,2,3,4,5,6,7 and anyonic statistics8,9,10,11 in the absence of a magnetic field. A central question is whether lattice-based systems can give rise to radically new states, distinct from those observed in traditional fractional quantum Hall systems12,13,14,15,16,17,18,19,20. Here we investigate a type of moiré flat-band system composed of Bernal bilayer graphene and rhombohedral tetralayer graphene. We discover an unprecedented richness of quantum anomalous Hall insulators with Chern numbers from |C| = 1 to |C| = 7 at a moiré filling factor v = 1 and around v = 3. Remarkably, we observe an exotic fractional Chern insulator with C = 7/3 around v = 2/3, which is beyond all known fractional Chern insulators described by either the Jain sequence or current high-Chern theory21,22, 1 fractional Chern insulators. Phys. Rev. B 87, 205137 (2013)."" href=""#ref-CR23"" id=""ref-link-section-d86594981e577_2"">23,24,25,26,27. Our work expands the understanding of fractionally charged excitations beyond the Landau-level basis and offers a moiré platform for exploring anyons.",nature_html,0
Magnetic character of the low-energy enhancement in 70Zn,https://www.nature.com/articles/s41586-026-10758-3,Nature,2026-07-15 00:00:00 UTC,2026-07-15 00:00:00+00:00,10.1038/s41586-026-10758-3,M. Wiedeking,"The transition of an atomic nucleus from an excited state to a state of lower energy is typically accompanied by the emission of photons. The likelihood of photon emission is a function of the photon energy and of properties of the initial and final nuclear states and is known as the photon (or γ-ray) strength function (γSF)1,2. Of the features present in the γSF, an enhancement in the low-energy region has been observed in some nuclei, but the electromagnetic nature of this enhancement remains an open question3,4. This low-energy enhancement in the γSF significantly impacts our understanding of how elements are created in stars and the structure of the nucleus5,6. Here we present the results from an experiment on the γSF of 70Zn that show that the enhancement in the γSF of this nucleus is of magnetic nature. This observation helps address a long-open question about γSFs in atomic nuclei and directly impacts our predictive capabilities in nuclear science.",nature_html,0
GPC3-specific dnTGFβRII-armoured CAR T cells for hepatocellular carcinoma,https://www.nature.com/articles/s41586-026-10786-z,Nature,2026-07-15 00:00:00 UTC,2026-07-15 00:00:00+00:00,10.1038/s41586-026-10786-z,Tingbo Liang,"Glypican-3 (GPC3) is highly expressed in hepatocellular carcinoma (HCC), making it an attractive target for chimeric antigen receptor (CAR) T cell therapy; however, this approach has previously shown limited clinical efficacy, potentially owing to high levels of transforming growth factor-β (TGFβ) in the tumour microenvironment1,2,3,4. We therefore engineered CAR T cells with a dominant-negative TGFβ receptor II, which showed enhanced antitumour activity in preclinical studies5. Here we report findings from a first-in-human trial evaluating the safety and efficacy of C-CAR031 in patients with advanced, treatment-refractory HCC (NCT05155189). Thirty-six patients received CAR T infusions at four dose levels (from 0.75 × 106 to 4.0 × 106 cells per kg). Cytokine release syndrome was reported in 34 patients, of which two cases were grade 3. Nine patients had non-haematological adverse events of grade 3 or higher. Tumour regression was observed in 32 patients, with a median best tumour reduction from baseline of 41.6% (range: 3.4–94.4%) in target lesions. The objective response rate was 44.4%, and the median duration of response was 4.4 months (95% confidence interval: 2.9–7.4). Median progression-free survival and overall survival were 4.2 months (95% confidence interval: 2.9–4.8) and 14.2 months (95% confidence interval: 10.1 to not evaluable), respectively. High-throughput analyses of tumour samples and functional validation suggested that GPC3 antigen loss and increased TGFβ levels may contribute to C-CAR031 resistance. Collectively, these results indicate that C-CAR031 has a manageable safety profile and encouraging antitumour activity in heavily pretreated patients with advanced HCC.",nature_html,0
"Catalyst-free, microdroplet-mediated waste plastic conversion to diacids",https://www.nature.com/articles/s41586-026-10746-7,Nature,2026-07-15 00:00:00 UTC,2026-07-15 00:00:00+00:00,10.1038/s41586-026-10746-7,Yong Wang,"Plastic waste accumulation poses a global threat to both the environment and public health1,2,3. Although catalytic upcycling to value-added chemicals holds promise, its industrial adoption is hindered by additive-induced catalyst deactivation, feedstock heterogeneity, process inflexibility and limited economic viability4. Here we report a catalyst-free upcycling strategy that makes use of in situ generation of hydroxyl radicals at microdroplet interfaces5,6,7,8 to enable oxidative cleavage of diverse waste plastics—from polyolefins to rubbers—into carboxylic acids under mild conditions. By eliminating catalyst-dependent pathways, this approach circumvents key challenges of catalyst design and poisoning, while substantially lowering technical barriers and costs9,10. Our method achieves complete conversion of polyethylene (PE) with selectivity to short-chain diacids approaching 69% under relatively mild conditions and demonstrated broad applicability to mixed commercial plastics, with scalability demonstrated up to the 300-g scale. Radical intermediate analysis reveals the crucial role of H2O in mediating a unique oxidative degradation mechanism: sequential hydroxyl radical addition to alkyl radicals, distinct from classical liquid-phase aerobic oxidation of alkane11. This interfacial radical-mediated strategy enables sustainable polymer upcycling with minimal infrastructure. More broadly, this work provides a scalable blueprint for the first, to our knowledge, industrial implementation of microdroplet chemistry, with transformative implications for oxidation processes in organic acid synthesis and beyond.",nature_html,0
Graphene oxide-polydopamine membranes with controlled interlayer spacing,https://www.nature.com/articles/s41586-026-10765-4,Nature,2026-07-15 00:00:00 UTC,2026-07-15 00:00:00+00:00,10.1038/s41586-026-10765-4,Jianjun Wang,"Stacked graphene oxide membranes (GOMs) show exceptional capabilities for high-throughput sieving of water, ions and molecules, offering transformative potential in environmental and energy sectors1,2,3,4,5. However, achieving GOMs with subnanometre interlayer spacing and subangstrom tunability while maintaining their structural robustness for rapid and selective ion transport remains a big challenge6,7,8. Here we present polydopamine-pillared composite GOMs with tunable and stable interlayer spacing, featuring controllable interlayer spacing down to 5.9 Å in the dry state, and capable of sieving hydrated rubidium (Rb+) and potassium (K+) ions differing in size by less than 0.1 Å in aqueous environments, achieving an Rb+/K+ separation factor of 5,320. These composite GOMs were fabricated by using the dopamine assembly and reaction timescale separation method. Specifically, the GOM fabrication capitalizes on the fact that nanoconfined water has a lower freezing temperature than that of bulk water, such that the interlayer spacing is regulated by the rapid assembly of dopamines into nanopillars, driven by nanoconfined liquid water while the surrounding is in bulk ice. The assembly process can be halted anytime by further lowering the temperature to tune and fix the interlayer spacing. Thereafter, the GOM is rigidified through the slower chemical reactions, including polymerization of dopamine molecules and covalent bonding at specific oxygen-containing sites on the graphene oxide surface while retaining ample graphene subnanochannels for high-flux transportation. The GOMs deliver continuous freshwater production for 30 days at a water permeance of 67.9 l m−2 h−1 bar−1, 1–2 orders of magnitude higher than conventional membranes9.",nature_html,0
How to end poverty and protect Earth: inside the debate tearing up economics,https://www.nature.com/articles/d41586-026-02216-x,Nature,2026-07-15 00:00:00 UTC,2026-07-15 00:00:00+00:00,10.1038/d41586-026-02216-x,Mariana Lenharo,The idea of prosperity without growth is gaining traction among researchers. So why are many economists sceptical? The idea of prosperity without growth is gaining traction among researchers. So why are many economists sceptical?,nature_html,0
Improvements in educational opportunities go hand in hand with innovation,https://www.nature.com/articles/d41586-026-02016-3,Nature,2026-07-15 00:00:00 UTC,2026-07-15 00:00:00+00:00,10.1038/d41586-026-02016-3,,"The first longitudinal regional atlas of intergenerational educational mobility shows that the subnational regions of Europe in which individuals’ educational opportunities are least dependent on the educational background of their parents tend to have the most innovation, as shown by the number of patents. European regions in which people’s education level is less dependent on their parents’ education generate more patents.",nature_html,0
Beyond lithium: how sodium-ion batteries could change the world,https://www.nature.com/articles/d41586-026-02150-y,Nature,2026-07-15 00:00:00 UTC,2026-07-15 00:00:00+00:00,10.1038/d41586-026-02150-y,Davide Castelvecchi,"Batteries based on sodium ions are entering mass production. Some researchers say they could ultimately be a cheaper, safer alternative to lithium in electric cars and other energy applications. Batteries based on sodium ions are entering mass production. Some researchers say they could ultimately be a cheaper, safer alternative to lithium in electric cars and other energy applications.",nature_html,0
Nucleotides act as ‘molecular glue’ and can sense their own abundance,https://www.nature.com/articles/d41586-026-01945-3,Nature,2026-07-15 00:00:00 UTC,2026-07-15 00:00:00+00:00,10.1038/d41586-026-01945-3,Ivan Đikić,Some nucleotides have been shown to control metabolism by ‘gluing’ proteins together. Could other small molecules made naturally by cells have similar capabilities? Some nucleotides have been shown to control metabolism by ‘gluing’ proteins together. Could other small molecules made naturally by cells have similar capabilities?,nature_html,0
AI avatars are reshaping society in China — the law is trying to catch up,https://www.nature.com/articles/d41586-026-01674-7,Nature,2026-07-15 00:00:00 UTC,2026-07-15 00:00:00+00:00,10.1038/d41586-026-01674-7,Rachel Fieldhouse,Digital people are fulfilling roles from running hospitals to giving lectures to offering companionship. Digital people are fulfilling roles from running hospitals to giving lectures to offering companionship.,nature_html,0
Optical filter sorts light by its ‘quantum statistics’,https://www.nature.com/articles/d41586-026-02038-x,Nature,2026-07-15 00:00:00 UTC,2026-07-15 00:00:00+00:00,10.1038/d41586-026-02038-x,Sebastian Golat,A nanostructured gold surface can filter light depending on the tendency of its photons to arrive at a detector in pairs. A nanostructured gold surface can filter light depending on the tendency of its photons to arrive at a detector in pairs.,nature_html,0
How naked mole-rat queens stop rivals reproducing,https://www.nature.com/articles/d41586-026-02168-2,Nature,2026-07-15 00:00:00 UTC,2026-07-15 00:00:00+00:00,10.1038/d41586-026-02168-2,Jacob Smith,"The scent of a single chemical, made only by the queen, alters hormone production in other females. The scent of a single chemical, made only by the queen, alters hormone production in other females.",nature_html,0
Doctored data sets could trick AI agents,https://www.nature.com/articles/d41586-026-02071-w,Nature,2026-07-15 00:00:00 UTC,2026-07-15 00:00:00+00:00,10.1038/d41586-026-02071-w,Dalmeet Singh Chawla,Researchers warn that ‘poisoned’ information can undermine the reliability of tools that analyse data autonomously. Researchers warn that ‘poisoned’ information can undermine the reliability of tools that analyse data autonomously.,nature_html,0
Why there needs to be a global debate on inequality,https://www.nature.com/articles/d41586-026-02147-7,Nature,2026-07-15 00:00:00 UTC,2026-07-15 00:00:00+00:00,10.1038/d41586-026-02147-7,,"Researchers have a responsibility to search for consensus on this crucial issue, both for future generations and the future of our planet. Researchers have a responsibility to search for consensus on this crucial issue, both for future generations and the future of our planet.",nature_html,0
"A high-fat, low-carbohydrate diet can feed intestinal tumours",https://www.nature.com/articles/d41586-026-02039-w,Nature,2026-07-15 00:00:00 UTC,2026-07-15 00:00:00+00:00,10.1038/d41586-026-02039-w,Evan C. Lien,"A ketogenic diet promotes tumour growth in the small intestine in susceptible mice. In people, diet advice might need to be tailored to individual cancer risks. A ketogenic diet promotes tumour growth in the small intestine in susceptible mice. In people, diet advice might need to be tailored to individual cancer risks.",nature_html,0
