title,link,source,published_str,pub_date,doi,last_author,abstract,abstract_source,must_have_abstract
Challenges and trends in automotive battery recycling,https://www.nature.com/articles/s41560-026-02092-9,Nature Energy,2026-07-17 00:00:00 UTC,2026-07-17 00:00:00+00:00,10.1038/s41560-026-02092-9,Fabian Duffner,"The electrification of the automotive industry is driving a rapid global expansion of battery production, which generates substantial volumes of waste from both manufacturing scrap and end-of-life batteries. Consequently, recycling capacities must scale significantly from 2026 onwards, while recyclers face major challenges: meeting regulatory requirements, establishing efficient reverse logistics and coping with the growing complexity of return streams, system designs, cell formats, and evolving chemistries. Here we provide a comprehensive overview of current recycling technologies and assess their compatibility with both state-of-the-art and next-generation batteries, highlighting the technical and economic challenges of managing diverse battery waste. We show that although established processes are largely suitable for today’s lithium-ion chemistries, future systems such as sodium-ion and solid-state batteries will require process adaptation. Beyond technical aspects, we identify seven key trends to enhance recycling economics, optimize material flows and support the development of a fully circular battery industry in the future.",nature_html,0
Measuring cardiac stroke volume through in-ear audio sensing,https://www.nature.com/articles/s41467-026-75642-0,Physical sciences : Nature Communications subject feeds,2026-07-17 00:00:00 UTC,2026-07-17 00:00:00+00:00,,Cecilia Mascolo,"Stroke volume, the volume of blood ejected by the left ventricle during a contraction, is a key metric of cardiovascular health. Currently, stroke volume is measured in clinic with specialised equipment. While purpose-made wearables exist to measure stroke volume, no solution relies solely on commodity devices. We present a deep learning system for stroke volume estimation from in-ear audio of earbuds. We combine generative self-supervised/transfer learning, a transformer-based autoencoder, to predict average stroke volume in unseen subjects. With data from 23 healthy participants, we compare our estimations to clinically validated device estimations. We achieve a mean absolute error of 5.24 ml, a Pearson correlation of r=0.94 between average predicted stroke volume and average true stroke volume, and a Percentage Error in the limits of agreement of 11.05% (within clinical range for stroke volume measurement devices). These findings open the doors to longitudinal, scalable and affordable cardiovascular measurement out of clinic.",nature_html,0
Understanding the European energy crisis through structural causal models,https://www.nature.com/articles/s41467-026-75433-7,Physical sciences : Nature Communications subject feeds,2026-07-17 00:00:00 UTC,2026-07-17 00:00:00+00:00,,Dirk Witthaut,"Natural gas supplies in Europe were disrupted and energy prices soared in the context of Russia’s invasion of Ukraine. Electricity prices in France experienced the largest relative increase among European countries, even though the share of natural gas in the electricity mix is small compared to its neighbours. In this article, we demonstrate the importance of causal statistical methods and propose causal graphs to investigate the French and Spanish electricity markets and pinpoint key influencing factors on electricity prices and net exports. We demonstrate that a causal approach resolves paradoxical results of simple correlation studies and enables a quantitative analysis of indirect causal effects and what-if scenarios. We introduce a linear structural causal model as well as non-linear tree-based machine learning combined with Shapley Flow values. The models elucidate the interplay of gas prices and the unavailability of nuclear power plants during the energy crisis as the high unavailability made France dependent on imports.",nature_html,0
Consequences of agricultural deforestation and subsequent afforestation on soil biodiversity and ecosystem multifunctionality,https://www.nature.com/articles/s41467-026-75740-z,Biological sciences : Nature Communications subject feeds,2026-07-17 00:00:00 UTC,2026-07-17 00:00:00+00:00,,Quanfa Zhang,"The Earth is currently in an era where massive deforestation and afforestation coexist. The impact of large-scale agricultural deforestation and the subsequent afforestation on soil biota multidiversity, ecosystem multifunctionality (EMF), and the relationship between soil biota multidiversity and EMF (BEFm) remain unclear. Here, we investigate 405 paired plots along a 4000 km south-north transect, spanning tropical, subtropical, temperate, and boreal zones. We measure 19 ecological functions and sequence soil biota (including bacteria, fungi, archaea, viruses, protists, and invertebrates) and metagenomes. We find that agricultural deforestation reduces soil multitrophic biodiversity by 25% and EMF by 58%, and afforestation has partially restored them, but pristine levels have not been reached. Agricultural deforestation decouples the positive BEFm relationship across four climatic zones, while afforestation restores the positive BEFm relationship in tropics and subtropics but not in temperate and boreal zones. Afforestation in the warmer zone triggers potential multitrophic cascades to enhance EMF, thereby strengthening BEFm relationship. The changes in biogeochemical-cycling genes induced by afforestation exert more significant driving effects on EMF in the warmer zone than the colder zone. Our study provides integrative evidence that climate modulates the recovery of BEFm relationship and offers multitrophic and metagenomic insights into the mechanisms underlying EMF.",nature_html,0
Unraveling daily dynamics of supraglacial lakes in response to hydrological pulses and anomalous climate signals,https://www.nature.com/articles/s41467-026-75669-3,Earth and environmental sciences : Nature Communications subject feeds,2026-07-17 00:00:00 UTC,2026-07-17 00:00:00+00:00,,Yiwen Liang,"Mass loss from debris-covered glaciers in High Mountain Asia drives the expansion of small supraglacial lakes (SGLs) and changes the occurrence patterns of hazardous processes including glacial lake outburst floods. Here, we analyse surface area changes of small SGLs ( > 0.045×104 m2) in the Sagarmatha region, Eastern Himalaya, integrating data with daily resolution from 2016 to 2024. The results show SGLs expanded at a mean rate of 5.90 ± 1.49×104 m2·yr⁻¹. Starting from October 2022, SGLs in the study area have exhibited anomalous expansion, with the total lake area reached its maximum during this period, 67.35% higher than during the second peak (2020). The seasonal fluctuations of SGLs are synchronous with short-term variations in global temperature. By mid-century, SGL expansion in High Mountain Asia is expected to continue. Given their rapid response to climate change, small SGLs could support the development of early-warning frameworks for hydrological pulses and extreme climate events.",nature_html,0
The Japanese Palaeolithic deserves more attention in Western narratives about human expansion across Asia,https://www.nature.com/articles/s41467-026-74116-7,Biological sciences : Nature Communications subject feeds,2026-07-17 00:00:00 UTC,2026-07-17 00:00:00+00:00,,Robin Dennell,"Japan deserves more attention than it has so far received in Western narratives about the expansion of humans across Asia. It has over 10,000 Palaeolithic sites, many of which are well-dated. Japan provides excellent examples of Pleistocene sea-faring and long-distance Palaeolithic exchange networks. Okinawa in the Ryukyu Islands may provide one of the earliest examples of humans deliberately trans-locating an animal to a new environment. Japan may also have been a starting point for the colonisation of the Americas.",nature_html,0
Mediterranean outflow waters supply North Atlantic convection sites,https://www.nature.com/articles/s41467-026-75523-6,Earth and environmental sciences : Nature Communications subject feeds,2026-07-17 00:00:00 UTC,2026-07-17 00:00:00+00:00,,Enrico Zambianchi,"The northward-flowing branch of the Mediterranean Outflow Water (MOW) carries warm and saline water into the Subpolar North Atlantic, where deep convection contributes to the formation of water masses that feed the lower limb of the Atlantic Meridional Overturning Circulation. Due to its distinctive thermohaline characteristics, the MOW presence may act as a preconditioning factor for the formation of these waters. However, the complex dynamics of the subpolar regions make tracing its pathway beyond &#x223C;"" role=""presentation"">∼\sim50°N using conventional tracers and datasets challenging. We use an extensive dataset of Argo float salinity and oxygen profiles acquired over the North Atlantic during more than two decades to track the northward-flowing MOW and characterize its evolution along the way. Here we show that these observations allow for a multi-tracer approach, providing robust evidence of MOW’s presence in the subpolar basins, including the Irminger Sea, which has recently been identified as a basin where major deep convective processes occur. These findings highlight the potential role of the MOW in influencing the large-scale overturning circulation.",nature_html,0
Charge-spin dichotomy in the kagome metal CsCr3Sb5,https://www.nature.com/articles/s41467-026-74096-8,Physical sciences : Nature Communications subject feeds,2026-07-17 00:00:00 UTC,2026-07-17 00:00:00+00:00,,Takasada Shibauchi,"Kagome metals host a variety of correlated electronic states, yet the nature of their intertwined orders remains an open question. The recently discovered Cr-based kagome compound CsCr3Sb5 differs from its V-based analogue CsV3Sb5 by exhibiting stronger correlations and a magnetic ground state. While multiple broken symmetries have been reported in CsV3Sb5, only a single transition at T* ≈ 55 K has been identified at ambient pressure in CsCr3Sb5, with its origin unresolved. Here we uncover an additional phase transition above T* through elastoresistivity measurements. Rotational symmetry breaking without divergent nematic susceptibility is identified around T ≈ 64 K, which is most consistently explained as the emergence of charge-density-wave order. Laser-based photoemission-electron microscopy further reveals three-domain structures associated with spin-density-wave order below T*. These findings indicate distinct charge and spin order transitions in CsCr3Sb5, offering crucial insight into the intertwined orders and pressure-induced superconductivity in this system.",nature_html,0
Ultrafast reset-free integrated polarization tracking enabled by thin-film lithium tantalate,https://www.nature.com/articles/s41467-026-75732-z,Physical sciences : Nature Communications subject feeds,2026-07-17 00:00:00 UTC,2026-07-17 00:00:00+00:00,,Ming Tang,"The rapid growth of artificial-intelligence computing demands high-bandwidth and energy-efficient data-center interconnects. Although self-homodyne coherent (SHC) transmission reduces digital signal-processing complexity, its practical deployment is limited by ultrafast state-of-polarization (SOP) fluctuations that destabilize coherent reception. Here we show an ultrafast adaptive polarization controller (APC) based on thin-film lithium tantalate, enabled by the co-design of a photonic chip, a finite-boundary gradient-descent (FBGD) algorithm, and a low-latency real-time control system. The FBGD algorithm incorporates the finite phase boundary directly into the control strategy, enabling reset-free continuous SOP tracking. The implemented APC is validated through both standalone polarization-tracking measurements and a dual-polarization 16-QAM SHC 400-Gbps transmission system. Stable reset-free operation under continuous polarization disturbances is maintained up to 1 Mrad·s⁻¹. These results establish a previously inaccessible operating regime for integrated polarization control and provide a practical route toward ultrafast and reset-free polarization control in coherent optical interconnects and other polarization-sensitive photonic systems.",nature_html,0
"Highly Efficient Methane Electrosynthesis Enabled by Precise, Multifaceted Interface Regulation",https://www.nature.com/articles/s41467-026-75518-3,Physical sciences : Nature Communications subject feeds,2026-07-17 00:00:00 UTC,2026-07-17 00:00:00+00:00,,Zongping Shao,"The electrocatalytic reduction of carbon dioxide (CO2) offers a pathway to transform greenhouse gas emissions into fuels and chemicals using renewable electricity. Among possible products, methane (CH4) is particularly attractive due to its high energy density and seamless integration with existing natural gas infrastructure, yet its electrosynthesis is hindered by demanding multi-electron kinetics and mass-transport constraints. Here, we report a four-channel copper tubular penetration electrode (TPE) with a honeycomb-like architecture that fundamentally reshapes the reaction environment for CO2 electroreduction. By precisely controlling electrode cross-sectional thickness, this multi-channel design regulates gas, electron, and electrolyte transport, stabilizing the three-phase interface required for efficient CH4 formation. The optimized TPE achieves a CH4 Faradaic efficiency of 87.5%, a half-cell energy efficiency of 43.46%, and stable operation for 100 hours. Combined experimental and theoretical analyses reveal that rational design of electrode architecture enables precise control over the CO2 adsorption configurations and reaction intermediates, thereby fine-tuning the reaction pathway toward CH4. These findings establish multi-channel TPEs as a powerful platform for efficient CO2 electromethanation.",nature_html,0
Quasi-solitons in Rydberg atom chains,https://www.nature.com/articles/s41467-026-75598-1,Physical sciences : Nature Communications subject feeds,2026-07-17 00:00:00 UTC,2026-07-17 00:00:00+00:00,,Maksym Serbyn,"Solitons—localized wave packets that travel without spreading—play a central role in understanding transport and properties of nonlinear systems. In quantum many-body systems, however, such robust excitations are typically destroyed by thermalization. Here, we theoretically demonstrate the existence of solitonic excitations in high-energy states of Rydberg atom chains in the regime of strong nearest-neighbor Rydberg blockade. These localized wave packets propagate directionally atop a special class of reviving initial states related to quantum many-body scars and are capable of carrying energy. Exhibiting long coherence times, these states constitute a form of non-ergodic quantum dynamics and can be efficiently implemented on Rydberg atom simulators. In this work, in addition to a phenomenological description of solitons, we identify their counterpart in a classical nonlinear dynamical system, demonstrate their potential use in quantum information transfer, and conjecture their relevance for anomalous energy transport reported in numerical studies of Rydberg atom arrays.",nature_html,0
Mid-IR light modulators enabled by dynamically tunable ultra-high-Q silicon membrane metasurfaces,https://www.nature.com/articles/s41467-026-75121-6,Physical sciences : Nature Communications subject feeds,2026-07-17 00:00:00 UTC,2026-07-17 00:00:00+00:00,,Hatice Altug,"Metasurfaces enable subwavelength control of free-space light for applications in sensing, nonlinear optics, and quantum photonics. However, their practical deployment is hindered by two key limitations: a tradeoff between low-Q resonances and weak amplitude contrast, and their predominantly static nature allowing only passive functionalities. These challenges are particularly severe in the mid-infrared (mid-IR), where the scarcity of low-loss materials constrains performance and scalability. Here, we demonstrate actively tunable single-crystalline silicon membrane metasurfaces combining high-Q resonances, strong amplitude contrast, and wafer-scale manufacturability. Our platform achieves record-high measured Q-factors up to 3000 in the mid-IR and supports two dynamic modulation schemes: electro-thermal tuning via Joule heating with >50% modulation depth at CMOS-compatible voltages and speeds up to 14.5 kHz, and ultrafast all-optical modulation via carrier generation in silicon with nanosecond response times and estimated sub-GHz rates. These results establish silicon membrane metasurfaces as a scalable platform for active mid-IR photonics.",nature_html,0
Coexistence of high temperature superconductivity and antiferromagnetic order in a cuprate with multiple hole Fermi pockets,https://www.nature.com/articles/s41467-026-75301-4,Physical sciences : Nature Communications subject feeds,2026-07-17 00:00:00 UTC,2026-07-17 00:00:00+00:00,,X. J. Zhou,"The intricate relationship between high temperature superconductivity and antiferromagnetic order in cuprates, and the fundamental origin of electron pairing remain open questions. By utilizing high-resolution laser-based spatially-resolved angle-resolved photoemission spectroscopy, we investigate the seven-layer Bi2Sr2Ca6Cu7O18+δ (Bi2267) and identify a cuprate system that consists of multiple hole Fermi pockets. The observed Fermi pockets exhibit pronounced momentum-, temperature- and Fermi surface-dependent energy gaps. Crucially, high temperature superconductivity with a critical temperature (Tc) of ~ 75 K emerges in a system with multiple Fermi pockets and the presence of strong antiferromagnetic order and correlations. In particular, substantial electron pairing is observed along the Fermi pocket with an energy gap up to ~ 42 meV in lightly-doped CuO2 planes (p ~ 0.05). These findings challenge the conventional understanding of the roles of the nodal and antinodal electronic states in driving high temperature superconductivity. They show that superconductivity and antiferromagnetism can coexist in a cuprate with multiple Fermi pockets, offering further insights into the pairing mechanism in cuprate superconductors.",nature_html,0
High-performance multijunction perovskite LEDs with reduced interconnection loss,https://www.nature.com/articles/s41467-026-75756-5,Physical sciences : Nature Communications subject feeds,2026-07-17 00:00:00 UTC,2026-07-17 00:00:00+00:00,,Yanrong Li,"Tandem light-emitting diodes (LEDs) offer advantages in efficiency, brightness and lower the current density for a target brightness, but their implementation in solution-processed perovskite LEDs is limited by interconnection strategies that introduce high voltage penalties and poor robustness. Here we demonstrate a hierarchically structured interconnection layer (ICL) integrating a near-degenerate charge-generation junction with a crystalline-amorphous oxide composite, enabling low-barrier transport and solvent-tolerant stacking with reduced loss. Using this ICL, we realize double-junction perovskite LEDs in which two subunits operate efficiently in series, achieving a peak external quantum efficiency (EQE) of 42.6%, a maximum radiance of 690 W sr−1 m−2, and low driving voltage. The ICL is compatible with multiple perovskite emitters and supports scalable multijunction integration, yielding multijunction devices with sub-bandgap turn-on voltages and high EQEs exceeding 60%. Our results establish a low-loss interconnection strategy for series-stacked perovskite emitters, providing a practical route toward high-brightness and multi-wavelength perovskite light sources.",nature_html,0
Visualizing excitonic states in constructed cyclic molecular architectures by tip-enhanced photoluminescence,https://www.nature.com/articles/s41467-026-75721-2,Physical sciences : Nature Communications subject feeds,2026-07-17 00:00:00 UTC,2026-07-17 00:00:00+00:00,,Yang Zhang,"Natural photosynthesis inspires the design of artificial cyclic light-harvesting architectures, yet probing their excitonic behaviors—particularly optically dark states—remains challenging for far-field optics due to diffraction limits and dipole selection rules. Here, combining scanning tunneling microscope manipulation with tip-enhanced photoluminescence, we visualize discrete excitonic states in constructed cyclic zinc-phthalocyanine architectures with sub-nanometer resolution. By controlling intermolecular distances, we map excitonic evolution across weak, intermediate, and strong coupling regimes. We uncover a transition dipole rotation phenomenon arising from the molecules’ orthogonal, degenerate dipoles, which facilitates coherent intermolecular coupling. Furthermore, by comparing hollow and solid architectures, we demonstrate that the molecular architectures determine the nature of the lowest-lying excitonic state: a hollow ring possesses an optically dark lowest-lying state, whereas a solid architecture features a bright one, highlighting a possible structural physical advantage of hollow cyclic architectures for suppressing radiative losses. These findings provide guidelines for designing organic architectures with high energy transfer efficiencies.",nature_html,0
Bound water as a kinetic crosslinker for bio-inspired impact-stiffening polymers,https://www.nature.com/articles/s41467-026-75737-8,Physical sciences : Nature Communications subject feeds,2026-07-17 00:00:00 UTC,2026-07-17 00:00:00+00:00,,Lingyan Gao,"Developing high-performance impact-stiffening polymers that are broadly applicable across chemical systems remains a key challenge, as existing designs rely on meticulously engineered molecular motifs. Inspired by water’s role in biological impact resistance, we introduce a generalizable biomimetic paradigm. We transform water—commonly considered a property-limiting plasticizer—into an active, rate-sensitive cross-linker by structurally confining bound-water networks within proton-rich polymer scaffolds. Programming their dissociation kinetics enables a sharp, reversible soft-to-rigid transition under impact via kinetic freezing. This design, demonstrated in a poly(thioctic acid)-based system, concurrently achieves outstanding energy dissipation, self-healing, and strong adhesion. Crucially, it bypasses de novo synthesis of specialized motifs and is applicable across diverse polymer backbones, establishing programmable water dynamics as a versatile principle for adaptive polymeric materials.",nature_html,0
Reforging Mitsunobu reaction via sulfoxides-catalyzed C(sp3)-O bond activation of alkanols,https://www.nature.com/articles/s41467-026-75633-1,Physical sciences : Nature Communications subject feeds,2026-07-17 00:00:00 UTC,2026-07-17 00:00:00+00:00,,Jun Yang,"The stereospecific conversion of alkanols plays a pivotal role in synthetic chemistry and drug discovery. Among the substantial advances, the Mitsunobu reaction has long stood out as a powerful platform for C(sp3)-O bond activation to achieve the transformation of alkanols. Due to the inherent environmental drawbacks of phosphorus chemistry, an alternative element is pressingly demanded. Herein, we develop well-designed sulfoxide catalysts for an alternative catalytic Mitsunobu-type reaction with broad substrate scope, generating H2O as the sole by-product. Kinetic studies, mechanistic investigations, and density functional theory (DFT) calculations provide comprehensive mechanistic insights and uncover key structure-reactivity relationships. This approach establishes a sustainable and atom-economical pathway for the Mitsunobu-type reaction, and expands the conceptual scope of sulfur catalysis.",nature_html,0
Flow matching for reaction pathway generation,https://www.nature.com/articles/s41467-026-75654-w,Physical sciences : Nature Communications subject feeds,2026-07-17 00:00:00 UTC,2026-07-17 00:00:00+00:00,,Ju Li,"Elucidating reaction mechanisms requires efficient generation of transition states (TSs) and products. Existing diffusion and sequence-based models accelerate parts of this process over traditional string-based methods, but typically still require manual enumeration of either TSs or products, and stochastic diffusion dynamics can be inefficient and hard to control. We introduce MolGEN, a conditional flow-matching framework that uses deterministic optimal transport to map Gaussian priors to chemical distributions. For TS generation, MolGEN improves TS geometry and barrier-height prediction over diffusion models while enabling sub-second sampling. For reaction product generation, it achieves competitive top-k accuracy while preserving mass and electron balance. Using the same backbone for TS and product sampling, MolGEN enables template-free generative exploration of reaction networks without the repeated quantum-chemistry searches required by prior methods. For the γ-ketohydroperoxide decomposition network, it produces more valid TSs than string-based methods using only 12 quantum-chemistry evaluations instead of 1156, and identifies a lower-barrier pathway.",nature_html,0
