title,link,source,published_str,pub_date,doi,last_author,abstract,abstract_source,must_have_abstract
Immune protection and persistence in Pseudomonas aeruginosa infections by pyruvate cross-feeding,https://www.nature.com/articles/s41467-026-75330-z,Biological sciences : Nature Communications subject feeds,2026-07-08 00:00:00 UTC,2026-07-08 00:00:00+00:00,,Ruggero La Rosa,"Chronic infections by Pseudomonas aeruginosa in people with cystic fibrosis are characterized by persistent inflammation and oxidative stress, yet the mechanisms enabling bacterial persistence are not fully understood. Here, we identify a persistence mechanism mediated by pyruvate secretion resulting from mutations in the pyruvate dehydrogenase complex in clinical isolates of P. aeruginosa, with putative analogous mutations also identified in Staphylococcus aureus, Haemophilus influenzae and Stenotrophomonas maltophilia. These mutations lead to elevated extracellular pyruvate, which dampens host inflammatory responses and favors bacterial persistence. Pyruvate exerts multiple roles: scavenges reactive oxygen species such as H2O2, suppresses host immune activation both in airway epithelial cells and macrophages, and increases bacterial survival during phagocytosis. This metabolic crosstalk promotes bacterial persistence while reducing epithelial and macrophage inflammatory responses. Our findings reveal pyruvate as a bacterial immunometabolite that mimics host antioxidant defenses, reshaping the infection niche to favor long-term colonization. This work highlights the broader role of secreted metabolites in host-pathogen interactions and suggests new strategies targeting metabolic pathways to manage chronic infections.",nature_html,0
Genetically targeted photocatalytic organic dyes for spatiotemporally controlled organic synthesis in specific living cells,https://www.nature.com/articles/s41557-026-02195-6,Nature Chemistry,2026-07-08 00:00:00 UTC,2026-07-08 00:00:00+00:00,10.1038/s41557-026-02195-6,Zhenan Bao,"The catalytic synthesis of many abiotic organic compounds is beyond the native capabilities of mammalian cells. Broadening the range of physiologically compatible, bond-forming catalytic reactions could enable the in situ synthesis of diverse molecules within living systems. By controlling these reactions in both specific cells and in physical space, this approach could offer transformative ways to modulate cellular behaviour and treat cells as distinct reaction vessels within organisms. Here we use genetic targeting to incorporate organic photocatalytic dyes onto and within cells to enable cell-type-specific and spatially defined catalysis. Photocatalysis can be restricted to individual cells using mild, green-to-red visible stimulation. The dyes catalyse cross-dehydrogenative C–H functionalization for the light- and cell-specific construction of C–C bonds in situ. Nuclear-localized assembly directs protein translocation with reversed transport directionality, illustrating the utility of this approach to both generate and enhance the function of chemical biology tools. We anticipate that the integration of synthetic catalysts with cell-specific targeting may lay an important foundation for future precision-directed abiotic chemical synthesis in living organisms.",nature_html,0
Plant-soil feedbacks benefit plant invaders under multiple global change factors,https://academic.oup.com/nsr/advance-article/doi/10.1093/nsr/nwag415/8728727?rss=1,National Science Review Advance Access,2026-07-08 00:00:00 UTC,2026-07-08 00:00:00+00:00,10.1093/nsr/nwag415,Mark van Kleunen,"Plant-soil feedbacks (PSFs) are an important mechanism determining plant community dynamics and invasion by non-native species. While the individual responses of plants and soil microbes to multiple concurrent global change factors (GCFs) have been documented, it remains poorly understood how multiple GCFs affect PSFs and, particularly, whether this effect depends on plant origin. We conducted a PSF experiment with five pairs of native and alien species and nine GCFs applied in concurrent combinations of 0, 1, 3 and 6 GCFs. As GCF-number increased, PSFs shifted from negative to neutral or positive in native species, but were consistently positive and became stronger in alien species. The positive response of PSFs to multiple GCFs was due to specific interactions between co-acting GCFs in native species, but not in alien species, and was related to changes in soil mutualists. Our study highlights that PSFs could promote the spread of alien species under multiple concurrent GCFs.",rss_oup,0
Alternatively spliced killer–protector system confers S19-mediated hybrid male sterility in rice,https://www.nature.com/articles/s41467-026-74581-0,Biological sciences : Nature Communications subject feeds,2026-07-08 00:00:00 UTC,2026-07-08 00:00:00+00:00,,Letian Chen,"Hybrid sterility limits the use of strong interspecific heterosis and S19 is a major locus that confers hybrid sterility between Oryza sativa (Asian cultivated rice) and Oryza glaberrima (African cultivated rice). However, the S19 is not yet cloned and its underlying mechanism remains elusive. In this study, we identify two closely linked genes (S19A1 and S19A7) specific to African rice allele that encode a killer–protector module at the S19 locus. Two alternatively spliced transcripts expressed from the killer gene S19A1 (S19A1.1 and S19A1.2) encode mitochondria-targeted cytotoxic proteins that cause toxicity diversity for somatic and/or gametic cell death, respectively. However, S19A7 interacts with S19A1.1 and S19A1.2, blocking their cytotoxic effect. Because the Asian rice S19 allele lacks S19A1 and S19A7, male gametes that carry this allele are selectively aborted in Asian–African F1 hybrids. Knockout of S19A1 can overcome S19-mediated hybrid sterility. Haplotype analysis reveals that the functional S19 allele is absent in non-AA-genome Oryza species and likely emerged in the O. barthii–O. glaberrima lineage through a multi-step evolutionary process. Our findings provide insight into the genetic mechanisms responsible for hybrid sterility between Asian and African rice and suggest genetic and biotechnological strategies for the use of interspecific heterosis in rice.",nature_html,0
A portable Cas6f-based system for multiplex translational repression in bacteria,https://www.nature.com/articles/s41467-026-75135-0,Biological sciences : Nature Communications subject feeds,2026-07-08 00:00:00 UTC,2026-07-08 00:00:00+00:00,,Pablo I. Nikel,"Engineered small RNAs (sRNAs) enable programmable gene knockdowns and support metabolic engineering and multiplex regulation in model bacteria. Still, precise, tunable, and multiplex gene repression remains a challenge in synthetic biology. Common tools can impose genetic burden, depend on host RNA factors, or do not transfer well across species. Here we present MORTISE (Multiplex, ORthogonal Translation Interference SystEm), a compact Cas6f-based platform for programmable translational repression in Gram-negative bacteria. The system functions without host Hfq or RNases and operates robustly in Escherichia coli and Pseudomonas putida. We demonstrate repression in both species using chromosomal reporter assays, with performance improving when guide and target transcription are matched and when the translation initiation region is targeted. Single-promoter multiplexing enables simultaneous knockdowns and a cloning toolbox facilitates assembly of up to nine guides in a single step. Finally, MORTISE is leveraged to boost malonyl-coenzyme A–dependent production in P. putida, supporting pathway balancing.",nature_html,0
Dynamic immune profiling predicts response to radiation plus anti-PD-1 therapy in oligometastatic renal cell carcinoma,https://www.nature.com/articles/s41467-026-74255-x,Biological sciences : Nature Communications subject feeds,2026-07-08 00:00:00 UTC,2026-07-08 00:00:00+00:00,,Shankar Siva,"Biomarkers that predict response to combined radiation and anti-PD-1 therapy in clear cell renal cell carcinoma (ccRCC) are poorly defined. RAPPORT trial (NCT02855203) is a prospective phase I/II study of stereotactic ablative body radiotherapy (SABR) and pembrolizumab in 30 patients with oligometastatic ccRCC. The primary endpoint was safety; secondary endpoints included overall survival, time to local progression, distant progression-free survival, objective and disease control rates, duration of response and patient-reported pain. Here, we report the pre-specified exploratory translational analyses. In pre-treatment tumours, responders had greater intra-tumoural cytotoxic T cell infiltration in close proximity to tumour cells, whereas non-responders showed enrichment of immunosuppressive, TGF-β and angiogenic signatures. In peripheral blood post-treatment, responders developed a proliferative burst of activated CD8+ T cells and sustained sharing of pre-existing tumour-enriched TCR clones. These findings identify trafficking and maintenance of pre-existing tumour-enriched T cell clones as determinants of response to SABR plus anti-PD-1 in ccRCC.",nature_html,0
From screening to generative design in nucleic acid delivery,https://www.nature.com/articles/s41578-026-00944-0,Nature Reviews Materials,2026-07-08 00:00:00 UTC,2026-07-08 00:00:00+00:00,10.1038/s41578-026-00944-0,Bowen Li,"The discovery of delivery materials is shifting from empirical screening to predictive, artificial intelligence-guided design. Harder problems, including the simultaneous optimization of competing properties and delivery beyond the liver, are now pushing the field further, from screening materials to generating them against predefined property targets.",nature_html,0
Cryo-EM structures of naturally occurring dimeric photosystem II complexes lacking the Mn4CaO5 cluster,https://www.nature.com/articles/s41467-026-75324-x,Biological sciences : Nature Communications subject feeds,2026-07-08 00:00:00 UTC,2026-07-08 00:00:00+00:00,,Leonid A. Sazanov,"Robust oxygenic photosynthesis requires the efficient assembly and repair of the multi-subunit oxygen-evolving photosystem II (PSII) complex. Previous cryogenic electron microscopy (cryo-EM) structures of PSII assembly/disassembly intermediates have relied on the analysis of deletion mutants or removal of PSII subunits in vitro. Here we report the cryo-EM structures of naturally occurring dimeric PSII intermediates from the cyanobacterium Thermosynechococcus vestitus at a resolution of about 2.2 Å. These intermediates contain inactive dimers lacking the oxygen-evolving complex (OEC) and semi-active dimers with the OEC present in one of the two monomers. Our structural data provide a mechanism for how assembly and disassembly of the Mn4CaO5 cluster is coordinated with the binding and release of the extrinsic proteins: restructuring of the C-terminal tail of D1 subunit during assembly or disassembly of the Mn cluster triggers conformational changes in D2, CP47 and CP43 to drive the binding/release of the extrinsic proteins. A combination of structural and mass spectrometry data also suggests that the inactive PSII complexes may include damaged complexes containing oxidized D1-His332, a monodentate ligand to one of the Mn ions of the OEC.",nature_html,0
Nuclear weapons lurking in space could be tracked down by satellites,https://www.nature.com/articles/d41586-026-01944-4,Nature,2026-07-08 00:00:00 UTC,2026-07-08 00:00:00+00:00,10.1038/d41586-026-01944-4,Angela Di Fulvio,"A nuclear weapon orbiting Earth would emit neutrons through its interactions with the planet’s space radiation environment, and these could be detected by satellites. A nuclear weapon orbiting Earth would emit neutrons through its interactions with the planet’s space radiation environment, and these could be detected by satellites.",nature_html,0
Sea-floor spreading captured by undersea observatory,https://www.nature.com/articles/d41586-026-01943-5,Nature,2026-07-08 00:00:00 UTC,2026-07-08 00:00:00+00:00,10.1038/d41586-026-01943-5,Lars H. Ruepke,A sea-floor monitoring experiment observed oceanic crust being created between two tectonic plates — the first in situ measurement of this phenomenon. A sea-floor monitoring experiment observed oceanic crust being created between two tectonic plates — the first in situ measurement of this phenomenon.,nature_html,0
Judicious use of LLMs could speed up progress in the social sciences,https://www.nature.com/articles/d41586-026-01875-0,Nature,2026-07-08 00:00:00 UTC,2026-07-08 00:00:00+00:00,10.1038/d41586-026-01875-0,James N. Druckman,"Large language models could advance experiments in the social sciences, but fundamental questions remain about how they should be used to support research. Large language models could advance experiments in the social sciences, but fundamental questions remain about how they should be used to support research.",nature_html,0
Breast cancer driver genes found by screening chromosome aberrations in vivo,https://www.nature.com/articles/d41586-026-02014-5,Nature,2026-07-08 00:00:00 UTC,2026-07-08 00:00:00+00:00,10.1038/d41586-026-02014-5,,"Cancer genomes are unstable, often experiencing gains or losses of whole chromosomes or chromosome arms — changes known as aneuploidies. Experiments in mouse models of breast cancer reveal that these instabilities harbour one or two prevalent genes that drive cancer and that bypass the need to accumulate aneuploidies; they also require an intact microenvironment to produce their effects. Altered expression of many drivers identified in the in vivo CRISPR screen did not alter cell behaviour in vitro.",nature_html,0
Ocean floor witnessed splitting apart for the first time — releasing lava,https://www.nature.com/articles/d41586-026-02139-7,Nature,2026-07-08 00:00:00 UTC,2026-07-08 00:00:00+00:00,10.1038/d41586-026-02139-7,Davide Castelvecchi,"Scientists observed a mid-ocean ridge widen in real time, recording several metres of sea-floor motion and huge lava outflows. Scientists observed a mid-ocean ridge widen in real time, recording several metres of sea-floor motion and huge lava outflows.",nature_html,0
Those who forget,https://www.nature.com/articles/d41586-026-01933-7,Nature,2026-07-08 00:00:00 UTC,2026-07-08 00:00:00+00:00,10.1038/d41586-026-01933-7,Michael Adam Robson,Clarity of thought. Clarity of thought.,nature_html,0
Volcanoes and wildfires contributed to increased stratospheric humidification,https://www.nature.com/articles/d41586-026-02011-8,Nature,2026-07-08 00:00:00 UTC,2026-07-08 00:00:00+00:00,10.1038/d41586-026-02011-8,,"Observations from satellites and climate-model simulations show that moderate volcanic eruptions and extreme wildfires have humidified the stratosphere since 2005. The aerosol-mediated effects of these eruptions and fires explain about one-third of the observed stratospheric water-vapour trend, a contribution similar to that of surface warming. Moderate eruptions and extreme fires account for about one-third of the upward trend in stratospheric moisture.",nature_html,0
"How to advance revolutionary science: high turnover, high risk and a licence to fail",https://www.nature.com/articles/d41586-026-02090-7,Nature,2026-07-08 00:00:00 UTC,2026-07-08 00:00:00+00:00,10.1038/d41586-026-02090-7,Elizabeth Gibney,Kathleen Fisher reveals the recipe for funding innovative science that she brings to the UK Advanced Research and Invention Agency. Kathleen Fisher reveals the recipe for funding innovative science that she brings to the UK Advanced Research and Invention Agency.,nature_html,0
A NIR fluorotag reporter CETIF6a enables bright pan-tumor labeling and functional proteomic profiling,https://www.nature.com/articles/s41467-026-75356-3,Biological sciences : Nature Communications subject feeds,2026-07-08 00:00:00 UTC,2026-07-08 00:00:00+00:00,,Shoujun Zhu,"Tumor-seeking fluorescent dyes enable precise lesion localization by recognizing overexpressed receptors, providing a critical adjunctive technology for cancer histopathology. However, tumor heterogeneity and the poor understanding of targeting mechanisms limit their efficacy. Here we engineer CETIF6a, a click chemistry-compatible heptamethine cyanine dye, for multi-cancer targeting, intraoperative histopathology, and proteome-wide target identification. CETIF6a demonstrates margin delineation across multiple cancer types ( > 90% concordance with H&E staining). Quantitative proteomics reveals that the dye targets 5-15 times more tumor-specific proteins than in paracancerous tissues. Synergistic pan-cancer targeting is achieved through 491 conserved tumor-enriched proteins involved in ribosomal, proteasomal, and metabolic pathways, effectively overcoming heterogeneity. Mechanistic studies confirm that CETIF6a emits bright fluorescence upon covalent binding to targets via nucleophilic substitution at cysteine thiol residues within hydrophobic cavities. The modifiable scaffold of CETIF6a supports both intraoperative tumor diagnosis and functional targets profiling, providing a foundation for systematic probe optimization.",nature_html,0
Structural dynamics of RNA polymerase II throughout the nucleotide addition cycle,https://www.nature.com/articles/s41467-026-75257-5,Biological sciences : Nature Communications subject feeds,2026-07-08 00:00:00 UTC,2026-07-08 00:00:00+00:00,,Peijun Zhang,"RNA polymerase II (RNAPII) drives gene expression through iterative nucleotide addition cycles (NACs) comprising translocation, substrate binding, and catalysis. The lack of pre-catalysis and post-catalysis intermediates has precluded a complete mechanistic understanding of the NAC. Here we present 31 Cryo-electron Microscopy structures (with 43 maps) capturing distinct stages of Saccharomyces cerevisiae RNAPII elongation complex (EC) NAC, including previously intractable transition intermediates. We establish a continuous spectrum of RNAPII EC structural dynamics during the NAC, which can be divided into two coordinated phases: a substrate-induced EC tightening phase and a post-catalysis EC relaxation phase. For the substrate-induced EC tightening phase, the substrate binding initiates allosteric conformational changes across the entire RNAPII EC, including Trigger Loop folding, funnel closure, clamp closure, transcription bubble ordering, and precise alignment of the RNA 3′-end with substrate to form a catalysis-competent configuration. For the post-catalysis EC relaxation phase, we capture the long-sought, short-lived post-catalysis product state and identify a series of intermediates that reveal a reverse conformational transition that facilitates rapid translocation. Together, our findings define a comprehensive structural and dynamic framework for RNAPII NAC, yielding a “molecular movie” of RNAPII in action and revealing a fundamental principle by which the enzyme balances speed and fidelity through coordinated conformational dynamics.",nature_html,0
Systems-level analysis predicts no autotrophy-linked protein-RNA interactions in Clostridium autoethanogenum,https://www.nature.com/articles/s41467-026-75309-w,Biological sciences : Nature Communications subject feeds,2026-07-08 00:00:00 UTC,2026-07-08 00:00:00+00:00,,Kaspar Valgepea,"Burning fossil fuels drives climate change with detrimental consequences on humankind while waste accumulation from increasing consumption threatens biosustainability globally. Gas fermentation enables to recycle carbon oxides (CO and CO2) from industrial waste gases and gasified waste into value-added products using gas-fermenting microbes, namely acetogens. However, our limited understanding of gene function and metabolic regulation is hindering rational engineering of acetogen cell factories. In this work, we aimed to identify genome-wide protein-RNA interactions contributing to autotrophy in the model-acetogen Clostridium autoethanogenum by combining steady-state chemostat cultivation, functional genomics, and computational methods. We first detected limited and uncoupled transcriptional and translational regulation between autotrophy and heterotrophy. Rigorous mapping of genome-wide transcriptional architecture revealed both differential usage and signal strength of transcriptional start and termination sites between genes and growth substrates. We then used computational tools to reconstruct protein-RNA interactions for differentially regulated genes, predicting 14 trans-acting regulatory RNA-binding proteins (RBPs) involved in post-transcriptional regulation but not linked to genes key for autotrophy. Most RBPs, one of which is translationally regulated, perform RNA modifications and regulate mRNA stability while others target translation-related genes. Our work provides valuable knowledge for metabolic engineering of acetogens and potentially contributes towards understanding primordial life on Earth.",nature_html,0
"Neuronal dynamics, timing, and flow of sensory and choice-related information in auditory-prefrontal circuitry",https://www.nature.com/articles/s41467-026-75349-2,Biological sciences : Nature Communications subject feeds,2026-07-08 00:00:00 UTC,2026-07-08 00:00:00+00:00,,Bruno B. Averbeck,"Auditory decision-making requires transforming sensory inputs into meaningful choices by integrating external stimuli with internal cognitive processes. Classical hierarchical models propose sequential processing, where primary sensory areas relay sensory information to higher-order regions that compute decision-related processes. However, whether this sequential hierarchy fully captures cortical dynamics remains unclear. Here, we analyzed simultaneous neuronal recordings from primary auditory cortex (A1) and dorsolateral prefrontal cortex (PFC) in two male macaque monkeys performing a spatial auditory decision-making task. Our analyses revealed a clear temporal hierarchy: sensory information was unidirectionally transferred from A1 to PFC, while decision-related information exhibited a bidirectional transfer, first from PFC to A1, and crucially back from A1 to PFC. These findings extend classical hierarchical assumptions, demonstrating a recurrent loop between A1 and PFC during decision-making, and offer a dynamic perspective on the integration of sensory and cognitive processes in the cerebral cortex.",nature_html,0
Autonomous control of quantum-confined CsPbBr3 nanoplatelets,https://www.cell.com/matter/fulltext/S2590-2385(26)00278-X?rss=yes,Matter,2026-07-08 00:00:00 UTC,2026-07-08 00:00:00+00:00,10.1016/j.matt.2026.102915,Milad Abolhasani,"An autonomous microfluidic platform combines flow chemistry, real-time spectroscopy, and Bayesian optimization to discover high-quality CsPbBr3 nanoplatelets with targeted optical properties. The system rapidly identifies synthesis conditions that control quantum confinement, emission color, and photoluminescence efficiency, while generating data-driven insight into nanoplatelet growth mechanisms. The optimized conditions translate directly to steady-state continuous manufacturing, demonstrating how self-driving laboratories can accelerate the discovery and scalable production of advanced quantum materials.",rss_cell,0
Programming curved atomic active sites in carbon dots through curvature-coordination coupling,https://www.cell.com/matter/fulltext/S2590-2385(26)00277-8?rss=yes,Matter,2026-07-08 00:00:00 UTC,2026-07-08 00:00:00+00:00,10.1016/j.matt.2026.102914,Chuangang Hu,"Curved carbon dots offer a geometry-defined platform for integrating curvature with second-shell coordination in atomic active sites. This cooperative regulation places Ni sites in an optimal electronic regime, raising intrinsic urea oxidation activity by nearly 20-fold and enabling energy-efficient hydrogen production with concurrent urea-containing waste remediation.",rss_cell,0
Breaking the power ceiling of radiative cooling through evaporative-radiative synergy,https://www.cell.com/matter/fulltext/S2590-2385(26)00244-4?rss=yes,Matter,2026-07-08 00:00:00 UTC,2026-07-08 00:00:00+00:00,10.1016/j.matt.2026.102881,Jinping Qu,"Traditional radiative cooling faces low cooling limits and environmental restrictions. This review introduces evaporative-assisted radiative cooling, revealing its synergistic thermodynamics to break the power ceiling of radiative cooling. It summarizes related material designs and diverse applications, and discusses key challenges, offering guidelines for advanced passive cooling toward energy sustainability. This work provides a comprehensive roadmap to advance next-generation passive cooling research and real-world implementation.",rss_cell,0
