stable_id,title_zh,abstract_zh
ca2da57573ebd968,锕系裂变中同位素分辨的 Ba 和 Xe 产率及相关重轻碎片系统学,"作者：K. Pomorski、A. Augustyn、T. Cap、Y. J. Chen、M. Kowal、B. Nerlo-Pomorska、M. Warda 和 Z. G. Xiao 根据评估的参考数据计算 Ba 和 Xe 链中同位素解析的中子裂变产率并进行基准测试，重点是固定碎片电荷下的元素解析同位素链 $Y({N}_{f})$ $Z$ 以及重轻片段相关性的一致性。计算……[物理。 Rev. C 114, 014307] 2026 年 7 月 7 日星期二发布"
39aaaf9c9572b1ee,首次观察到 $^{162}\mathrm{Er}$ 中的高 $K$ 能带结构以及相同能带现象背景下的含义,"作者：P. K. Nayak 等人首次鉴定出 $^{162}\mathrm{Er}$ 中的高 $K$ 能带结构。基于 ${K}^{π}\phantom{\rule{0.16em}{0ex}}=\phantom{\rule{0.16em}{0ex}}{7}^{(−)}$ 异构体，发现其本质上与相应的 ${K}^{π}\phantom{\rule{0.16em}{0ex}}=\phantom{\rule…[Phys. Rev. C 114, 014306] 2026 年 7 月 7 日星期二发布"
2399f123ea24b6f6,"$^{67,69,70}\mathrm{Ni}$ 中 $ν{g}_{9/2}$ 异构态的 $g$ 因子测量","作者：K. Stoychev、G. Georgiev、J. Ljungvall、K. Sieja、A. M. Amthor、D. L. Balabanski、G. Belier、M. Danchev、J. M. Daugas、T. N. Ginter、G. Goldring、M. Hausmann、I. Matea、W. Mueller、B. S. Nara Singh、G. Neyens、O. Perru、O. Roig、A. Saltarelli、A. Stolz、N. Vermeulen 和 D. T. Yordanov 背景：在 $^{68}\mathrm{Ni}$ 被提出作为双重魔核之后，过去几十年来，Ni 同位素中 $N=40$ 周围的区域从实验和理论的角度都引起了相当大的兴趣。然而，实验证据被证明是矛盾的……[物理。 Rev. C 114, 014305] 于 2026 年 7 月 7 日星期二发布"
744beb675bb95d8f,量子自旋链中的黑洞态,"作者：Charlotte Kristjansen 和 Konstantin Zarembo 我们通过研究全息术中的热相关器来定义自旋链中的黑洞态。围绕海森堡模型，我们通过评估黑洞态的纠缠熵、空洞形成概率和克雷洛夫复杂度来研究黑洞态的热特性和复杂性特性。 Th…[物理。莱特牧师。 137, 021602] 于 2026 年 7 月 7 日星期二发布"
17258769daeafe8f,非高斯波包量子态的环境辅助生成,"作者：Maryam Khanahmadi 和 Klaus Mølmer 生成非高斯态并将其转换为行波包对于可扩展、容错的量子计算至关重要，但也具有挑战性。我们提出了一种硬件高效的方法，通过将工程非线性耗散与线性TR相结合，同时实现这两项任务……[Phys。莱特牧师。 137, 020802] 2026 年 7 月 7 日星期二发布"
4c554a2ce388ca68,当真空破裂时：极端质量比螺旋中天体物理环境的自洽测试,"作者：Lorenzo Copparoni、Rohit S. Chandramouli 和 Enrico Barausse 引力波信号通常在真空假说下进行解释，即假设天体物理环境的影响可以忽略不计。对于低频源，例如极端质量比螺旋（EMRI），这种假设预计会被打破，这是……[Phys.莱特牧师。 137, 021405] 2026 年 7 月 7 日星期二发布"
0a73b21e3efa1bde,黑洞合并的最大熵猜想,"作者：Monica Rincon-Ramirez、Nathan K. Johnson-McDaniel、Eugenio Bianchi、Ish Gupta、Vaishak Prasad 和 B. S. Sathyaprakash 黑洞合并的残余特性可能受到最大熵界的控制，这表明一旦黑洞变得足够接近，两个黑洞周围的喉咙对于远处的观察者来说就类似于单个克尔黑洞的喉咙，因此克尔熵计算变得有效。莱特牧师。 137, 021406] 2026 年 7 月 7 日星期二发布"
7c4eff23d12651b6,GWTC-4 揭示了活动星系核盘中对齐的分层黑洞合并,"作者：李银杰、王元柱、唐绍鹏和范一中活跃星系核（AGN）吸积盘是分层黑洞（BH）合并的理想场所。为了有力地探讨这种可能性，我们使用灵活的混合群体模型分析了 GWTC-4 中的双黑洞合并，该模型针对成分质量、自旋幅度和自旋倾斜角，a…[Phys.莱特牧师。 137, 021407] 2026 年 7 月 7 日星期二发布"
8dee0ba48e5ca377,广义 Veneziano 振幅世界表,"作者：Shota Komatsu 和 Pronobesh Maity 我们提出了一个世界表动作，它再现了文献中讨论的一类双共振振幅，它概括了空弦的 Veneziano 振幅。我们的建议建立在最近推出的手性复合线性膨胀函数的基础上。我们进一步计算更高点的扩展和c…[Phys。莱特牧师。 137, 021601] 发布时间 2026 年 7 月 7 日星期二"
53c70be73f9be1b6,阿贝尔弦网模型的等距张量网络状态骨架,"作者：Julian Boesl、Yu-Jie Liu、Frank Pollmann 和 Michael Knap 我们构造参数化等距张量网络状态（称为“骨架”），使我们能够探索阿贝尔拓扑序的阶段，并且可以在量子处理器上有效实现。我们获得了稳定的弦网不动点的有限相关长度变形，它们是…[Phys。莱特牧师。 137, 020405] 2026 年 7 月 7 日星期二发布"
776bb7782ea5de98,高温费米子吉布斯态是高斯态的混合,"作者：Akshar Ramkumar、Yiyi Cai、Yu Tong 和 Jiaqing Jiang 量子系统的有效模拟通常依赖于量子态的结构特性。受到 Bakshi 等人最近的结果的启发。关于量子自旋系统高温吉布斯态中纠缠的突然死亡，我们研究了边界的高温吉布斯态......[物理。莱特牧师。 137, 020601] 发布时间 2026 年 7 月 7 日星期二"
82fc21b3373a5f17,无噪声费米子传输中普遍性的出现,"作者：João Costa、Pedro Ribeiro 和 Andrea De Luca 我们分析了各种形式的噪声对非相互作用费米子的一维系统的影响。在强噪声极限下，我们证明，在温和的假设下，热力学极限中费米子相关矩阵的统计遵循最近的研究描述的通用形式……[Phys.莱特牧师。 137, 020403] 于 2026 年 7 月 7 日星期二发布"
7f70965fd857d62e,通过不定因果阶纠错实现抗噪海森堡有限量子传感,"作者：Hang Xu、Xiaoyang Deng、Ze Cheng、Tailong Shaw 和 Guihua Zeng 原则上，量子资源可以实现海森堡极限传感，但 no go 定理意味着海森堡极限缩放在现实的噪声设备中通常是无法实现的。虽然量子纠错 (QEC) 可以抑制噪声，但其在量子传感中的使用受到严格要求的限制……[Phys.莱特牧师。 137, 020801] 2026 年 7 月 7 日星期二发布"
38eebce98ef27653,通过基布尔-祖雷克机制在新生玻色-爱因斯坦凝聚态中产生自发量子湍流,"作者：Seong-Ho Shinn、Matteo Massaro、Mithun Thudiyangal 和 Adolfo del Campo Kibble-Zurek 机制 (KZM) 预测在有限速率驱动的连续相变中拓扑缺陷的自发形成。我们提出在热猝灭引起的玻色-爱因斯坦凝聚过程中通过 KZM 产生自发量子湍流 (SQT)。使用数字...[物理。莱特牧师。 137, 020402] 2026 年 7 月 7 日星期二发布"
2e2584538e1eb680,1.2 公里光纤上的时间多模离子-离子纠缠,"作者：Z.-B.崔，Z.-Q。王，P.-Y。刘，王，P.-C。赖，J.-X。石，Y.-D。孙，Z.-C。田，H.-S。孙，Y.-B。梁，B.-X。齐，Y.-Y。黄，Z.-C。周，Y.-K。吴，Y.徐，Y.-F。 Pu，和L.-M。段量子网络和量子中继器代表了构建大规模量子信息系统的有前途的途径，可作为分布式量子计算、长距离量子通信和网络量子传感的基础设施。实现 fu 的关键一步......[物理。莱特牧师。 137, 020803] 2026 年 7 月 7 日星期二发布"
31e725630dfa60df,金字塔库仑团簇中对称控制的热激活：检验克莱默-兰格理论,"作者：Akhil Ayyadevara、Anand Prakash、Shovan Dutta、Arun Paramekanti 和 S. A. Rangwala 限制在电磁陷阱中的激光冷却离子提供了一个独特的、可调谐的介观系统，其中捕获势、非线性库仑相互作用和激光离子散射的相互作用产生了丰富的集体动力学。在这项工作中，我们设计了……[物理。莱特牧师。 137, 023002] 2026 年 7 月 7 日星期二发布"
f8c97be36f9c778c,通过光子时间晶体产生微波涡旋束激光,"作者：黄磊、张伟轩、邹德元、包嘉成、迪凤晓、秦浩宇、钱龙、孙厚军和张向东携带轨道角动量（OAM）的微波激光在大容量通信、精密传感和雷达成像等领域的高级应用中具有巨大的潜力。然而，传统的微波激射器方法无法通过嵌入式 OAM 产生发射。最近出现的……[物理。莱特牧师。 137, 023801] 发布时间 2026 年 7 月 7 日星期二"
60ce80ffbf8e5bd1,连续变量系统的非参数学习非高斯量子态,"作者：Liubov Markovich、Xiaoyu Liu 和 Jordi Tura 连续变量量子系统是量子计算、通信和传感的基础。虽然使用波函数或密度矩阵的传统表示通常是不切实际的，但量子力学的层析图像通过关联量子提供了一种可行的替代方案……[物理学。莱特牧师。 137, 020201] 发布时间 2026 年 7 月 7 日星期二"
d19a4935cbffeeac,系综瞬态密度泛函理论,"作者：Kimberly J. Daas、Steven Crisostomo 和 Kieron Burke 时间相关密度泛函理论 (TDDFT) 是计算分子和固体光学激发的标准方法，而系综 DFT (EDFT) 是正在开发的一种有前途的替代方法。我们引入了集成 TDDFT (ETDDFT)，这是一种将两者结合起来的实用理论，概括了 bo…[Phys.莱特牧师。 137, 028002] 2026 年 7 月 7 日星期二发布"
14b191a980f20011,利用电磁真空增强红外激光解离,"作者：Johan F. Triana 和 Felipe Herrera 控制键断裂是分子物理学的一个长期目标。目前正在开发红外纳米腔，以达到与一些分子的腔 QED 的奇异耦合机制，但目前尚不清楚化学反应如何在此类系统中进行。我们研究红外光……[物​​理。莱特牧师。 137, 028001] 2026 年 7 月 7 日星期二发布"
3eadf518f5e845f7,超临界-亚临界对应、不对称效应和临界点附近的反对称校正,"作者：李新阳和金玉良尽管液-气哈密顿量不存在 ${Z}_{2}$ 对称性，但伊辛模型和液-气系统中的二阶相变具有普适性类和临界指数。这种差异凸显了关键现象中的一个中心难题：不对称的影响是什么……[物理学。莱特牧师。 137, 027102] 2026 年 7 月 7 日星期二发布"
30a2d9e590f919f4,三维宽带宽量子能量截断太赫兹相干断层扫描,"作者：Pengfei Zhu、Hai Zhang、Stefano Sfarra、Fabrizio Sarasini、Xavier Maldague 和 Andreas Mandelis 我们报告了一种量子能量截断太赫兹相干断层扫描技术，该技术能够高度局部地提取分子物种特异性太赫兹响应。该方法利用发射器太赫兹能量与分子振动量子匹配时的共振光子损失。反射的太赫兹辐射是rec…[物理。莱特牧师。 137, 026901] 2026 年 7 月 7 日星期二发布"
65d9c260b96d4550,六方 ${\mathrm{LuFeO}}_{3}$ 薄膜二维极限的多铁性,"作者：Huilin Lai、Junyu Tan、Jinfeng Zhai、Yang Shi、Lili Feng、Huanyu Zhu、Chuanrui Hu、Chuhang Liu、Lijun Wu、Lifeng Yin、Hangwen Mao、Jun Chen、Xiaoshan Xu、Jun Zhu、Yimei Zhu、Shiqing Deng、Wenbin Wang 和 Ken Shen 多铁性氧化物具有共存的铁电序和磁序，对于理解相关量子现象至关重要。然而，当厚度接近二维 (2D) 极限时，铁电性和磁性通常会受到去极化的强烈抑制……[Phys.莱特牧师。 137, 026801] 发布时间 2026 年 7 月 7 日星期二"
b13aa2a152c970af,三角形反铁磁体中的几何自旋,"作者：格里戈尔·阿达米扬 (Grigor Adamyan)、巴斯蒂安·普拉德纳斯 (Bastián Pradenas)、鲍里斯·伊万诺夫 (Boris Ivanov) 和奥列格·切尔尼什约夫 (Oleg Tchernyshyov) 我们描述了一种几何现象，其中由简并戈德斯通模式组成的行波留下了转变的基态。在三角形海森堡反铁磁体中，圆偏振自旋波脉冲使自旋在其平面内旋转。非线性方程的精确解...[物理。莱特牧师。 137, 026704] 2026 年 7 月 7 日星期二发布"
6f7d8a1d8c1d2924,振荡磁场中的动态重入斯格明子相,"作者：Z. Demir Vatansever、E. Vatansever、A. Vasilopoulos、NG. Fytas 和 A. Berger 我们通过研究具有 Dzyaloshinskii-Moriya 相互作用的二维磁体在周期性振荡磁场下的非平衡响应，解决了驱动拓扑物质中的一个核心开放问题。使用广泛的蒙特卡罗模拟，我们发现了一个动态r…[Phys。莱特牧师。 137, 026703] 于 2026 年 7 月 7 日星期二发布"
59fe4f1aff3b235c,洛伦兹如何增强重塑弛豫谱,"作者：L. Gavassino 在相对论中，弛豫过程通常被认为在洛伦兹增强下经历时间膨胀。我们证明这种直觉通常是失败的。由于同时性的相对性，洛伦兹增强可以将单个弛豫模式分解为连续的激励模式，其宽度由最大值设置……[物理。莱特牧师。 137, 022301] 发布时间 2026 年 7 月 7 日星期二"
f291bf6058d72402,反馈 Ising 模型中的混合阶段,"作者：Yi-Ping Ma、Ivan Sudakow 和 P. L. Krapivsky 我们研究平均场 Ising 模型，其中耦合通过反馈函数取决于磁化强度。我们确定了混合相 (MP)，并证明它们可以在零温度下保持稳定，以获得足够强的反馈。此外，稳定的 MP 总是超稳定的，这意味着扰动会……[Phys。莱特牧师。 137, 027101] 2026 年 7 月 7 日星期二发布"
ef214f9631b0c177,等价 $p$ 波磁体的量子自旋模型,"作者：GiBaik Sim 和 Stephan Rachel$p$ 波磁体已成为一种新型磁性，在动量空间中表现出奇宇称、时间反转对称自旋分裂，并且作为自旋电子应用的有前途的平台引起了相当大的兴趣。然而，对基本机制的理论理解……[物理。莱特牧师。 137, 026503] 于 2026 年 7 月 7 日星期二发布"
339712815ea53cb1,模糊球上 3D 超共形伊辛临界值的出现,"作者：Yin Tang、Cristian Voinea、Liangdong Hu、Zlatko Papić 和 W. Zhu 超对称共形场论构成了量子场论的一个独特子集，为强耦合临界现象提供了强有力的见解。在这里，我们提出了三维 $\mathcal{N}=1$ 超共形伊辛临界点的微观和非微扰实现......[物理。莱特牧师。 137, 026502] 2026 年 7 月 7 日星期二发布"
6fa5d54f07c66470,准晶体中量子几何谱的层次结构：重正化群研究,"作者：王俊迪、陈宇晓和黄华清以量子度量和贝里曲率为特征的量子几何是理解量子材料中各种物理现象的强大框架，但其在非周期系统中的行为在很大程度上仍然未知。在这里，我们揭示了不同增强剂的通用机制……[物理。莱特牧师。 137, 026401] 发布时间 2026 年 7 月 7 日星期二"
9b2a9cc1b28b6dfb,Pb 中弱耦合超导性的压力驱动演化的热力学证据,"作者：Rustem Khasanov热力学临界场 ${B}_{\mathrm{c}}$ 提供了对超导凝聚能的直接访问，但其压力依赖性的研究远不如转变温度的广泛。在这里，热力学临界的μ子自旋旋转弛豫测量......[物理。莱特牧师。 137, 026002] 2026 年 7 月 7 日星期二发布"
7b38df2a5e49a6f6,单味金属中声子介导的延迟的超导性,"作者：Yang-Zhi Chou、Jihang Zhu、Jay D. Sau 和 Sankar Das Sarma 我们研究了具有可调贝里曲率的单味金属中的声子介导的配对。在没有贝里曲率的情况下，我们发现了一种意想不到的可能性：$p$波超导纯粹是由延迟效应产生的，而静态巴丁-库珀-施里弗（BCS）近似......[物理。莱特牧师。 137, 026001] 发布时间 2026 年 7 月 7 日星期二"
247e138b0c066b43,空心拉盖尔高斯激光器定向和准直电子加速的实验演示,"Author(s): Wenpeng Wang, Zhengxing lv, Fengyu Sun, Zhiyong Shi, Xiaoming Lu, Yi Xu, Jinfeng Li, Rongjie Xu, Zongxin Zhang, Jiayi Qian, Jiacheng Zhu, Xiaoyan Liang, Yuxin Leng, Ruxin Li, and Zhizhan XuWe report the first experimental demonstration of directional and collimated electron acceleration in the direct laser acceleration regime using a relativistic hollow Laguerre-Gaussian (LG) laser. Electrons are confined within the hollow field distribution along the reflected laser direction, produc…[Phys. Rev. Lett. 137, 025001] Published Tue Jul 07, 2026"
e41070621ca80c73,三维牛顿和聚合湍流中环流面积法则和双分形的实验观察,"作者：刘习然、陈鑫、彭胜宏、张一宝和席恒东 闭环周围的速度循环是湍流能量级联研究中关注的一个基本量。最近的理论和数值研究已将循环确定为一种几何可观察量，它通过面积规则和独特的……[物理。莱特牧师。 137, 024001] 2026 年 7 月 7 日星期二发布"
1870c772f71ea20a,光谱均匀连续可变量子微梳,"作者：Kangkang Li、Yue Wang、Ze Wang、Xin Zhou、Jin Cheng Li、Yinke Cheng、Binyan Wu、Qi Huang Kong、Bei-Bei Li 和 Qi-Fan Yang 在高 Q$ 微谐振器中生成的连续变量 (CV) 量子微梳为集成量子信息处理提供了紧凑的、频率复用的纠缠模式源。尽管确定性克尔诱导的双模压缩已在芯片上得到证明，但实现了均匀的…[物理。莱特牧师。 137, 023802] 发布时间 2026 年 7 月 7 日星期二"
2546a17161b87d20,弹性体老化,"作者：Ori Lev、Sagy Lachmann 和 Shmuel M. Rubinstein 弄皱的聚酯薄膜片在力和位移控制的条件下表现出对数松弛。我们进行了循环松弛实验，并揭示了一系列连续的力-位移曲线，这些曲线逐渐趋向平衡，以瞬时和完全松弛的极限为界。按基因...[物理。莱特牧师。 137, 028201] 2026 年 7 月 7 日星期二发布"
f5d559cad9c7b1e2,超空腔量子电动力学,"Author(s): Xueshi Li (李学诗), Ziwei Wang (王子维), Yan Chen (陈岩), Dong Liu ((刘栋), Kaili Xiong (熊凯莉), Guangfeng Wang (王光丰), Jiantao Ma (马剑涛), Ying Yu (喻颖), Jiawei Wang (王嘉威), Zhanling Wang (王占领), Xiao Li (李霄), Xianfeng Chen (陈险峰), Erez Hasman, Bo Wang (王波), Jin Liu (刘进), and Tian Jiang (江天)Cavity quantum electrodynamics (cQED) harnesses light-matter interactions to produce nonclassical light states. However, a fundamental challenge lies in simultaneously achieving Purcell enhancement and tailored wave front control within a single cavity, due to conflicting resonator requirements. Her…[Phys. Rev. Lett. 137, 023601] Published Tue Jul 07, 2026"
392527bb48740956,化学对称性破缺实现了交变磁态和补偿亚铁磁态之间的相互转换,"作者：赵波、刘勤西、杨秋平、邢建培、赵继军、刘峰和蒋雪异磁性和完全补偿亚铁磁性是不同类别的零净磁化序，将反铁磁补偿与类铁磁自旋分裂相结合。在交变磁体中，自旋分裂源于晶体对称性并在动量空间中交替，而在补偿......[物理。莱特牧师。 137, 026702] 发布时间 2026 年 7 月 7 日星期二"
cded79f3c7feb479,通过表位编辑进行非基因毒性移植和体内选择,"移植前基因毒性调节的短期和长期影响仍然阻碍造血干/祖细胞 (HSPC) 移植和基因治疗的更广泛应用1,2,3,4。尽管针对 KIT 的单克隆抗体已被提议作为化疗或放疗的替代方案5,6,7，但由于存在耗尽移植的 HSPC 的风险，其药代动力学阻碍了临床应用。在这里，为了解决这个问题，我们鉴定了 KIT 胞外域中的氨基酸变化，这些变化破坏了两种治疗性单克隆抗体8,9的结合，从而损害干细胞因子（SCF）介导的信号传导而不影响 KIT 表达或功能。我们利用腺嘌呤碱基编辑 10 或引物编辑 11 在 HSPC 中有效引入这些突变，并将其与 BCL11A 红细胞增强子的破坏相结合，以促进胎儿血红蛋白 (HbF) 的表达 12,13，这是一种治疗多种血红蛋白病的方法。该策略能够在体内共同选择基因工程细胞，以达到为镰状细胞病和β地中海贫血患者提供治疗益处所需的阈值。我们在体外和体内展示了 KIT 单克隆抗体在选择性压力下 KIT 加 BCL11A 多重编辑造血作用的逐步富集。我们报告说，根据慢病毒条形码文库的评估，抗 KIT 方案的延长治疗可实现优异的体内富集，同时避免克隆选择。最后，通过克服单克隆抗体药代动力学的局限性，e"
2caa76c1c154971f,I 类产甲烷菌中 8 MDa Hdr–Vhu–Fwd 超级组装的结构,产甲烷菌是全球碳循环的核心，也是甲烷（一种强效温室气体）的最大生物来源之一。它们能量代谢的核心是 Hdr–Vhu–Fwd 超级组件，它通过基于黄素的电子分叉将 H2 氧化与 CO2 还原耦合起来。在这里，我们展示了来自马里帕鲁迪斯甲烷球菌的 Hdr-Vhu-Fwd 超组装体的低温电子显微镜结构，揭示了一个包含 252 条多肽链和 600 多个氧化还原辅因子的 8 MDa 复合物。冷冻电子断层扫描进一步支持这种超级组装在完整细胞的细胞质内形成完整的结构。该结构由两个六聚体 HdrABC-Vhu 环组成，通过四聚体 FwdF 核心连接，形成连续的圆形电子链。在这种独特的排列中，12个多聚铁氧还蛋白亚基（VhuB）连接Vhu-Hdr和Fwd复合物，从而将电子分叉与CO2还原耦合起来，并直接连接产甲烷的最后一步和第一步。此外，我们还确定了该复合物的模块化变体，其中[NiFe]-氢化酶Vhu被含钨甲酸脱氢酶（FdhAB）取代，这表明电子输入模块的灵活整合有利于不同环境条件下的代谢适应2。分类分布分析表明，这种结构是 I 类产甲烷菌特有的，与 II3 类较小的 Hdr-Fmd 复合体不同。总之，我们的研究揭示了 Hdr-Vhu-Fwd 超级组件具有模块化且适应性强的生物能组件，这表明
046bfd407bb1aece,量子纠错的强化学习控制,"量子纠错 (QEC) 是保护量子计算机免受环境影响的主要策略1,2。 QEC 的先决条件是错误必须保持足够少，这需要不断调整计算机的控制参数以适应漂移的环境条件。目前解决这个问题的方法是终止整个量子计算进行重新校准，但这与未来量子算法的长运行时间不兼容3、4。在这里，我们通过将校准与计算相结合来解决这一挑战。我们赋予 QEC 过程 5,6,7,8,9,10,11 双重角色：它的错误检测事件不仅用于纠正逻辑量子状态，而且还被重新用作学习信号，教导强化学习代理 12,13,14,15,16 在计算过程中连续引导控制参数并稳定量子系统。我们在 Willow 超导处理器上通过实验演示了该框架，将表面代码针对注入漂移的逻辑稳定性提高了 3.5 倍。通过综合我们的全套技术进步，我们实现了表面和颜色代码的创纪录性能，每个周期的平均逻辑错误分别为 7.72(9) × 10−4 和 8.19(14) × 10−3。对具有数万个控制参数的大型代码的数值模拟证实了我们的 RL 框架的可扩展性，揭示了与系统规模无关的优化速度。因此，这项工作实现了一种新的范式：一种能够从错误中学习并且永不停止计算的量子计算机。"
1ae228248bd01284,大型语言模型可以预测社会科学实验的结果,"人们越来越关注大型语言模型 (LLM) 如何推动社会和行为科学1,2,3,4,5。之前的工作评估了法学硕士预测调查反应的能力6,7,8,9，但人们对他们是否能够预测社会科学实验的结果10知之甚少，特别是那些训练数据中没有的结果。在这里，我们建立了美国 70 个预先注册的、具有全国代表性的调查实验档案，涉及 469 个实验效果和 119,330 名参与者。我们促使法学硕士模拟美国个体的代表性样本对实验刺激的反应，然后通过比较不同条件下的模拟反应来推断治疗效果。 GPT-4 的训练数据截止时间早于我们档案中许多研究的发表，其预测与实际治疗效果密切相关，达到了与人类汇总预测相似的准确性。对于在模型训练数据截止日期之前未发表或公开发布的研究以及来自著名开放权重模型的预测，相关性仍然很高。尽管相关性很高，但预测系统地高估了效应大小。在包含 15 项大型研究（涉及 606 种效应）的二级档案中，相关性较低，但与汇总的专家预测者的相关性相当。为了评估对科学实践的影响，我们对 460 名社会科学家进行了调查，了解可能的用途和感知的风险，并利用我们的档案来评估多种应用（试点测试、干预选择、识别需要复制的效果）和风险（偏见、"
e8f81d2fd48d6dcb,古代与喂养相关的神经肽调节蚂蚁的异育,"异亲照料和劳动分工是昆虫社会的标志1。社会昆虫工蜂通常在幼年时在巢内照顾幼虫，并在年龄2、3、4、5岁时过渡到巢外觅食。这为研究养育和与年龄相关的行为变化的神经基础提供了一个强大的范例。尽管之前的工作已经探讨了这些动力学的各个方面6,7,8,9,10,11,12,13,14，但潜在的神经和分子机制仍然知之甚少。在这里，通过对神经肽进行无偏见的药理学筛选，我们发现两种祖先的摄食调节因子神经肽 F (NPF) 和尿抑素 A (AstA) 可调节克隆掠夺蚁的育雏行为。通过功能操作，我们发现 NPF 会增加育雏行为，而 AstA 则具有相反的效果。此外，我们发现大脑中 NPF 和 AstA 的水平随着蚂蚁年龄的增长而自然变化，这表明这些变化是与年龄相关的育雏行为变化的基础。最后，我们表明，与孤独物种15,16一样，NPF和AstA仍然对营养状态敏感，并且营养状态相应地影响育雏行为。我们的结果表明，进化具有增选的分子机制，可以调节祖先的进食，以实现合作性的育雏和与年龄相关的劳动分工。"
