stable_id,title_zh,abstract_zh
54e4a87a43b3815b,北太平洋融水削弱了大西洋经向翻转环流并为 Heinrich Stadial 1 奠定了先决条件,Heinrich Stadials 提供了有关大西洋经向翻转环流 (AMOC) 未来可能减弱的见解，但在这些时间间隔内驱动 AMOC 减弱的机制仍然难以捉摸。虽然海因里希·斯塔迪亚尔斯与北大西洋的冰山放电事件（即海因里希事件）有关，但已知 AMOC 减弱先于海因里希事件。在这里，我们进行了淡水冲洗实验，以表明同期东北太平洋冰山排放事件（即 Siku 事件）持续发生在 Heinrich Stadials 爆发时，可能会通过将淡水输送到北大西洋深水形成区域来引发 AMOC 减弱。这种最初的减弱随后可能会因北大西洋东北部和北部的地下逐步变暖而引起的英国和劳伦太德冰原的进一步融水释放而放大。我们的研究结果表明，Siku 事件可能在北大西洋海因里希事件的预处理中发挥了关键作用，强调了全球海洋-冰冻圈系统相互关联的性质。
141d774ae28e6fab,形态发生机械超材料：自组织结构中出现的张量特性,了解生物体如何自发地形成复杂的功能结构激发了工程设计的新策略。在这里，我们引入了一种基于形态发生的分散生成模型，可以自主生长具有受控张量属性的机械结构。通过各向异性扩散采用图灵的反应扩散概念，我们的方法能够局部出现表现出定制刚度和各向异性的微结构，无需伴随或拓扑优化循环即可实现目标正交各向异性张量。这些结构的合成依赖于将形态发生参数与通过均质化技术获得的有效弹性张量联系起来的数据库。我们通过机械隐身示例实验证明了这一概念，验证了我们的方法独立控制局部各向异性和刚度的能力，并有效隐藏机械场中的结构缺陷。这种方法规避了拓扑优化所需的迭代全局求解，同时保留了对跨大型设计域的各向异性和刚度的局部控制。
86de0c4f1542a0ee,基于耗散回音壁模式微腔传感器的亚十亿分之一二氧化碳检测,由于其超高的光学限制，回音壁模式微腔提供了强烈的光-物质相互作用，但微小的气体折射率变化限制了它们感测痕量气体的能力。在这里，我们展示了可以在非功能化回音壁模式微腔中使用耗散传感机制来检测气体吸收。我们的方法不是跟踪传统色散传感中使用的谐振频移，而是通过热诱导耗散将光学吸收转换为谐振深度的变化。在百万分之1.5至400的浓度范围内实现了二氧化碳的定量检测，相关系数超过0.99。该传感器在 400 秒的积分时间内达到了万亿分之 168 的检测极限，精度约为 0.4%。连续监测进一步证明了在环境条件下的稳定运行。这些结果表明耗散微腔传感是一种有前途的紧凑、低成本和高灵敏度痕量气体检测方法。
3dd339c65c5428df,通过电网现代化缓解能源贫困：中国特高压输电项目的微观证据,
6964abcac36a8105,数字孪生驱动的深度强化学习分布式储能集群协调调度与状态预测,
20118cdd93d3b0ef,剪接修饰化合物的特异性和外显子靶空间,剪接调节是一种既定的治疗策略，具有临床应用和靶向特定外显子以影响基因表达的潜力。小分子剪接修饰剂（例如 Risdiplam 和 Branaplam）会诱导包含通常由于较弱的 {5}^{{\prime} } 剪接位点而被跳过的外显子。 Risdiplam 优先在 {3}^{{\prime} } 外显子末端诱导具有 N−3G−2A−1 序列的外显子，而 Branaplam 则倾向于 A−3G−2A−1 结尾的外显子。然而，特异性的决定因素仍不清楚，因为许多基序匹配的外显子未被诱导。在这里，我们研究了剪接调节剂特异性的分子基础。使用生化测定、转录组分析和遗传扰动，我们确定了决定外显子对剪接调节剂诱导的反应性的序列依赖性特征。我们进一步证明，可以通过操纵 U1 snRNA 来重新编程特异性。这些发现完善了剪接调节剂靶空间的决定因素，并可能支持其他靶外显子和化合物的鉴定。
751022b6cde553c1,BZR1-BLH1-PIF4 反馈模块充当拟南芥中精确热形态发生的分子放大器,全球气温升高的强度和频率的增加正在威胁生态系统的稳定性和作物产量。了解植物热形态发生对于开发气候适应型作物至关重要，但其潜在机制仍有待阐明。在这里，我们将 BEL1-LIKE HOMEODOMAIN 转录因子 BLH1 确定为热形态发生的关键负调节因子，调节关键的BRASSINAZOLE-RESISTANT 1 (BZR1)-PHYTOCHROME INTERACTING FACTOR 4 (PIF4)热形态发生调节模块。 BLH1 或其同源物的过度表达会导致高温 (HT) 不敏感，而 blh 高阶突变体则表现出 HT 超敏性。 BLH1 表达受 BZR1 直接抑制，并受 HT 下调。我们进一步证明BLH1直接结合PIF4启动子以抑制其转录，同时与PIF4蛋白相互作用以抑制其活性。 BLH1 的过表达可挽救 bzr1-1D 或 PIF4 过表达植物中伸长的下胚轴表型。我们的研究结果定义了 BZR1-BLH1-PIF4 调节轴，该轴调节 BZR1-PIF4-生长素-BR-BZR1 正反馈环，确保对 HT 的平衡热形态发生反应。
8fd8cd59a1514002,CSF1R 调节单核细胞亚群分化和细胞内代谢,单核细胞是血管稳态、先天免疫和炎症的关键循环效应器。在小鼠骨髓中产生后，经典 (Ly6Chigh) 单核细胞被动员到血液循环中，在那里它们成熟为非经典 (Ly6Clow) 巡逻单核细胞，或者被招募到外周组织中，在那里它们分化为组织驻留或炎症巨噬细胞。单核细胞和巨噬细胞表达 CSF1R (CD115)，即谱系特异性生长因子 CSF1 和 IL-34 的受体。在这里，我们报告说，急性 CSF1R 阻断或基因缺失会负面干扰单核细胞的细胞内代谢，并部分通过削弱 Ly6Chigh 单核细胞的分化来减少血液 Ly6Clow 单核细胞。基于谷氨酰胺-果糖-6-磷酸转氨酶 1 (GFPT1) 的谱系特异性缺失，己糖胺生物合成途径 (HBP) 被确定为 CSF1R 表达和单核细胞亚群的重要调节因子。抑制受体酪氨酸激酶 CSF1R 和 FLT3 重新连接并部分损害人类单核细胞的代谢活动。我们的研究结果提供了对 CSF1R 信号传导、代谢调节以及单核细胞存活和分化之间联系的见解。
19b34f4afe3a1af6,非洲马瘟病毒 VP2 受体结合蛋白的冷冻电镜结构使纳米颗粒疫苗设计成为可能,非洲马瘟病毒（AHSV）是一种致命的马病原体，除了含有减毒病毒的疫苗外，没有获得许可的疫苗，存在安全风险。 AHSV 是撒哈拉以南非洲地区的流行病，已在西班牙、葡萄牙、塞浦路斯、摩洛哥、中东、印度和巴基斯坦以及最近的泰国引发动物流行。在这里，我们解析了 AHSV 血清型 4 的全长 VP2 的 3.11 Å 冷冻电镜结构，采用其天然的 triskelion 结构，并揭示了锚定 triskelion 核心的 α 螺旋结构域，这在其他结构特征的环状病毒中是不存在的。结构引导映射将 VP2 的一个子结构域确定为中和抗体的关键靶点。该结构域利用 SpyCatcher/SpyTag 技术显示在纳米颗粒上，为小鼠在病毒攻击感染后提供了针对临床疾病的完全保护，并在 AHSV 的目标物种马中引发了强大而持久的免疫反应。这些发现为下一代针对 AHSV 和相关环状病毒的重组疫苗提供了结构蓝图。
b31595dfdd2c9cda,通过谷氨酰胺拮抗作用重编程巨噬细胞免疫代谢可增强小鼠结直肠癌治疗,结直肠癌 (CRC) 通常表现出抑制性肿瘤微环境，该微环境与谷氨酰胺代谢升高和免疫抑制巨噬细胞的诱导有关。谷氨酰胺拮抗剂，如 6-重氮-5-氧代-L-正亮氨酸 (DON) 及其前药 JHU-083 可以限制肿瘤生长，但其毒性和免疫细胞选择性仍然不理想。在这里，我们将 DON 与巨噬细胞靶向部分青蒿酯结合，开发出 WGF-T17 (T17)，它可以阻断巨噬细胞中的谷氨酰胺代谢。在体外，T17 将巨噬细胞代谢重新连接至糖酵解，诱导乳酸积累和组蛋白乳酸化，增强线粒体裂变和吞噬细胞活性，从而将巨噬细胞重新编程为炎症状态。在体内，T17 通过巨噬细胞依赖性途径比 JHU-083 更好地控制肿瘤生长，并且还提高了携带皮下 CRC 肿瘤的雌性小鼠的免疫治疗、化疗和抗血管生成治疗的疗效。因此，我们的研究结果表明，T17 通过靶向巨噬细胞谷氨酰胺代谢来逆转免疫抑制，是一种有前途的 CRC 治疗策略。
97656c1f9a1c324c,靶向长读长测序能够全面分析遗传性肌病的遗传和表观遗传景观,导致遗传性肌病的遗传变异在类型、大小和序列背景上差异很大，包括小序列变异、大结构变异、重复扩增和更复杂的事件，例如导致面肩肱型肌营养不良的 D4Z4 大卫星收缩和低甲基化。使用下一代测序和其他旧的分子技术来表征其中许多都具有挑战性。为了解决这个问题，我们开发了一种有针对性的长读长测序分析和生物信息学分析框架，捕获目前与遗传性肌病有关的全套基因、变异和表观遗传特征。将其应用于一组肌病患者，我们证明了我们的方法的分析有效性以及与现有方法相比提高的准确性和分辨率。我们的检测对 35.5% (11/31) 的经过标准临床基因检测后仍未确诊的患者进行了新的基因诊断。该方法构成了遗传性肌病的全面遗传和表观遗传特征的单一简化测定。
12ebf8ec30e1c756,动态贝叶斯模型揭示灵长类动物前额叶-杏仁核网络中社交凝视的因果动力学,社交凝视是灵长类动物交​​流的基本渠道，可塑造动态互动并促进相互理解。虽然之前的研究已经绘制了前额叶-杏仁核回路中社交凝视的行为相关性，但这些相互作用的因果结构仍然知之甚少。在这里，我们开发了一种算法，将雄性猕猴独立记录的会话整合到“超级会话”中，并使用地面实况合成数据进行验证，从而能够重建与匹配的注视序列对齐的同时多区域记录。将动态贝叶斯网络分析应用于这些超级会话，我们揭示了杏仁核、眶额皮层、背内侧前额叶皮层（dmPFC）和前扣带皮层之间的时间结构、行为依赖的因果相互作用。当猕猴成为社交目光的目标时，大脑行为网络表现出正向时间调节，dmPFC 成为主要来源，杏仁核成为影响的主要接受者。当猕猴将目光转向它们的伴侣时，dmPFC 和杏仁核保留了各自的角色。前额叶区域相互正向调节，而杏仁核仅作为下游目标，接收专门负向调节的前额叶输入。这些发现揭示了灵长类动物社交大脑中以前未知的定向相互作用，并强调了社会注意力双向动态背后的独特因果结构。
7c2b2417fc21a372,具有时间动态调制功能的可编程记忆晶体管阵列，可实现高效的时间序列数据处理,基于硬件的油藏计算系统有望实现节能的时间序列数据处理。然而，它们在硬件级别上的不可调节时间动态限制了多尺度特征提取和计算能力。在这里，我们提出了一种可编程动态记忆晶体管，具有双功能门堆栈，可实现动态行为的硬件级控制，而无需持续偏置或输入预处理。该忆晶体管集成了用于易失性时间处理的电荷存储层和用于能带结构的非易失性调制的电荷陷阱层，从而实现了弛豫时间常数的 5 倍可调性。通过并行配置具有不同动态的存储器晶体管，我们实现了能够跨多个时间尺度处理信号的广泛存储计算系统。与单个储层基线相比，该架构将多个叠加振荡器预测任务的误差减少了 40 倍，并在预测混沌洛伦兹吸引子方面实现了与软件相当的精度。我们的结果建立了一个紧凑且节能的硬件平台，用于可扩展的宽储层计算实施。
3ca0ff7b6e020bb5,肿瘤-间质相互作用的下游信号传导调节粘液性结直肠腺癌顶端基底极性,粘液性结直肠癌（MUC CRC）转移至多个器官和腹膜，与不良预后相关。播散性 MUC CRC 表现出影响患者预后的传统（顶端向内）或反向（顶端向外）极性。因此，确定如何调节 MUC CRC 极性至关重要。在这里，我们分析了具有顶端向内或顶端向外极性的患者来源的 MUC CRC 异种移植物。单细胞分析表明 α2β1-整合素是这些模型中关键的胶原蛋白结合受体。胶原蛋白 - α2β1 - 整合素相互作用激活 Src 并上调 SorLA（一种内体分选受体）。 SorLA 通过促进整合素回收和 HER2/HER3 表达来支持顶端极性。我们观察到患者样本中的 HER2、HER3 和 SorLA 与心尖呈现组织中较高的 HER2 表达呈正相关。临床相关的 HER2/HER3 靶向抗体可恢复肿瘤球极性，并阻止胶原蛋白重塑和与小鼠腹膜的粘附。该 SorLA-整合素-HER2/HER3 轴可以代表 MUC CRC 患者分层方法，并且与具有顶端外表型的其他癌症相关。
0d378d59086f7e9e,脑萎缩、白质高信号和认知的联合轨迹量化大脑维护,大脑维护——与认知表现相关的大脑结构或功能的保存——仍然难以量化。在这里，我们提出了一个领域通用的大脑维护指数，该指数是通过对衰老相关萎缩（通过内侧颞叶与心室比率，MTLV比率）、白质高信号（WMH）和使用潜在生长曲线建模的临床前阿尔茨海默氏症认知复合物（PACC5）评估的整体认知的纵向共同进化进行联合建模而得出的。我们在 DELCODE 队列中的 543 名认知未受损的老年人中展示了它的实用性，并在四年内每年进行一次跟踪。我们发现 MTLV 比率和 WMH 的变化可以相加地预测认知变化。我们进一步表明，较高的神经质、抑郁症状、较低的开放性和较快的生物衰老与不利的特定领域轨迹和较差的大脑维护有关。我们的研究结果强调了 WMH 和衰老相关萎缩动力学对大脑维护的综合相关性。保持脑血管和心理健康以及认知参与可以促进大脑维护，延缓认知能力下降和痴呆。
17b6edaa880b0fed,metilene3：通过自动分类识别多种条件下的 DMR,DNA 甲基化是许多物种的关键表观遗传标记，识别差异甲基化区域 (DMR) 对于了解基因组调控至关重要。大多数现有的 DMR 检测方法需要预定义的样本条件，限制了新的表观遗传模式的发现，特别是当群体身份未知或不确定时，这在临床环境中很常见。此外，只有极少数方法可以跨多种条件进行比较。为了解决这一重大差距，我们提出了 metilene3，这是一种快速、多条件 DMR 检测的方法，可以在监督和无监督模式下运行，使用用户提供的标签或自动聚类未标记的样本。通过基于多个成对甲基化差异信号对基因组进行分段，metilene3 能够实现样本分类和表观遗传关系的 DMR 锚定推断。使用模拟和多样化的人类数据集，我们表明 metilene3 可以准确检测 DMR，稳健地对样本进行聚类，并具有揭示新的调控元件和样本分层的潜力。具体来说，在胰腺组织数据集中，metilene3 识别出富含参与胰腺癌发展的关键转录因子的 DMR，暗示 NFKB-NFAT 调控程序发生了改变。 metilene3 共同提供了一个快速、可解释的框架，用于探索异质甲基化组并发现复杂的生物和临床数据集中的表观遗传模式。
24e84144f3ec782e,ZNF689 缺失会损害同源重组，从而使三阴性乳腺癌对 PARP 和 PD-L1 联合抑制敏感,三阴性乳腺癌（TNBC）是乳腺癌中最具侵袭性的亚型，由于缺乏有效的靶向治疗，其特点是预后不良。虽然聚（ADP-核糖）聚合酶（PARP）抑制剂有利于 BRCA1/2 突变的 TNBC，但它们对 BRCA 野生型肿瘤的疗效仍然有限。在这项研究中，我们发现了锌指蛋白 689 (ZNF689) 在调节 TNBC 同源重组 (HR) 修复中的关键作用。我们的研究结果表明，响应 DNA 损伤，ZNF689 被 ATM 磷酸化，并通过 E3 连接酶 SKP2 促进 NBS1 泛素化，从而导致 MRN 复合物的稳定和随后的 ATM 激活，从而促进 HR 修复。 ZNF689 缺失显着增强了 TNBC 对 PARP 抑制剂的敏感性，特别是与紫杉醇联合使用时。此外，PARP 抑制可通过激活 STING 通路上调 ZNF689 缺陷的 TNBC 细胞中的 PD-L1 表达。值得注意的是，ZNF689 缺失增强了 PARP 抑制加抗 PD-L1 免疫疗法的治疗效果。总之，这些发现表明 ZNF689 是 HR 修复的关键调节因子，并为 ZNF689 低 TNBC 患者结合 PARP 抑制和 PD-L1 阻断提供了概念验证。
4bfc85583bf83f5b,快速和慢速时间尺度的视觉学习是由灵长类动物颞下皮层的独特可塑性规则驱动的,我们学习识别大量熟悉的物体，这个过程涉及颞下皮层（IT）活动中与学习相关的变化。发现熟悉性学习机制的一个挑战是，它跨越从几分钟到几天的多个时间尺度，并且伴随着细胞、突触和网络属性的同时变化。我们利用综合实验理论方法，使用两只雄性猕猴在会话内和会话间熟悉度学习期间的 IT 记录来推断潜在的可塑性机制。我们确定了与学习相关的变化的两个时间尺度，从几分钟到几天，与不同的突触和细胞机制一致。在整个会话中，平均反应随着熟悉程度逐渐下降，这与突触可塑性一致。相反，会话内的变化，包括快速响应衰减和自发活动增加，与内在的可塑性机制相一致。赋予从实验中推断出的学习规则的循环网络复制了观察到的学习动态，支持了我们对不同学习机制的假设——长时间尺度上的缓慢的突触可塑性和短时间尺度上的快速的内在可塑性。
7463930621547f8b,利用深度学习模型对顺式调控代码和核小体组织进行位置解释,序列到功能神经网络学习驱动多种类型基因组数据的顺式调控序列规则。解释这些模型以将序列规则与潜在的生物过程联系起来仍然具有挑战性，特别是对于复杂的基因组读数，例如 MNase-seq，它映射核小体占据，但受到实验偏差的混淆。在这里，我们引入了序列归因的成对影响（PISA），它使用归因来组合解码哪些碱基对特定基因组坐标的读数有贡献。 PISA 可视化转录因子基序的影响，检测具有复杂贡献模式的未被发现的基序，并揭示实验偏差。通过了解 MNase-seq 的偏差，PISA 实现了前所未有的核小体预测模型。这些模型允许从头发现核小体定位基序，并通过系统基序扰动揭示 Micro-C 染色质结构域边界的基础。最后，这些模型允许设计具有改变的核小体配置的序列。这些结果表明，PISA 是一种多功能工具，可以扩展我们在基因组数据上训练和解释序列功能神经网络并理解底层顺式调控代码的能力。
c97a387a3923c09e,物种分布对气候变化的生态进化反应,物种海拔变化是对气候变化的有据可查的反应，许多物种向上坡移动以追踪合适的条件。然而，这些变化在方向和速率上都有很大差异，而且这种变化的根本原因尚不清楚。本研究通过分析全球 845 个动植物物种记录中成对的下缘和上缘变化，探讨了海拔变化如何取决于地理区域以及物种的气候生态位、全球流行率和进化历史。我们发现这些驱动因素对分配上限和分配下限有明显的影响。热带物种的下缘向上移动速度比温带物种更快。具有更温暖和更湿润的最佳气候生态位的物种表现出更快的上边缘变化，而那些只有更湿润的气候生态位的物种则表现出更快的下边缘变化。全球流行的物种通过将较快的上缘进步与较慢的下缘收缩相结合，随着气候变化扩大了它们的分布，这可能反映了它们对干燥气候的适应。重要的是，这些生态效应与系统发育效应基本重叠，而系统发育保守主义独立解释了海拔反应变化的显着部分。这些发现凸显了进化历史和生态过程在影响物种气候反应方面的复杂性，并强调了某些物种由于其进化惯性而面临的气候脆弱性。
84d3584e4f66d680,一种基于似然性的尖峰序列重放识别方法,海马体重放（位置细胞的顺序重新激活）与记忆回忆、巩固和规划有关，但传统分析依赖于空间调谐并排除非位置细胞，从而限制了其范围。没有空间模板的基于模型的分析通常依赖于预定义的参数和约束模式定义，这使得它们对参数敏感并且可能存在偏差。为了解决这些限制，我们开发了一种分析方法，根据在主动行为期间观察到的成对发射顺序概率来估计尖峰序列的可能性，而不管它们的行为相关性如何。我们使用模拟、大鼠单单元记录和小鼠钙成像验证了该方法，显示出与传统重放指标的强烈一致性和广泛的适用性。当应用于被动观看自然电影刺激的头部固定小鼠时，该方法在海马体和视觉皮层中检测到显着的重放，证明了其在揭示跨大脑区域和感觉域的结构化重放方面的实用性。
eb49b5fcc563887b,谷氨酸信号是儿童数学和阅读能力的大脑结构组织的基础,儿童数学和阅读能力个体差异背后的神经化学机制仍然很大程度上未知。在这里，我们研究了两个独立儿童群体（N = 991）中神经递质系统如何与支持这些能力的大脑结构组织相关。我们将与学习成绩相关的全脑结构表型映射到包含 19 种神经递质受体和转运蛋白的综合 PET 图谱上。在这两个领域和队列中，NMDA 谷氨酸受体分布显示出与支持学术能力的大脑结构组织最一致的关联（数学的复制贝叶斯因子 >9e4；阅读的复制贝叶斯因子 >4）。 NMDA 受体密度与数学能力的多个功能网络相对应，但在阅读的视觉网络中显示出更多的空间集中关联，表明共享的和特定领域的神经化学机制。多巴胺能、胆碱能、血清素能和 GABA 能系统表现出较弱、不可复制的关联。这些发现将分子神经化学和支持学术技能的宏观大脑结构联系起来，将谷氨酸信号确定为解决学习障碍干预措施的候选目标。
b85f9e1ca6bb185f,前岛叶高伽玛活动的闭环读数可引导基于价值的决策,决策领域长期以来一直试图了解人类选择变异性的起源。变异性的潜在来源在于正在进行的神经活动的自发波动，这可能会影响多个认知领域的行为。在这里，我们开发了一种闭环颅内脑机接口，可检测宽带伽玛活动（BGA，70-150 Hz）的瞬态波动，以触发取决于高或低神经状态的刺激呈现。使用这种方法，我们研究了前岛叶的自发活动如何影响接受/拒绝决策，涉及结合愉快和不愉快成分的多属性提议。前岛叶高 BGA 之前的提议与前岛叶活动的短暂提议后抑制相关，这使得在假设的多属性选择中倾向于接受不愉快的项目以换取愉快的项目。这些发现表明，亚秒内源性神经波动直接调节选择行为，通过强调内在大脑状态在塑造决策可变性中的关键作用，对当前的神经计算模型提出了挑战。
ce5d9e8740dd46e0,BRCA1-A 复合物限制 ATM 缺陷细胞中复制叉逆转依赖性 DNA 修复,共济失调毛细血管扩张突变 (ATM) 激酶缺陷会导致癌症易感性和药物过敏。 BRCA1 相互作用 A 复合物或 XRCC4/连接酶 4 的缺陷会导致 ATM 缺陷细胞对拓扑异构酶 I 或 PARP1 抑制剂产生耐药性。这表明 BRCA1-A 通过非法末端连接对 ATM 突变细胞中的叉损伤剂产生毒性。在这里，我们表明，ATM 抑制会触发 SUMO 和泛素介导的 BRCA1-A 受损叉识别相结合，以限制末端切除并引起拓扑异构酶 I 抑制剂超敏反应。 BRCA1-A 缺陷细胞在受损叉处显示出更高的染色质可及性和核酸酶活性，同时恢复了切除和耐药性。电子显微镜证据表明，ATM 抑制可防止复制叉逆转，而 BRCA1-A 丢失可恢复复制叉逆转，从而生成用于末端切除的底物。这些发现表明，BRCA1-A 强制限制性染色质状态来抑制切除底物的发生，表明叉逆转是 ATM 缺陷细胞化疗反应的关键决定因素。
70395aeede38665f,外源间充质通过间充质到上皮的转变有助于表皮干细胞的形成,皮肤发育是由非神经外胚层上皮和下面的间充质细胞之间的串扰启动的。最近的研究表明，一些间充质细胞有助于受损皮肤角质形成细胞的再生。然而，间充质细胞是否有助于生理正常皮肤中角质形成细胞的形成仍不清楚。在这里，我们利用小鼠皮肤的谱系追踪、单细胞转录组和表观基因组分析表明，滤泡间表皮主要由间充质谱系细胞组成。对小鼠胚胎的进一步谱系追踪和实时成像分析表明，这些间充质谱系表皮祖细胞源自外胚层，并通过胚胎第 8.5 天和第 9.5 天之间的间充质到上皮过渡样过程，形成表面外胚层。我们还建立了人类诱导多能干细胞来源的外胚充质，并证明它能产生表达 p63 的角质形成细胞。这些数据揭示了外间充质对皮肤发育的先前未被认识到的贡献，并为涉及表皮嵌合的皮肤疾病提供了见解。
